date,username,to,replies,retweets,favorites,text,geo,mentions,hashtags,id,permalink
2015-12-05 15:27:43,Tobby007bond,,0,0,0,"RT __arsenalnews_ ""Leicester City are absolutely smashing it this season!""",,,,673161839354753024,https://twitter.com/Tobby007bond/status/673161839354753024
2015-12-05 15:27:40,WorlanyoDesmond,,0,0,0,"Leicester city are performing magic now",,,,673161824943144960,https://twitter.com/WorlanyoDesmond/status/673161824943144960
2015-12-05 15:27:39,nirasol1969,,0,0,0,"When you are a club with minimal expectations, it can work in your favour at times. Play with freedom #LeicesterCity",,,#LeicesterCity,673161820346130432,https://twitter.com/nirasol1969/status/673161820346130432
2015-12-05 15:27:37,wakhungueugene,,0,0,0,"Leicester city Premier League so far https://twitter.com/TrollFootball/status/672861731929108480/photo/1pic.twitter.com/YSEEoqlfnK """,,,,673161812565753856,https://twitter.com/wakhungueugene/status/673161812565753856
2015-12-05 15:27:37,FemiCoolfm,,0,1,0,"Leicester City have now scored 31 goals in the Premier League this season",,,,673161811450023936,https://twitter.com/FemiCoolfm/status/673161811450023936
2015-12-05 15:27:35,MarcoChana,,0,0,0,"Leicester City mean biniz",,,,673161803149524992,https://twitter.com/MarcoChana/status/673161803149524992
2015-12-05 15:27:30,MehdiAHG,,0,0,0,"Unreal Leicester City! Unreal!",,,,673161783763460097,https://twitter.com/MehdiAHG/status/673161783763460097
2015-12-05 15:27:27,Owen_Bart,,0,0,0,"Leicester City don't show no signs of letting up! #LCFC",,,#LCFC,673161768743628800,https://twitter.com/Owen_Bart/status/673161768743628800
2015-12-05 15:27:23,SenseSoccer,,1,0,0,"Leicester City's title to lose. #SWALEI",,,#SWALEI,673161752553652224,https://twitter.com/SenseSoccer/status/673161752553652224
2015-12-05 15:27:18,Din_Cheng,,0,0,0,"Power r Leicester City!!!!!!!!",,,,673161730873122816,https://twitter.com/Din_Cheng/status/673161730873122816
2015-12-05 15:27:16,AouadiRayane,,0,0,0,"""Rhyad Mahrez Second GOAL - Swensea vs Leicester City 0-2 (EPL 2015) HD"" : http://youtu.be/We3eGXZF5j4?a via @YouTube",,@YouTube,,673161722425946112,https://twitter.com/AouadiRayane/status/673161722425946112
2015-12-05 15:27:15,RyDrury_11,,0,0,0,"Really hope Leicester keep this up ! Great advert for football! #leicestercity",,,#leicestercity,673161720794374144,https://twitter.com/RyDrury_11/status/673161720794374144
2015-12-05 15:27:13,Athaya_Zahra29,,0,0,0,"Ooooh my gosshhhhhh Leicester City on fire! Swansea are you ok?",,,,673161710413328384,https://twitter.com/Athaya_Zahra29/status/673161710413328384
2015-12-05 15:27:12,Siya90,,0,0,0,"Leicester City",,,,673161706093309952,https://twitter.com/Siya90/status/673161706093309952
2015-12-05 15:27:05,Edugicheri,,0,0,0,"Eish Leicester city ffs..",,,,673161679354642432,https://twitter.com/Edugicheri/status/673161679354642432
2015-12-05 15:27:04,fils101,,0,0,0,"The Tinkerman is doing a good job at Leicester city hope he can keep a healthy squad for Xmas games",,,,673161675340718080,https://twitter.com/fils101/status/673161675340718080
2015-12-05 15:27:04,wakhungueugene,,0,0,0,"Leicester City....... Class Toping the Epl table",,,,673161675156144128,https://twitter.com/wakhungueugene/status/673161675156144128
2015-12-05 15:27:02,Toluwaniyin,,0,1,0,"Leicester City isn't joking this season",,,,673161664632590339,https://twitter.com/Toluwaniyin/status/673161664632590339
2015-12-05 15:27:00,Mista_Bammy,,0,0,0,"Leicester City....Nice goal",,,,673161656902541312,https://twitter.com/Mista_Bammy/status/673161656902541312
2015-12-05 15:26:54,seungore,,0,8,1,"Leicester City is Definitely Going To Play European Football Next Season",,,,673161632932085760,https://twitter.com/seungore/status/673161632932085760
2015-12-05 15:26:50,JADWAL_HKLPI,,0,1,0,"Gol Swansea City 0-2 Leicester City (Mahrez 22) #SWALEI",,,#SWALEI,673161616838533121,https://twitter.com/JADWAL_HKLPI/status/673161616838533121
2015-12-05 15:26:43,Mrg37EvM,,0,0,0,"I really Hope Leicester city can keep it up and continue to win",,,,673161585121222656,https://twitter.com/Mrg37EvM/status/673161585121222656
2015-12-05 15:26:39,ice_kofi,,0,0,1,"Leicester City on form this season.they lead Swansea by 2goals..",,,,673161568935419904,https://twitter.com/ice_kofi/status/673161568935419904
2015-12-05 15:26:35,Ade_vuitt,,0,0,0,"Leicester city...... wow in chigul's voice",,,,673161551084392449,https://twitter.com/Ade_vuitt/status/673161551084392449
2015-12-05 15:26:33,kasembeli_afc,,0,0,0,"Swansea city 0-2 Leicester city Mahrez with a double, now he has scored 9 goals and assisted 6",,,,673161543656349697,https://twitter.com/kasembeli_afc/status/673161543656349697
2015-12-05 15:26:31,dah_optimist,,0,0,1,"So Leicester city a lead 2-0 and we almost concede 2 goals",,,,673161537297649664,https://twitter.com/dah_optimist/status/673161537297649664
2015-12-05 15:26:30,dereemus,,0,0,0,"Leicester City. Premier League front runners. This is like the unexpected lead of Donald Trump",,,,673161531614367744,https://twitter.com/dereemus/status/673161531614367744
2015-12-05 15:26:29,FouadAFC,,0,6,5,"Leicester City are on fire",,,,673161529278136320,https://twitter.com/FouadAFC/status/673161529278136320
2015-12-05 15:26:29,SBOBET,,0,2,4,"SCORE UPDATE: Swansea 0-2 Leicester City. Goal by Riyiad Mahrez (23'). #LCFC #SwaLei https://vine.co/v/i7a2I29OE9q",,,#LCFC #SwaLei,673161525419347973,https://twitter.com/SBOBET/status/673161525419347973
2015-12-05 15:26:26,alexanderOG,,0,0,0,"Leicester City defo going top. Its December not August. Fair play to Leicester!",,,,673161516036804608,https://twitter.com/alexanderOG/status/673161516036804608
2015-12-05 15:26:26,CP30___,,0,0,0,"Leicester City",,,,673161513209864193,https://twitter.com/CP30___/status/673161513209864193
2015-12-05 15:26:25,mariecsutton,BBCMOTD,0,0,1,"@BBCMOTD @BBCSport top of the league.. We're Leicester city we're top of the league!",,@BBCMOTD @BBCSport,,673161509862834176,https://twitter.com/mariecsutton/status/673161509862834176
2015-12-05 15:26:25,ghostlypipo,,0,0,0,"Who is going to stop Leicester city? Swansea 0-2 Leicester",,,,673161509342695424,https://twitter.com/ghostlypipo/status/673161509342695424
2015-12-05 15:26:23,MuhammadArslan3,,0,0,0,"Leicester city on fire!",,,,673161504095666176,https://twitter.com/MuhammadArslan3/status/673161504095666176
2015-12-05 15:26:23,Hamza_A11,,0,0,0,"I'm a leicester CITY fan",,,,673161502950576129,https://twitter.com/Hamza_A11/status/673161502950576129
2015-12-05 15:26:23,_LeKido_,,0,0,0,"Two players from Leicester City are chasing the Golden Boot Two Mahrez 9 goals Vardy 13 Goals",,,,673161502103379968,https://twitter.com/_LeKido_/status/673161502103379968
2015-12-05 15:26:22,hafizsouzaaa,,0,0,0,"Leicester City for the EPL title.",,,,673161497590153217,https://twitter.com/hafizsouzaaa/status/673161497590153217
2015-12-05 15:26:20,FootballVideos,,4,64,61,"Leicester City are absolutely smashing it this season!",,,,673161488660566017,https://twitter.com/FootballVideos/status/673161488660566017
2015-12-05 15:26:11,BjaybreezyXq,,0,0,0,"Leicester city",,,,673161453084483584,https://twitter.com/BjaybreezyXq/status/673161453084483584
2015-12-05 15:26:06,officialphrehd,,0,0,0,"Leicester City",,,,673161429948751872,https://twitter.com/officialphrehd/status/673161429948751872
2015-12-05 15:26:05,blvz_,,0,0,1,"Leicester City que time",,,,673161427646066689,https://twitter.com/blvz_/status/673161427646066689
2015-12-05 15:26:04,adigies,,0,0,0,"Leicester city a just too good at the moment @LCFC keep it up",,@LCFC,,673161423690842112,https://twitter.com/adigies/status/673161423690842112
2015-12-05 15:26:00,EdweenStevens,,0,0,0,"Whats happening to Leicester City ? Whats the magic ?",,,,673161407236612096,https://twitter.com/EdweenStevens/status/673161407236612096
2015-12-05 15:26:00,ActionPlusSport,,0,0,1,"Leicester celebrate goal Barclays Premier League Swansea City v Leicester City Dec 5th http://bit.ly/1TKSWlr pic.twitter.com/jnQTI1TBJC",,,,673161406938656768,https://twitter.com/ActionPlusSport/status/673161406938656768
2015-12-05 15:25:59,Bodders6,,2,0,5,"Can't wrap my head around Leicester city this season",,,,673161399871348737,https://twitter.com/Bodders6/status/673161399871348737
2015-12-05 15:25:58,josh_winterton,,0,0,0,"I love Leicester City",,,,673161397862277120,https://twitter.com/josh_winterton/status/673161397862277120
2015-12-05 15:25:56,themendebeast,,0,0,0,"leicester city is the beast tonight",,,,673161387368038410,https://twitter.com/themendebeast/status/673161387368038410
2015-12-05 15:25:52,iTzDa_Luck,,0,0,0,"Leicester city oh my. I am impressed",,,,673161373405347841,https://twitter.com/iTzDa_Luck/status/673161373405347841
2015-12-05 15:25:51,lcfc12,,0,0,1,"Swansea City vs Leicester City 0-2. 23' Riyad Mahrez scores for Leicester City! Assist: Ngolo Kante #LCFC",,,#LCFC,673161367424212994,https://twitter.com/lcfc12/status/673161367424212994
2015-12-05 15:25:48,riverabyron10,,0,0,2,"Leicester city already 2-0 and Man U still haven't scored",,,,673161357223723008,https://twitter.com/riverabyron10/status/673161357223723008
2015-12-05 15:25:48,iam_NY,,0,0,0,"Leicester City",,,,673161354967179264,https://twitter.com/iam_NY/status/673161354967179264
2015-12-05 15:25:47,AjayShafiq,,0,0,0,"Damn Leicester City ._.",,,,673161353050263552,https://twitter.com/AjayShafiq/status/673161353050263552
2015-12-05 15:25:47,HotSportsng,,0,0,0,"Guess who's top of the table? It's not Man city or Man Utd or Arsenal or Chelsea. Yes u guessed right LEICESTER CITY. Kudos Ranieri #BPL",,,#BPL,673161349099335680,https://twitter.com/HotSportsng/status/673161349099335680
2015-12-05 15:25:46,Sleaze_Jay,,0,0,0,"Leicester City are top of the league in December! Is this real life?",,,,673161347832614913,https://twitter.com/Sleaze_Jay/status/673161347832614913
2015-12-05 15:25:46,_Karimi_,,0,0,0,"Leicester City Football Club on fire!! Two up.",,,,673161346414993408,https://twitter.com/_Karimi_/status/673161346414993408
2015-12-05 15:25:43,Soccermasterseu,,0,0,0,"#PremierLeague: OFFENSE!! Leicester City A yellow card in the 24th minute for Ngolo Kante. #swalei http://soccermasters.eu/f/71558",,,#PremierLeague #swalei,673161333861457920,https://twitter.com/Soccermasterseu/status/673161333861457920
2015-12-05 15:25:43,abamure,,0,0,0,"Leicester City is so consistent.",,,,673161333630754816,https://twitter.com/abamure/status/673161333630754816
2015-12-05 15:25:42,medianyce,,0,2,0,"Leicester City's @Mahrez22 bags his second for the evening at Liberty Stadium #TheDugOutpic.twitter.com/MrO5buQdMV",,@Mahrez22,#TheDugOutpic,673161329201418241,https://twitter.com/medianyce/status/673161329201418241
2015-12-05 15:25:42,SMashifane,,0,0,0,"Leicester city #ssfootball best team to watch #EPL",,,#ssfootball #EPL,673161328413011968,https://twitter.com/SMashifane/status/673161328413011968
2015-12-05 15:25:39,sejatopaledi,,0,0,0,"Just wonder how long will Leicester City keep up with their form",,,,673161317642076161,https://twitter.com/sejatopaledi/status/673161317642076161
2015-12-05 15:25:35,dhillon_kabir,,0,0,2,"Leicester City, what a bloody team",,,,673161300260741120,https://twitter.com/dhillon_kabir/status/673161300260741120
2015-12-05 15:25:34,Faelis3,,0,0,0,"Leicester city",,,,673161298235011072,https://twitter.com/Faelis3/status/673161298235011072
2015-12-05 15:25:33,KpanshMasta,,0,0,0,"Leicester City is on",,,,673161290492289024,https://twitter.com/KpanshMasta/status/673161290492289024
2015-12-05 15:25:32,Yeeeeee_,,0,0,0,"Oboy Leicester city wn carry league ? rush rush 2:0 for Swansea house oh",,,,673161287338237952,https://twitter.com/Yeeeeee_/status/673161287338237952
2015-12-05 15:25:31,MhlabaneEnos,,0,0,0,"The unstoppable Leicester City @LCFC",,@LCFC,,673161283433316353,https://twitter.com/MhlabaneEnos/status/673161283433316353
2015-12-05 15:25:26,ExpatTennisFan,,0,0,0,"Breaking News: Leicester City are 2-0 up at Swansea and Vardy HASN'T scored (yet).",,,,673161264143589376,https://twitter.com/ExpatTennisFan/status/673161264143589376
2015-12-05 15:25:26,Squawka,,4,286,120,"Leicester City have now scored 31 goals in the Premier League this season, more than any other side. Yep. pic.twitter.com/TB2dtr16PI",,,,673161263258730496,https://twitter.com/Squawka/status/673161263258730496
2015-12-05 15:25:26,roro__cule,,0,1,1,"bruh Leicester City need to chilll",,,,673161262075916288,https://twitter.com/roro__cule/status/673161262075916288
2015-12-05 15:25:21,Kenickilive,,0,0,0,"Leicester city is just unstoppable this season! Fun to watch",,,,673161243365085184,https://twitter.com/Kenickilive/status/673161243365085184
2015-12-05 15:25:20,AndrewDindial_,,0,0,1,"Imagine if Leicester City win the league hmmm",,,,673161236465369088,https://twitter.com/AndrewDindial_/status/673161236465369088
2015-12-05 15:25:19,Mazi_Uchenna,,0,0,0,"Leicester city shaaa",,,,673161232749371392,https://twitter.com/Mazi_Uchenna/status/673161232749371392
2015-12-05 15:25:19,chichi__o,,0,0,0,"Leicester City not playing games",,,,673161232543825920,https://twitter.com/chichi__o/status/673161232543825920
2015-12-05 15:25:18,cfcrupes,,0,0,0,"Leicester City",,,,673161228575891456,https://twitter.com/cfcrupes/status/673161228575891456
2015-12-05 15:25:17,verndog82,,0,0,0,"Leicester City making the premier league look easy one again",,,,673161226499850240,https://twitter.com/verndog82/status/673161226499850240
2015-12-05 15:25:17,StuffRidaSays,,0,0,0,"Riyadh Mahrez is at the heart of everything good at #leicestercity",,,#leicestercity,673161224687718401,https://twitter.com/StuffRidaSays/status/673161224687718401
2015-12-05 15:25:16,OnifadeDapo,,0,0,0,"Leicester city are on fire dis season hope dey can continue till d end of d season",,,,673161219579256832,https://twitter.com/OnifadeDapo/status/673161219579256832
2015-12-05 15:25:11,kuba_karpinski,LCFC,0,0,0,"Is there a person in this world not celebrating Leicester City's goal? Especially Vardy's or Mahrez's. https://twitter.com/LCFC/status/673156116809912320 …",,,,673161201254277122,https://twitter.com/kuba_karpinski/status/673161201254277122
2015-12-05 15:25:09,seloro17,,0,0,1,"Swansea 0-2 Leicester City LOOOOOOOOOOOL",,,,673161192840568836,https://twitter.com/seloro17/status/673161192840568836
2015-12-05 15:25:08,d_problemsolver,,1,2,0,"GOAL!!! 2nd goal for #leicestercity swansea 0-2 #Leicester #footballliveng",,,#leicestercity #Leicester #footballliveng,673161188625248256,https://twitter.com/d_problemsolver/status/673161188625248256
2015-12-05 15:25:07,Jaytex_songz,,0,0,0,"Wait..... This Leicester City hope there is nothing wrong shaa..... Kill anybody",,,,673161184158334976,https://twitter.com/Jaytex_songz/status/673161184158334976
2015-12-05 15:25:07,NzRv,,0,0,0,"It's a strange EPL season when Leicester City leads the table while the year end approaches.",,,,673161183675809792,https://twitter.com/NzRv/status/673161183675809792
2015-12-05 15:25:07,Leicester_Stall,,0,0,0,"Leicester City F.C. Silver Plated Crest Ring Small http://bit.ly/1K4NbMU Run by Fans for Fans! Please re-tweetpic.twitter.com/CDenNw1zNZ",,,,673161181327196161,https://twitter.com/Leicester_Stall/status/673161181327196161
2015-12-05 15:25:06,bodmannet,,0,0,0,"#IG: bodezkul LIVE: Swansea vs Leicester City http://dlvr.it/Cwlk09",,,#IG,673161179947130881,https://twitter.com/bodmannet/status/673161179947130881
2015-12-05 15:25:06,techguy1016,,0,0,0,"I need Leicester city babalawo's number.",,,,673161178328248320,https://twitter.com/techguy1016/status/673161178328248320
2015-12-05 15:25:05,deejayfaremi,,0,2,1,"Leicester City are going on top of the PL table. Never though I would write that with 15 games played.",,,,673161177048948736,https://twitter.com/deejayfaremi/status/673161177048948736
2015-12-05 15:25:03,SportsJournalNG,,0,0,0,"LIVE: Swansea vs Leicester City http://dlvr.it/Cwlr6M",,,,673161167259328513,https://twitter.com/SportsJournalNG/status/673161167259328513
2015-12-05 15:25:03,Oduscoly,,0,0,0,"LIVE: Swansea vs Leicester City http://dlvr.it/Cwllzr",,,,673161167112527872,https://twitter.com/Oduscoly/status/673161167112527872
2015-12-05 15:25:03,Dejexkul,,0,0,0,"LIVE: Swansea vs Leicester City http://dlvr.it/CwlnVn",,,,673161167074791424,https://twitter.com/Dejexkul/status/673161167074791424
2015-12-05 15:25:02,hirvin03,,0,0,0,"Leicester City BPL Champions",,,,673161162318585857,https://twitter.com/hirvin03/status/673161162318585857
2015-12-05 15:25:01,tope414,,0,0,0,"Leicester city leading 2 nil away from home . You have to pay attention. Some unreal things going on in that club.",,,,673161157918724096,https://twitter.com/tope414/status/673161157918724096
2015-12-05 15:25:00,IamDoxel,,0,0,1,"Leicester City is just too good this season",,,,673161155070828544,https://twitter.com/IamDoxel/status/673161155070828544
2015-12-05 15:24:59,Billy_Turnbull,,0,0,0,"We are all Leicester City fans now! LOL",,,,673161148770861058,https://twitter.com/Billy_Turnbull/status/673161148770861058
2015-12-05 15:24:58,MyStickyTruth,,0,0,0,"We really have missed such a good opportunity this year. Leicester City are top after 15 games ffs",,,,673161147399434240,https://twitter.com/MyStickyTruth/status/673161147399434240
2015-12-05 15:24:58,FaneleMbuyazi8,,0,0,0,"Leicester City...",,,,673161147252670465,https://twitter.com/FaneleMbuyazi8/status/673161147252670465
2015-12-05 15:24:58,bernard_gooner,,0,6,4,"Remember Blackburn in 94/95 season? Leicester City is reenacting it",,,,673161144794636288,https://twitter.com/bernard_gooner/status/673161144794636288
2015-12-05 15:24:56,Pascalville,,0,0,1,"Leicester City going up lol",,,,673161139224727553,https://twitter.com/Pascalville/status/673161139224727553
2015-12-05 15:24:52,SMLeicester,,0,0,0,"GOAL! Swansea City 0-2 Leicester City (Riyad Mahrez, 22'). Join us live: http://sm.mg/z5brkwx #swans #lcfc",,,#swans #lcfc,673161119930949632,https://twitter.com/SMLeicester/status/673161119930949632
2015-12-05 15:24:52,SMSwansea,,0,0,0,"GOAL! Swansea City 0-2 Leicester City (Riyad Mahrez, 22'). Join us live: http://sm.mg/z5brkwx #swans #lcfc",,,#swans #lcfc,673161118806876161,https://twitter.com/SMSwansea/status/673161118806876161
2015-12-05 15:24:43,Tumelo_LT,,0,0,0,"Yey yi Leicester City etheni le",,,,673161084283576326,https://twitter.com/Tumelo_LT/status/673161084283576326
2015-12-05 15:24:41,JhaChelsea,,0,0,0,"Leicester City have been a delight to watch this season. #SWALEI",,,#SWALEI,673161074338742273,https://twitter.com/JhaChelsea/status/673161074338742273
2015-12-05 15:24:40,EngineerStef,,0,0,0,"Leicester City are a joy to watch",,,,673161072187150338,https://twitter.com/EngineerStef/status/673161072187150338
2015-12-05 15:24:39,EGR4Y,,0,0,0,"Have to say like, Leicester City are for real ATM.",,,,673161065119801344,https://twitter.com/EGR4Y/status/673161065119801344
2015-12-05 15:24:38,___Beann,,0,0,0,"Riyad Mahrez, Jamie Vardy and Leicester City are just something else",,,,673161060547973120,https://twitter.com/___Beann/status/673161060547973120
2015-12-05 15:24:37,TayoMarciano,,0,0,0,"Leicester City is no laughing matter.",,,,673161058912104449,https://twitter.com/TayoMarciano/status/673161058912104449
2015-12-05 15:24:35,DeBOLx,,0,0,0,"Meanwhile, Leicester City are on fire!",,,,673161048904613888,https://twitter.com/DeBOLx/status/673161048904613888
2015-12-05 15:24:35,nealcol,,3,1,0,"Looks like @lcfc are going top of @premierleague. FOXES! @garylineker any South African Leicester City fans emerging yet?",,@lcfc @premierleague @garylineker,,673161048275464193,https://twitter.com/nealcol/status/673161048275464193
2015-12-05 15:24:35,mattmorgan_,,0,0,2,"I hate seeing #Swansea get embarrassed but Leicester City so much fun to watch. #swans #foxes",,,#Swansea #swans #foxes,673161047256207360,https://twitter.com/mattmorgan_/status/673161047256207360
2015-12-05 15:24:32,kynzyyzu,,0,0,0,"Leicester City",,,,673161035910656000,https://twitter.com/kynzyyzu/status/673161035910656000
2015-12-05 15:24:31,GoalNews,,0,21,3,"GOAL! Swansea City 0-2 Leicester City (Mahrez again) http://bit.ly/1m3tsEz #Swans #LCFCpic.twitter.com/9E5PTX2le9",,,#Swans #LCFCpic,673161032571973632,https://twitter.com/GoalNews/status/673161032571973632
2015-12-05 15:24:30,colourMebadHaze,,0,0,0,"Mayne Leicester city on a rave",,,,673161028528680961,https://twitter.com/colourMebadHaze/status/673161028528680961
2015-12-05 15:24:29,Lynnccourtney,,0,0,0,"Second goal of the afternoon for Leicester City",,,,673161025244504064,https://twitter.com/Lynnccourtney/status/673161025244504064
2015-12-05 15:24:29,ThisFineBobo,premierleague,0,0,0,"Leicester City going top of the #BPL.https://twitter.com/premierleague/status/673160785401683968 …",,,#BPL,673161023235469312,https://twitter.com/ThisFineBobo/status/673161023235469312
2015-12-05 15:24:27,Michael_Nyt,,0,0,0,"Leicester City tho",,,,673161014750355456,https://twitter.com/Michael_Nyt/status/673161014750355456
2015-12-05 15:24:27,albanzogaj,,0,0,0,"#LeicesterCity two up ... And top of the league! That's a surprise! #PremierLeague",,,#LeicesterCity #PremierLeague,673161013882183680,https://twitter.com/albanzogaj/status/673161013882183680
2015-12-05 15:24:25,Timberwolf___,,0,0,0,"Swansea City 0 - 2 Leicester City. 23' Riyad Mahrez scores a brace for Leicester City!",,,,673161008014188546,https://twitter.com/Timberwolf___/status/673161008014188546
2015-12-05 15:24:25,matt_green1995,,0,0,1,"Leicester City need to calm down and give the rest of the premier league a chance",,,,673161007511019522,https://twitter.com/matt_green1995/status/673161007511019522
2015-12-05 15:24:24,OfficiaIMICHAEL,,0,2,2,"Man I hate Leicester City",,,,673161003174072320,https://twitter.com/OfficiaIMICHAEL/status/673161003174072320
2015-12-05 15:24:21,_GeorgeAF,,0,0,0,"Leicester City bruh -_____- always winning and shit",,,,673160989244813312,https://twitter.com/_GeorgeAF/status/673160989244813312
2015-12-05 15:24:21,OJAY_PUMPING,,0,0,0,"LIVE: Swansea vs Leicester City http://dlvr.it/Cwlq8f",,,,673160988741337088,https://twitter.com/OJAY_PUMPING/status/673160988741337088
2015-12-05 15:24:20,AmBieMZ,,0,0,0,"Leicester city 2-0 up : (",,,,673160986354958336,https://twitter.com/AmBieMZ/status/673160986354958336
2015-12-05 15:24:17,Jopac4dvirg,,0,0,0,"LIVE: Swansea vs Leicester City http://dlvr.it/Cwlp5w",,,,673160974765953024,https://twitter.com/Jopac4dvirg/status/673160974765953024
2015-12-05 15:24:16,cypress1978,,0,0,0,"#PremierLeague LEICESTER CITY @SWANSEA CITY, In progress: 2 - 0 pic.twitter.com/5S9Fa8fkeg",,@SWANSEA,#PremierLeague,673160968185225217,https://twitter.com/cypress1978/status/673160968185225217
2015-12-05 15:24:15,MOHYEES,,0,0,0,"Swansea 0-2 Leicester City",,,,673160966490742784,https://twitter.com/MOHYEES/status/673160966490742784
2015-12-05 15:24:15,Abzeeskillz,,0,0,0,"Errrm...Leicester City might win this trophy yo!",,,,673160965941276672,https://twitter.com/Abzeeskillz/status/673160965941276672
2015-12-05 15:24:07,nitro2009,,0,0,0,"Leicester City singing at the top is just us",,,,673160930948157440,https://twitter.com/nitro2009/status/673160930948157440
2015-12-05 15:24:05,Jassumo7,,0,0,0,"Riyad mahrez also scores brace 2-0 up Leicester City. Want vardy to score now .",,,,673160923863912448,https://twitter.com/Jassumo7/status/673160923863912448
2015-12-05 15:24:05,indykaila,,3,23,48,"Watch Leicester City second goal. Bergkamp just scored for them. #LCFC",,,#LCFC,673160921884319745,https://twitter.com/indykaila/status/673160921884319745
2015-12-05 15:24:03,ExpelCelena,,0,0,0,"Leicester City be the champion please",,,,673160916578398208,https://twitter.com/ExpelCelena/status/673160916578398208
2015-12-05 15:24:03,dt_alerts,,0,0,0,"Goal! #lcfc Mahrez (LEI) +5 Pts (13 Pts) 22': Swansea City 0 - 1 Leicester City #sundreamteamhttp://www.dreamteamalerts.com",,,#lcfc #sundreamteamhttp,673160915479478272,https://twitter.com/dt_alerts/status/673160915479478272
2015-12-05 15:24:02,sahadanskor,,0,0,0,"Goool! Swansea City 0 - 2 Leicester City",,,,673160911943827457,https://twitter.com/sahadanskor/status/673160911943827457
2015-12-05 15:24:01,HJJ92_,,0,0,0,"Leicester City 3 points clear.",,,,673160906063355906,https://twitter.com/HJJ92_/status/673160906063355906
2015-12-05 15:24:00,Shirah_vincent,,0,0,0,"Leicester city",,,,673160901189595136,https://twitter.com/Shirah_vincent/status/673160901189595136
2015-12-05 15:24:00,Sean_FootyMad,,0,0,0,"Leicester City are doing bits....",,,,673160900329783296,https://twitter.com/Sean_FootyMad/status/673160900329783296
2015-12-05 15:23:59,Zain_555555,,0,0,0,"Leicester City take a bow",,,,673160898450690048,https://twitter.com/Zain_555555/status/673160898450690048
2015-12-05 15:23:59,thegeorgeazeez,,0,0,0,"What are Leicester City fighting for!?!?!",,,,673160896273760259,https://twitter.com/thegeorgeazeez/status/673160896273760259
2015-12-05 15:23:59,Kenickilive,,0,0,0,"Leicester city 2-0",,,,673160896089350144,https://twitter.com/Kenickilive/status/673160896089350144
2015-12-05 15:23:57,TopEuropaSport,,0,0,0,"GOAL! Mahrez Swansea City 0-2 Leicester City #swalei #BPL http://www.topeurosport.tk",,,#swalei #BPL,673160888338239489,https://twitter.com/TopEuropaSport/status/673160888338239489
2015-12-05 15:23:56,mattmeakin83,,0,0,0,"Fucking Leicester City fair play!",,,,673160884588568576,https://twitter.com/mattmeakin83/status/673160884588568576
2015-12-05 15:23:51,LiveLCFC,,0,0,2,"GOAL! Swansea 0 Leicester City 2 (Mahrez, 22) Follow the action: http://buff.ly/1HMT1Uw #SwaLei #lcfc",,,#SwaLei #lcfc,673160864636215300,https://twitter.com/LiveLCFC/status/673160864636215300
2015-12-05 15:23:46,laura_08x,,0,0,1,"We're Leicester city, we're top of the league #lcfc",,,#lcfc,673160842469376000,https://twitter.com/laura_08x/status/673160842469376000
2015-12-05 15:23:43,PL_Latest_News,,0,0,0,"GOALFLASH!! Swansea City 0-2 Leicester City - Riyad Mahrez! http://fb.me/1T5TXqXL6",,,,673160829961940992,https://twitter.com/PL_Latest_News/status/673160829961940992
