date,username,to,replies,retweets,favorites,text,geo,mentions,hashtags,id,permalink
2015-12-05 16:59:53,Bizzarru,,0,0,0,"Swansea City 0-3 Leicester City [Premier League] http://goo.gl/fb/RZspd1",,,,673185031280599041,https://twitter.com/Bizzarru/status/673185031280599041
2015-12-05 16:59:50,NoWisdomMate,,0,0,0,"Jamie Vardy fails to score for the first time in 12 matches, but Riyad Mahrez's hat-trick moves Leicester City top with a 3-0 win ove...",,,,673185019863543808,https://twitter.com/NoWisdomMate/status/673185019863543808
2015-12-05 16:59:49,DrVaSeech,,0,0,0,"I think Claudio Ranieri is the new Special one. Leicester City top of the league at almost half point. Very, very, impressive.",,,,673185015350464512,https://twitter.com/DrVaSeech/status/673185015350464512
2015-12-05 16:59:45,georginarh,,0,0,0,"There's only on Leicester city",,,,673184996971024384,https://twitter.com/georginarh/status/673184996971024384
2015-12-05 16:59:43,sport_swep,,2,0,0,"Let us know your thoughts about the defeat to Leicester City. pic.twitter.com/wIMj6gy4k1",,,,673184990247694340,https://twitter.com/sport_swep/status/673184990247694340
2015-12-05 16:59:43,stevelowebeds,,0,0,0,"If there was a league for commentators' predictions, Lawro would already be relegated. #LeicesterCity",,,#LeicesterCity,673184989404602368,https://twitter.com/stevelowebeds/status/673184989404602368
2015-12-05 16:59:41,Acidbej,,0,0,0,"It hurts but must be said, Leicester city are league leaders.",,,,673184983763329024,https://twitter.com/Acidbej/status/673184983763329024
2015-12-05 16:59:41,ImmortalPT,,0,0,1,"#mahrez is #on_fire .. With his hat-trick today #LeicesterCity is on top of the premier league, Amazing!!! #محرز",,,#mahrez #on_fire #LeicesterCity #محرز,673184980395302913,https://twitter.com/ImmortalPT/status/673184980395302913
2015-12-05 16:59:39,CurtisDvorak,,3,0,0,"Hey long time #BPL folks I got a question. Is #LeicesterCity a one year wonder?",,,#BPL #LeicesterCity,673184974867156997,https://twitter.com/CurtisDvorak/status/673184974867156997
2015-12-05 16:59:34,thekidLEGEND,,0,0,0,"Leicester City is back at the top of the Premier League table! Mahrez with the hat trick",,,,673184952213594112,https://twitter.com/thekidLEGEND/status/673184952213594112
2015-12-05 16:59:32,AbigailNorton4,,0,0,0,"Swansea City v Leicester City http://dlvr.it/CwnCQ3",,,,673184946156998656,https://twitter.com/AbigailNorton4/status/673184946156998656
2015-12-05 16:59:31,mackjoseph69,,0,0,0,"What a time to be a Leicester city fan",,,,673184940272537600,https://twitter.com/mackjoseph69/status/673184940272537600
2015-12-05 16:59:29,coldpony86,,0,0,0,"Good for Mahrez , happy for #LeicesterCity",,,#LeicesterCity,673184930713632769,https://twitter.com/coldpony86/status/673184930713632769
2015-12-05 16:59:28,steverains,,0,1,1,"We're Leicester City, we're top of the league @BadOther #LCFC #TopOfTheLeague",,@BadOther,#LCFC #TopOfTheLeague,673184926968250368,https://twitter.com/steverains/status/673184926968250368
2015-12-05 16:59:27,TJB1028,,0,0,0,"Incredibly thrilled for Leicester City since this team was in the second division 2 years ago and faced relegation last year",,,,673184921565929473,https://twitter.com/TJB1028/status/673184921565929473
2015-12-05 16:59:24,No_1_Raymond,,0,0,0,"I don't what this leicester city dey plan sha",,,,673184912149766144,https://twitter.com/No_1_Raymond/status/673184912149766144
2015-12-05 16:59:24,Tarrycool,,0,0,0,"BPL - RESULTS: West Brom 1-1 Spurs Swansea 0-3 Leicester City Watford 2-0 Norwich City #SSFootball pic.twitter.com/rsuLxRZqNh""",,,#SSFootball,673184910929223681,https://twitter.com/Tarrycool/status/673184910929223681
2015-12-05 16:59:22,isportbroadcast,,0,0,0,"#sport Swansea City v Leicester City http://dlvr.it/CwnBGS",,,#sport,673184903035404288,https://twitter.com/isportbroadcast/status/673184903035404288
2015-12-05 16:59:21,davidtplays,,0,0,0,"Arsenal win and are 2nd in the table only behind the mighty Leicester City.",,,,673184899688325120,https://twitter.com/davidtplays/status/673184899688325120
2015-12-05 16:59:20,KestrelRun,,0,0,0,"""First weekend of December and it's Leicester City leading the league..."" was not on anyone's radar 4 months ago. Wow.",,,,673184895728934914,https://twitter.com/KestrelRun/status/673184895728934914
2015-12-05 16:59:20,UK_HGV_Network,,0,0,0,"UK HGV NETWORK SPORT Swansea City v Leicester City http://dlvr.it/Cwn8R3 Drive Safe All",,,,673184895070437376,https://twitter.com/UK_HGV_Network/status/673184895070437376
2015-12-05 16:59:20,Andrew77240,ManonLgrst,0,0,0,"Leicester City Top of the PL just for you information #Miss Bordeauxhttps://twitter.com/ManonLgrst/status/673183678789496832 …",,,#Miss,673184894739210244,https://twitter.com/Andrew77240/status/673184894739210244
2015-12-05 16:59:17,jamiemollart,,2,0,3,"We're Leicester City, we're top of the league pic.twitter.com/CuNi4YA2nQ",,,,673184883213246464,https://twitter.com/jamiemollart/status/673184883213246464
2015-12-05 16:59:15,DrewMollel,,1,1,0,"But...meeeen Leicester City..",,,,673184871272050689,https://twitter.com/DrewMollel/status/673184871272050689
2015-12-05 16:59:13,ABBasson17,,0,2,0,"Leicester City two points clear. Vardy played non-league not so long ago. Mahrez played in the French Ligue 2 in 2014.Bought for £400,000.",,,,673184863856541696,https://twitter.com/ABBasson17/status/673184863856541696
2015-12-05 16:59:13,Lokzil,,0,0,0,"#sport Swansea City v Leicester City http://dlvr.it/CwnDc3",,,#sport,673184862480629760,https://twitter.com/Lokzil/status/673184862480629760
2015-12-05 16:59:12,AlexanderYoun13,,0,0,0,"Swansea City v Leicester City http://dlvr.it/CwnD7r",,,,673184860542910464,https://twitter.com/AlexanderYoun13/status/673184860542910464
2015-12-05 16:59:11,cesarjalapeno,,0,0,0,"Leicester City on top of the Premier League? That's some Football Manager shit. Great story.",,,,673184857669767168,https://twitter.com/cesarjalapeno/status/673184857669767168
2015-12-05 16:59:10,maroq,,0,0,0,"Leicester City's attack force >>>>> Man U's #mufc",,,#mufc,673184852880027648,https://twitter.com/maroq/status/673184852880027648
2015-12-05 16:59:10,HarryPotts2,,0,0,0,"Swansea City v Leicester City http://dlvr.it/Cwn8Gv",,,,673184852049453056,https://twitter.com/HarryPotts2/status/673184852049453056
2015-12-05 16:59:10,iam_KingCee,,0,4,0,"Leicester City is currently the best in form team at the moment in the top flight, I'm not surprised if they secure a CL spot next season.",,,,673184849784475648,https://twitter.com/iam_KingCee/status/673184849784475648
2015-12-05 16:59:09,Loom_6,,0,0,0,"Leicester city showing no signs of slowing down pic.twitter.com/NRg7pHG63i",,,,673184849361022978,https://twitter.com/Loom_6/status/673184849361022978
2015-12-05 16:59:09,dakin2011,,1,1,3,"Actually can't believe what is going on at Leicester City football club...unbelievable #lcfc",,,#lcfc,673184847502966786,https://twitter.com/dakin2011/status/673184847502966786
2015-12-05 16:59:07,Kalnormzac,,0,0,0,"Also, we need someone to checc on Leicester City's performance. They're flying soo annoyingly high! #BPL.",,,#BPL,673184837876994048,https://twitter.com/Kalnormzac/status/673184837876994048
2015-12-05 16:59:06,JoeLiporace,,0,0,1,"Congrats to Leicester City for being the first team ever to lead the Premier League with less than 20% of people able to pronounce its name",,,,673184834878111744,https://twitter.com/JoeLiporace/status/673184834878111744
2015-12-05 16:59:04,barnzy_10,,0,0,0,"Leicester City top of the league",,,,673184828506804224,https://twitter.com/barnzy_10/status/673184828506804224
2015-12-05 16:59:03,Garys_Goldfish1,,0,0,0,"@BBCMOTD Great to see Leicester City doing so well this season. Are they now serious contenders for the title?",,@BBCMOTD,,673184822597197828,https://twitter.com/Garys_Goldfish1/status/673184822597197828
2015-12-05 16:58:56,ariesten,,0,0,0,"Leicester city are on to something#SSfootball",,,#SSfootball,673184794700701696,https://twitter.com/ariesten/status/673184794700701696
2015-12-05 16:58:54,Najmaaaa,,0,1,0,"Oh yh and can Leicester city fuck off already",,,,673184783887966208,https://twitter.com/Najmaaaa/status/673184783887966208
2015-12-05 16:58:51,Oshozee_bangz,,0,0,0,"Trust me when i say Leicester city surely would be in top 6 teams in the league this season. IMPRESSIVE",,,,673184772412305408,https://twitter.com/Oshozee_bangz/status/673184772412305408
2015-12-05 16:58:51,qayywm,,0,0,0,"Yang penting Leicester City 1st hahaha",,,,673184771892076544,https://twitter.com/qayywm/status/673184771892076544
2015-12-05 16:58:45,IfcFootballTV,,0,1,1,"#football: Swansea City 0 Leicester City 3: Vardy streak finally ends as Mahrez steals show with hat-trick pic.twitter.com/ahnlWqOfry",,,#football,673184748546736128,https://twitter.com/IfcFootballTV/status/673184748546736128
2015-12-05 16:58:43,OfficialShannor,,0,0,0,"Man City lost Man Utd draw Leicester City won Arsenal won Tottenham draw Chelsea... ?",,,,673184736689295360,https://twitter.com/OfficialShannor/status/673184736689295360
2015-12-05 16:58:41,electrofunkbox1,,0,0,0,"#LCFC top of the league! Top of the league! Top of the league well done Leicester city",,,#LCFC,673184728569262080,https://twitter.com/electrofunkbox1/status/673184728569262080
2015-12-05 16:58:33,CurtisLMacleod,,0,1,2,"Imagine how mad it would be if Leicester City actually won the league.",,,,673184697527246848,https://twitter.com/CurtisLMacleod/status/673184697527246848
2015-12-05 16:58:33,3SportsGh,,0,5,2,"Leicester City. Top of the league. #tv3sportsghpic.twitter.com/7yODmt5HVq",,,#tv3sportsghpic,673184695467819011,https://twitter.com/3SportsGh/status/673184695467819011
2015-12-05 16:58:31,Daaarshan,,0,0,0,"Keeping my Fidelity at bay, I so wish to change my allegiance to teams like Leicester City.",,,,673184689138503680,https://twitter.com/Daaarshan/status/673184689138503680
2015-12-05 16:58:30,MyLuvArsenal,,0,0,0,"Leicester City _/\_ Just one loss this season!! and that defeat came against us. #Arsenal #AFC #ARSSUN",,,#Arsenal #AFC #ARSSUN,673184683102879744,https://twitter.com/MyLuvArsenal/status/673184683102879744
2015-12-05 16:58:28,Abigail_lcfc,,0,2,6,"We just clearly want this more than any other Premier League team! We're Leicester City, we rule supreme! #LCFC",,,#LCFC,673184673716117505,https://twitter.com/Abigail_lcfc/status/673184673716117505
2015-12-05 16:58:22,mrmingo,,1,0,1,"And the chant rolls into December ..... We're Leicester city, we're top of the league!! #lcfc #championsleague #topoftheleague",,,#lcfc #championsleague #topoftheleague,673184651402420224,https://twitter.com/mrmingo/status/673184651402420224
2015-12-05 16:58:17,AGRMoore,,2,0,1,"Leicester City. It's getting fucking silly now like. #football #bloodyhell",,,#football #bloodyhell,673184627994046464,https://twitter.com/AGRMoore/status/673184627994046464
2015-12-05 16:58:15,rod__s,,1,0,0,"Leicester City is my pride and joy because i discovered them before anyone else did",,,,673184621555773440,https://twitter.com/rod__s/status/673184621555773440
2015-12-05 16:58:13,VampireeGirll,,0,0,0,"WE'RE LEICESTER CITY, WE'RE TOP OF THE LEAGUE!!! What a time to be a… https://www.instagram.com/p/-6uyLyR46lRwh8TbZqgG6k37uIqX0c4KjFgVk0/ …",,,,673184614324809728,https://twitter.com/VampireeGirll/status/673184614324809728
2015-12-05 16:58:13,BraisIglesias,,0,0,0,"Leicester City won 0-3 away and is leader of the @premierleague table. Congratulations. Small team also can do it!",,@premierleague,,673184611342680064,https://twitter.com/BraisIglesias/status/673184611342680064
2015-12-05 16:58:12,bjsaunders_,_UmarC10,1,0,4,"@Umar_Wilshere19 not pal but Credit where credit is due Leicester City doing very well",,@Umar_Wilshere19,,673184606926057476,https://twitter.com/bjsaunders_/status/673184606926057476
2015-12-05 16:57:58,ajaAayera,,0,0,0,"Which ever EPL Clubs we support....we need to support Leicester city football club for an EPL Trophy this time. #epl15/16 #LCFC",,,#epl15 #LCFC,673184551699685377,https://twitter.com/ajaAayera/status/673184551699685377
2015-12-05 16:57:55,DOgbefho,,0,0,0,"Leicester City goes 2 points clear...Vardy didn't score..no problem..Mahrez hat trick...complete team",,,,673184538646863881,https://twitter.com/DOgbefho/status/673184538646863881
2015-12-05 16:57:55,ImmieBroods,quietlikeastorm,1,0,1,"@quietlikeastorm fear Alexis Sanchez! But, enjoy a well deserved win. Leicester worked hard! #LeicesterCity",,@quietlikeastorm,#LeicesterCity,673184538164621313,https://twitter.com/ImmieBroods/status/673184538164621313
2015-12-05 16:57:55,sicelohz,,0,0,0,"A big S/O to Leicester City",,,,673184538063933440,https://twitter.com/sicelohz/status/673184538063933440
2015-12-05 16:57:55,ArditSimnica5,,0,0,0,"Leicester City sosht rasisht n vend t pare",,,,673184536445001728,https://twitter.com/ArditSimnica5/status/673184536445001728
2015-12-05 16:57:55,Bifarin,,0,0,0,"Leicester City back on top.. #EPL",,,#EPL,673184535417352195,https://twitter.com/Bifarin/status/673184535417352195
2015-12-05 16:57:54,jacksonrwhite,,0,0,1,"Man City loses, Man U just a point, Leicester City wins again. Sure helps Liverpool but man I just don't get it #EPL",,,#EPL,673184534507180032,https://twitter.com/jacksonrwhite/status/673184534507180032
2015-12-05 16:57:53,_shittu__,,0,0,0,"Leicester city we are coming.... #Arsenal #RedArmy",,,#Arsenal #RedArmy,673184526844231680,https://twitter.com/_shittu__/status/673184526844231680
2015-12-05 16:57:52,QVivaElFutbol15,,0,0,0,"FINAL | Swansea 0-3 Leicester City",,,,673184526202503169,https://twitter.com/QVivaElFutbol15/status/673184526202503169
2015-12-05 16:57:52,abdulrazak_31,,0,0,0,"Algerian Riyad Mahrez scored a hat-trick as Leicester City claimed a 3-0 win at Swansea City to move to the top of the log #SSFootball",,,#SSFootball,673184525367791617,https://twitter.com/abdulrazak_31/status/673184525367791617
2015-12-05 16:57:51,ehMDS,,0,0,0,"Leicester City should just win the league so we can all climb in the bin.",,,,673184522008190978,https://twitter.com/ehMDS/status/673184522008190978
2015-12-05 16:57:50,kayblezzz,,0,0,0,"#EPL got all the unpredictable stuff there. Leicester city on top of the league. Amazing run",,,#EPL,673184514840109056,https://twitter.com/kayblezzz/status/673184514840109056
2015-12-05 16:57:47,PepsisNotOk,,0,0,0,"Leicester City could lose all their remaining games and stay up, 15 games into the season",,,,673184505654583296,https://twitter.com/PepsisNotOk/status/673184505654583296
2015-12-05 16:57:47,Jack_Bradley14,,1,0,0,"We're top of the league, we're top of the league, we're Leicester City we're top of the league @LCFC @premierleague",,@LCFC @premierleague,,673184501875494912,https://twitter.com/Jack_Bradley14/status/673184501875494912
2015-12-05 16:57:46,birdmanWl,themichaelowen,0,0,0,"@themichaelowen you putting Leicester city in the mix?",,@themichaelowen,,673184497605718016,https://twitter.com/birdmanWl/status/673184497605718016
2015-12-05 16:57:45,kbone_,,0,0,0,"Leicester city top of the League as expected.",,,,673184493465915392,https://twitter.com/kbone_/status/673184493465915392
2015-12-05 16:57:41,CLOweeee_,,0,1,0,"We're Leicester city, we're top of the league!!!",,,,673184478102204416,https://twitter.com/CLOweeee_/status/673184478102204416
2015-12-05 16:57:40,NaturalGaz,,0,0,0,"Leicester City 1st, of course. I wish powerhouse clubs like Leicester City would give other teams a go. Vardy forgot to score. Mahrez didn't",,,,673184475862274048,https://twitter.com/NaturalGaz/status/673184475862274048
2015-12-05 16:57:31,Jay_OBrien,,0,0,0,"Three goals for #LeicesterCity today and @vardy7 didn't have any of them? Hell of a run, man!",,@vardy7,#LeicesterCity,673184438277292032,https://twitter.com/Jay_OBrien/status/673184438277292032
2015-12-05 16:57:28,ChrisOkoye_,,0,0,0,"Leicester city for the Cup",,,,673184422494105600,https://twitter.com/ChrisOkoye_/status/673184422494105600
2015-12-05 16:57:24,beccasuttonX,,0,0,3,"Never ever thought I'd be able to sing 'we're Leicester City, we're top of the league' whilst in the PREMIER LEAGUE!!! #lcfc",,,#lcfc,673184406501203968,https://twitter.com/beccasuttonX/status/673184406501203968
2015-12-05 16:57:24,zhfrsyd,,1,5,1,"Suddenly Leicester City becomes everyone's second favourite team.",,,,673184405175730176,https://twitter.com/zhfrsyd/status/673184405175730176
2015-12-05 16:57:22,PBriscombe,,0,0,1,"Ok I now support Leicester city",,,,673184399274475522,https://twitter.com/PBriscombe/status/673184399274475522
2015-12-05 16:57:19,PietrezHaukongo,,0,0,0,"Leicester City just got a +1 fan",,,,673184387408769024,https://twitter.com/PietrezHaukongo/status/673184387408769024
2015-12-05 16:57:18,Christo_Jnr,,0,0,0,"Leicester City, Arsenal and Man City still have to play each other. We already played them all. Can all #MUFC fans CALM DOWN! Great position",,,#MUFC,673184383558426624,https://twitter.com/Christo_Jnr/status/673184383558426624
2015-12-05 16:57:18,Andrew_InStre,,0,0,0,"What's it about Leicester City FC? Is @NickFerrariLBC sponsoring their team this yeat? @ianpaynesport @lbc",,@NickFerrariLBC @ianpaynesport @lbc,,673184380462886912,https://twitter.com/Andrew_InStre/status/673184380462886912
2015-12-05 16:57:15,TomBlood118,,0,0,0,"Leicester City top of the league. Got to love the premiership",,,,673184370115657729,https://twitter.com/TomBlood118/status/673184370115657729
2015-12-05 16:57:15,virtualstatman,,0,3,1,"Leicester City virtually safe from relegation. Big relief at the King Power Stadium :) #LCFC",,,#LCFC,673184367636701184,https://twitter.com/virtualstatman/status/673184367636701184
2015-12-05 16:57:14,ashapumba,,1,2,1,"Leicester City are topping the EPL... I need to start watching a new league",,,,673184364780503040,https://twitter.com/ashapumba/status/673184364780503040
2015-12-05 16:57:13,DMC790,,0,0,4,"Another great away win! WE'RE LEICESTER CITY WE'RE TOP OF THE LEAGUE! #LCFC",,,#LCFC,673184362930786309,https://twitter.com/DMC790/status/673184362930786309
2015-12-05 16:57:13,JumaBahati,,0,0,0,"MUFC unlucky. Leicester City with a 2-point lead",,,,673184362368786432,https://twitter.com/JumaBahati/status/673184362368786432
2015-12-05 16:57:10,NaomiBryony,,1,1,1,"Still cannot believe Leicester City are top of the league! Let alone 2 points clear!",,,,673184347789369344,https://twitter.com/NaomiBryony/status/673184347789369344
2015-12-05 16:57:07,SportyAfrica,,0,0,0,"FT; Southampton 1 - 1 Aston Villa Swansea City 0 - 3 Leicester City Watford 2 - 0 Norwich City Arsenal 3 - 1 Sunderland",,,,673184335525240832,https://twitter.com/SportyAfrica/status/673184335525240832
2015-12-05 16:57:04,AmDiddy,,0,0,1,"For those of You of writing LEICESTER CITY off....be warned!!!! Remember this tweet",,,,673184321600135169,https://twitter.com/AmDiddy/status/673184321600135169
2015-12-05 16:57:02,WorkingPrimate,,0,0,0,"Leicester City killing it for the lols #LCFC #PremierLeague",,,#LCFC #PremierLeague,673184314243325953,https://twitter.com/WorkingPrimate/status/673184314243325953
2015-12-05 16:57:02,AjimNasry,,0,2,0,"Leicester City top of the league. Buat malu epl je doh gentle",,,,673184312909369345,https://twitter.com/AjimNasry/status/673184312909369345
2015-12-05 16:57:01,marktpower,,0,0,1,"I'm still dreaming... Leicester City see off Swansea 3-0 at the Liberty Stadium to go TWO POINTS CLEAR at the top of the Premier League!",,,,673184312104247296,https://twitter.com/marktpower/status/673184312104247296
2015-12-05 16:57:00,NGramz,,1,0,2,"When did Leicester city become #1",,,#1,673184306404204544,https://twitter.com/NGramz/status/673184306404204544
2015-12-05 16:57:00,FOXES_Fanly,,0,0,2,"Swansea vs Leicester LIVE: Foxes look to continue strong start ag... #LeicesterCity http://www.fanly.me/c/Ltk7jfGZl3 pic.twitter.com/xBmwiHDS4d",,,#LeicesterCity,673184306001350656,https://twitter.com/FOXES_Fanly/status/673184306001350656
2015-12-05 16:56:59,davisonp67,,0,0,0,"This man is not Brian Clough. #Ranieri #LeicesterCity #AFC @arseblogpic.twitter.com/kz1J6BycuR",,@arseblogpic,#Ranieri #LeicesterCity #AFC,673184301308059648,https://twitter.com/davisonp67/status/673184301308059648
2015-12-05 16:56:58,sisa_mafu,,1,0,0,"Leicester City pic.twitter.com/OfQeb510N7",,,,673184297466114050,https://twitter.com/sisa_mafu/status/673184297466114050
2015-12-05 16:56:57,Who_is_Odwa,,0,0,0,"But Leicester City is taking this EPL thing let's admit it!",,,,673184294160998400,https://twitter.com/Who_is_Odwa/status/673184294160998400
2015-12-05 16:56:54,HSagrma,,0,0,0,"Leicester City 15/16 EPL Champions #LCFC #LeicesterCity #EPL #prediction",,,#LCFC #LeicesterCity #EPL #prediction,673184281355804672,https://twitter.com/HSagrma/status/673184281355804672
2015-12-05 16:56:52,Jennster9148,,0,0,0,"Wow. Leicester City.",,,,673184274917548032,https://twitter.com/Jennster9148/status/673184274917548032
2015-12-05 16:56:51,SuperSportTV,,1,16,10,"#BPL - RESULTS: West Brom 1-1 Spurs Swansea 0-3 Leicester City Watford 2-0 Norwich City #SSFootballpic.twitter.com/qZGMQs2lDZ",,,#BPL #SSFootballpic,673184267753648128,https://twitter.com/SuperSportTV/status/673184267753648128
2015-12-05 16:56:49,originallyme_dj,,0,0,0,"Leicester City are just running",,,,673184258987458561,https://twitter.com/originallyme_dj/status/673184258987458561
2015-12-05 16:56:45,muhd_haddad,,0,0,0,"Woah Leicester City is at the top of the table",,,,673184242453504000,https://twitter.com/muhd_haddad/status/673184242453504000
2015-12-05 16:56:39,themib,,0,0,0,"Leicester City two points clear of Arsenal at the top of the Premier League.",,,,673184217375760384,https://twitter.com/themib/status/673184217375760384
2015-12-05 16:56:39,SF3frankie,,0,0,0,"Leicester City moving like RH rendezvous FC... get promote and bullying this thing LOL",,,,673184216910180352,https://twitter.com/SF3frankie/status/673184216910180352
2015-12-05 16:56:36,leonhartxtreme,,0,1,0,"Leicester City for BPL Champion!!!!",,,,673184203933016064,https://twitter.com/leonhartxtreme/status/673184203933016064
2015-12-05 16:56:34,yeyeboy_,,0,0,1,"what is leicester city doing at the top of the league??",,,,673184199596109825,https://twitter.com/yeyeboy_/status/673184199596109825
2015-12-05 16:56:34,SoccerNationNg,,0,0,0,"Leicester City are back on top of the log with an emphatic 3nil win over Swansea at the Liberty Stadium. #SNLive",,,#SNLive,673184197851369472,https://twitter.com/SoccerNationNg/status/673184197851369472
2015-12-05 16:56:33,Gharbawy,,0,0,0,"The selfishness of #Mahrez & #Ulloa prevented #Vardy from equaling another record #LeicesterCity #SWAvLEI",,,#Mahrez #Ulloa #Vardy #LeicesterCity #SWAvLEI,673184194055376896,https://twitter.com/Gharbawy/status/673184194055376896
2015-12-05 16:56:33,bluearmy,,0,0,7,"It's all over, #LCFC win 3-0 away at Swansea! Mahrez hat-trick! We're Leicester City, we're top of the league!! pic.twitter.com/FpzyEaCgdE",,,#LCFC,673184192985960450,https://twitter.com/bluearmy/status/673184192985960450
2015-12-05 16:56:32,KevinTeen38,,0,0,1,"Save this tweet: Leicester City PL champions 2015/16",,,,673184189869514752,https://twitter.com/KevinTeen38/status/673184189869514752
2015-12-05 16:56:32,Derek_Wilcox,,0,0,0,"Leicester City stunning the premier league #bpl",,,#bpl,673184189550759936,https://twitter.com/Derek_Wilcox/status/673184189550759936
2015-12-05 16:56:30,SStoned69,,0,0,0,"#LeicesterCity are TOP of #BPL !! Omg ha ha",,,#LeicesterCity #BPL,673184182265356289,https://twitter.com/SStoned69/status/673184182265356289
2015-12-05 16:56:30,FanmodeOfficial,,0,0,0,"Here is #leicestercity midfielder #mahrez scoring an #epl #hattrick. Well done sir! Who has him… https://www.instagram.com/p/-6uliNjj6u/",,,#leicestercity #mahrez #epl #hattrick,673184180281417728,https://twitter.com/FanmodeOfficial/status/673184180281417728
2015-12-05 16:56:29,S_Kumaran94,,0,0,0,"Well, the good thing is, there aren't many Leicester city fans in singapore whom will disturb you.",,,,673184176699400192,https://twitter.com/S_Kumaran94/status/673184176699400192
2015-12-05 16:56:29,StuartWaite84,,0,0,0,"Fair play Leicester City as well, not my team but to be top of the league after 15 games is a tremendous effort.",,,,673184176116531200,https://twitter.com/StuartWaite84/status/673184176116531200
2015-12-05 16:56:26,Oshozee_bangz,,0,0,0,"Arsenal moves to 2nd place. for the love of God when would Leicester city drop points they are just fantastic this season.",,,,673184161939738624,https://twitter.com/Oshozee_bangz/status/673184161939738624
2015-12-05 16:56:25,lamesatecnica,,0,0,0,"#PremierLeague FINAL: Swansea City 0 Leicester City 3 | Fecha 5 | #MesaTecnica",,,#PremierLeague #MesaTecnica,673184159569965056,https://twitter.com/lamesatecnica/status/673184159569965056
2015-12-05 16:56:23,imdatcris,,0,0,0,"Leicester City are two points clear at the top of the table...Let that sink in.",,,,673184151344926720,https://twitter.com/imdatcris/status/673184151344926720
2015-12-05 16:56:22,Waju_,,0,1,0,"I just can't believe Leicester City are first",,,,673184146672500737,https://twitter.com/Waju_/status/673184146672500737
2015-12-05 16:56:21,Joaozinho1,,0,0,0,"Leicester City",,,,673184142553665536,https://twitter.com/Joaozinho1/status/673184142553665536
2015-12-05 16:56:21,goat_musings,,0,0,0,"Leicester City has a 2 point lead in the EPL. Seriously.",,,,673184142427873280,https://twitter.com/goat_musings/status/673184142427873280
2015-12-05 16:56:20,jamie_whiting,,0,0,0,"Leicester City top of the league........ By two points....... What......?",,,,673184138636214272,https://twitter.com/jamie_whiting/status/673184138636214272
2015-12-05 16:56:19,Lib_Librarian,,0,3,1,"What warped version of The Matrix am I in in which Leicester City @LCFC is top of the table?",,@LCFC,,673184134399856641,https://twitter.com/Lib_Librarian/status/673184134399856641
