date,username,to,replies,retweets,favorites,text,geo,mentions,hashtags,id,permalink
2017-02-12 17:59:56,Freddy13Perez,,0,0,0,"SwanseaCity 2-0 LeicesterCity, Final.",,,,830838867624345602,https://twitter.com/Freddy13Perez/status/830838867624345602
2017-02-12 17:59:53,Funky_Phantom75,,0,0,0,"The White Stripes - I Just Don't Know What To Do With Myself This is how we feel as Leicester City fans #lcfc https://www.youtube.com/watch?v=fC7PEQnjKl4&feature=share …",,,#lcfc,830838852394815489,https://twitter.com/Funky_Phantom75/status/830838852394815489
2017-02-12 17:59:42,carryonkeith,,2,6,21,"Leicester City: football's imagining of Brexit.",,,,830838805586391041,https://twitter.com/carryonkeith/status/830838805586391041
2017-02-12 17:59:41,CAyugi,,0,0,0,"Leicester City will just remain a story and a case study for motivational speakers",,,,830838801056595970,https://twitter.com/CAyugi/status/830838801056595970
2017-02-12 17:59:40,TheRileyable,,0,0,0,"Leicester City: Probably going down but with more Premier League Titles than Liverpool.",,,,830838798527381505,https://twitter.com/TheRileyable/status/830838798527381505
2017-02-12 17:59:39,Andle_carefully,,0,0,0,"They lack ideas #Leicestercity",,,#Leicestercity,830838795977314305,https://twitter.com/Andle_carefully/status/830838795977314305
2017-02-12 17:59:38,lorax07,premierleague,0,0,0,"If Leicester City gets relegated, the entire squad should give their BMWs back to the owner. https://twitter.com/premierleague/status/830820940309225472 …",,,,830838790604324866,https://twitter.com/lorax07/status/830838790604324866
2017-02-12 17:59:37,Hanlon_Stephen,,0,0,0,"#LeicesterCity are basically just the real life Harchester United. #SWALEI",,,#LeicesterCity #SWALEI,830838785134956549,https://twitter.com/Hanlon_Stephen/status/830838785134956549
2017-02-12 17:59:36,MarcMcCullough_,,0,0,0,"Can't believe Leicester city this season man.",,,,830838780168925184,https://twitter.com/MarcMcCullough_/status/830838780168925184
2017-02-12 17:59:35,SN_CA_Soccer,,0,0,0,"Swansea City 2-0 Leicester City: Pressure mounts on struggling champions http://dlvr.it/NMCY3K pic.twitter.com/zHb9Lvh8oI",,,,830838776381349889,https://twitter.com/SN_CA_Soccer/status/830838776381349889
2017-02-12 17:59:33,eplfeeds,,0,0,0,"Leicester City relegation fears deepen with Swansea City defeat #epl @ESPNFC: Swansea City Leicester City 2 0 FT… http://dlvr.it/NMCY4Q",,@ESPNFC,#epl,830838770719039488,https://twitter.com/eplfeeds/status/830838770719039488
2017-02-12 17:59:33,TFS_Leicester,,0,0,0,"Leicester city FC are not romancing relegation. They are actually having sex without condom with relegation. http://dlvr.it/NMCY3h",,,,830838769599123457,https://twitter.com/TFS_Leicester/status/830838769599123457
2017-02-12 17:59:30,ESPNStatsInfo,,2,28,68,"Leicester City is the first reigning top-flight English champion to go 6 straight top division games without scoring. pic.twitter.com/ZxCaiGbR6S",,,,830838755481247744,https://twitter.com/ESPNStatsInfo/status/830838755481247744
2017-02-12 17:59:28,TheSeronja,,0,0,0,"Is it pos that QPR with Redknapp at the helm was a prelude of the Leicester City EPL title from a yr ago with Ranieri, except with no namers",,,,830838749185585158,https://twitter.com/TheSeronja/status/830838749185585158
2017-02-12 17:59:21,CFCrss,,0,0,1,"ESPNFC Swansea City 2-0 Leicester City - ESPN FC http://bit.ly/2kzEEZv",,,,830838717891895299,https://twitter.com/CFCrss/status/830838717891895299
2017-02-12 17:59:19,johnudofia2,,1,1,0,"Leicester City Champions of EPL last Season, relegation this season? @ogunmilorokenny @olatoberu @busayoadejumo",,@ogunmilorokenny @olatoberu @busayoadejumo,,830838711113900034,https://twitter.com/johnudofia2/status/830838711113900034
2017-02-12 17:59:18,Andle_carefully,,0,0,0,"This is like the worth EPL league team I have seen in a while.. WTF.. #leicestercity",,,#leicestercity,830838708203089920,https://twitter.com/Andle_carefully/status/830838708203089920
2017-02-12 17:59:18,HEdoubleN,,0,0,1,"There's regressing in the statistical sense, regressing in the evolutionary sense and now regressing in the Leicester city sense",,,,830838706865070081,https://twitter.com/HEdoubleN/status/830838706865070081
2017-02-12 17:59:16,Collard__Greens,,0,0,0,"I guess it's safe to say the problem with Leicester city this season has been the loss of Kante. Their midfield is dead",,,,830838697725722624,https://twitter.com/Collard__Greens/status/830838697725722624
2017-02-12 17:59:15,johnlsquires,,0,1,1,"New lcfc chant We're not very good We're not very good We're leicester city We're not very good",,,,830838692495372288,https://twitter.com/johnlsquires/status/830838692495372288
2017-02-12 17:59:12,malubomboka,,0,0,0,"whatever happend to Leicester city",,,,830838682479370241,https://twitter.com/malubomboka/status/830838682479370241
2017-02-12 17:59:11,FantasyGaffer,,0,2,3,"Leicester City have not scored a Premier League goal this year. 6 matches 520' 67 Shots 17 On Target Last goal v. #WHUFC Dec 31 Slimani 20'",,,#WHUFC,830838675655237632,https://twitter.com/FantasyGaffer/status/830838675655237632
2017-02-12 17:59:10,tomrichman94,,0,0,0,"Leicester City are a joke this season, how they won the PL with Huth and Morgan at CB I'll never know.",,,,830838673641963521,https://twitter.com/tomrichman94/status/830838673641963521
2017-02-12 17:59:09,scottbentley_16,,0,0,0,"No passion. No fight. No hope #leicestercity can't even imagine where the next points are coming from",,,#leicestercity,830838666616528896,https://twitter.com/scottbentley_16/status/830838666616528896
2017-02-12 17:59:06,ye_back,,0,0,0,"@SuperSportBlitz: #PL - RESULT: Swansea City 2-0 Leicester City #SSFootball",,@SuperSportBlitz,#PL #SSFootball,830838655644217346,https://twitter.com/ye_back/status/830838655644217346
2017-02-12 17:59:02,drama_abk,,0,0,1,"What is happening to Leicester City FC",,,,830838640754442240,https://twitter.com/drama_abk/status/830838640754442240
2017-02-12 17:59:00,Maniche4,,0,1,0,"One point above relegation Leicester City",,,,830838630004441088,https://twitter.com/Maniche4/status/830838630004441088
2017-02-12 17:58:57,ClarkyE,,0,0,0,"What's the odds on Leicester winning the champions league and getting relegated to the championship? #leicestercity #notoveryet #lcfc",,,#leicestercity #notoveryet #lcfc,830838618239406080,https://twitter.com/ClarkyE/status/830838618239406080
2017-02-12 17:58:56,KayK55,,0,0,0,"Mentality of the players is a big issue, not just the manager. #regelation #LeicesterCity",,,#regelation #LeicesterCity,830838615018237957,https://twitter.com/KayK55/status/830838615018237957
2017-02-12 17:58:56,bowbrookshrew,,1,0,4,"Leicester City going down sounds as unbelievable as it did them winning the Premier League last season, it could happen.",,,,830838612489027585,https://twitter.com/bowbrookshrew/status/830838612489027585
2017-02-12 17:58:43,rynorem,,0,0,0,"No goals in six straight for Leicester City. No reigning Champs has done that. Since 37/38 has a champion been relegated the next year.""",,,,830838560555143169,https://twitter.com/rynorem/status/830838560555143169
2017-02-12 17:58:42,FOXES_Fanly,,0,0,0,"Swansea 2-0 Leicester: Alfie Mawson and Martin Olsson heap more mi... #LeicesterCity https://serve.fans/r/c82b4a33a2 pic.twitter.com/yo6KgyUl3K",,,#LeicesterCity,830838555094220800,https://twitter.com/FOXES_Fanly/status/830838555094220800
2017-02-12 17:58:39,MattMcGill93,,0,0,2,"Actually regret not putting £10 on Leicester city to be relegated #SWALEI #BPL",,,#SWALEI #BPL,830838542859382786,https://twitter.com/MattMcGill93/status/830838542859382786
2017-02-12 17:58:34,hasan_noorul03,premierleague,0,0,0,"#SWALEI New low 4 #LeicesterCity. They r falling under wanted record books. Surely they need 2 find a way 2 avoid relegation.",,,#SWALEI #LeicesterCity,830838523125129216,https://twitter.com/hasan_noorul03/status/830838523125129216
2017-02-12 17:58:30,1960Bet,,1,0,0,"LEICESTER CITY",,,,830838507010682881,https://twitter.com/1960Bet/status/830838507010682881
2017-02-12 17:58:30,GarryDevilDada,,0,0,0,"No goals for Leicester City since the start of 2017.Foxes completely outfoxed! #SWALEI",,,#SWALEI,830838503248257026,https://twitter.com/GarryDevilDada/status/830838503248257026
2017-02-12 17:58:26,Mskopites,,0,1,1,"A fairytale of leicester city...from champions to relegations...",,,,830838489390346241,https://twitter.com/Mskopites/status/830838489390346241
2017-02-12 17:58:26,IamLungile_,,0,0,0,"Leicester city are defending league champions but they are now two points above relegation because sports is ruled by randomness",,,,830838486710247424,https://twitter.com/IamLungile_/status/830838486710247424
2017-02-12 17:58:25,lcfcbuzztap,,0,0,0,"espnfc .com >> Swansea City 2-0 Leicester City http://buzztap.com/-9YLbF4",,,,830838483761688576,https://twitter.com/lcfcbuzztap/status/830838483761688576
2017-02-12 17:58:24,RajiDraj,,0,2,0,"Leicester City's job of the decade was to stand between Arsenal and the League. They've accomplished that, it's time to go down.",,,,830838481496711168,https://twitter.com/RajiDraj/status/830838481496711168
2017-02-12 17:58:19,Hamzais41480421,,0,0,0,"@#swansea city 2 - 0 @#leicester city full time",,@ @,#swansea #leicester,830838457207496705,https://twitter.com/Hamzais41480421/status/830838457207496705
2017-02-12 17:58:17,M__Best,,0,0,0,"Leicester city is in a deep shit",,,,830838451805249542,https://twitter.com/M__Best/status/830838451805249542
2017-02-12 17:58:17,itsabdurrahman,premierleague,0,0,1,"i pity leicester city fc so much, i pity claudio Ranieri as well",,,,830838450152734721,https://twitter.com/itsabdurrahman/status/830838450152734721
2017-02-12 17:58:16,BlueFoxNews,,0,0,0,"Swansea City 2 Leicester City 0: Relegation rivals pile pressure on Ranieri (http://Sportal.co.nz ) http://ift.tt/2l40uHX",,,,830838445446676480,https://twitter.com/BlueFoxNews/status/830838445446676480
2017-02-12 17:58:15,BlueFoxNews,,0,0,0,"Swansea City 2-0 Leicester City: Pressure mounts on struggling champions (Sporting News) http://ift.tt/2l41kEC",,,,830838442288361473,https://twitter.com/BlueFoxNews/status/830838442288361473
2017-02-12 17:58:15,BlueFoxNews,,0,0,0,"Swansea City 2-0 Leicester City: Foxes continue plunge as Swans clear drop (ProSoccerTalk) http://ift.tt/2lERHts",,,,830838440816148480,https://twitter.com/BlueFoxNews/status/830838440816148480
2017-02-12 17:58:14,BlueFoxNews,,0,0,0,"Swansea City v Leicester City: Premier League – live! – The Guardian (News http://Informer.info ) http://ift.tt/2l40ojJ",,,,830838438362542081,https://twitter.com/BlueFoxNews/status/830838438362542081
2017-02-12 17:58:12,eSportsFansClub,,0,0,0,"#PL – Result: Swansea City 2-0 Leicester City #SFZ",,,#PL #SFZ,830838430582046721,https://twitter.com/eSportsFansClub/status/830838430582046721
2017-02-12 17:58:10,Mr_McFresh,,0,0,0,"what has happened to Leicester City?",,,,830838419668496384,https://twitter.com/Mr_McFresh/status/830838419668496384
2017-02-12 17:58:09,neilscott02,,0,0,0,"Leicester city ffs",,,,830838418640867329,https://twitter.com/neilscott02/status/830838418640867329
2017-02-12 17:58:09,MichKatami,,0,0,1,"Defending champions going down each game. It can't get worse for Leicester City, another defeat..",,,,830838416178814976,https://twitter.com/MichKatami/status/830838416178814976
2017-02-12 17:58:06,FPLUpdates_Tips,,0,0,3,"Full Time !! Swansea City FC 2 -- 0 Leicester City FC Scorers : Mawson , Olsson Assists : Fernandez , Sigurdsson... http://fb.me/5HrtwQBtq",,,,830838404313128960,https://twitter.com/FPLUpdates_Tips/status/830838404313128960
2017-02-12 17:58:02,OptaJoke,,8,246,361,"117,181 - Number of people who are delighted they only supported Leicester City last season and can go back to supporting Chelsea. Foxed.",,,,830838385614929925,https://twitter.com/OptaJoke/status/830838385614929925
2017-02-12 17:57:57,sadeeqdahiru,,0,0,0,"@Jamal_Tahir22 Leicester City will be relegated if they continue playing shit.",,@Jamal_Tahir22,,830838367206137857,https://twitter.com/sadeeqdahiru/status/830838367206137857
2017-02-12 17:57:57,TracyFirm,,0,0,0,"#foxesneverquit only 1pt outside of relegation #leicestercity",,,#foxesneverquit #leicestercity,830838365251633159,https://twitter.com/TracyFirm/status/830838365251633159
2017-02-12 17:57:53,JYash,,0,0,0,"Leicester City just 1 point clear of the dreaded relegation zone. From rags to riches back to rags again?",,,,830838349946564609,https://twitter.com/JYash/status/830838349946564609
2017-02-12 17:57:51,TimeAddedOn91,,0,1,0,"Leicester City are the only team in the top 4 divisions without a league goal in 2017... The champions of England! #LCFC #SWALEI",,,#LCFC #SWALEI,830838341004357633,https://twitter.com/TimeAddedOn91/status/830838341004357633
2017-02-12 17:57:51,KeithRacingtips,,0,0,0,"Swansea City 2-0 Leicester City http://www.bbc.co.uk/sport/football/38871532 …",,,,830838340878483456,https://twitter.com/KeithRacingtips/status/830838340878483456
2017-02-12 17:57:48,deanallum,,0,0,0,"The possibility of the #PremierLeague Champions could get relegated the following season becomes more likely each week #Leicestercity",,,#PremierLeague #Leicestercity,830838328027205635,https://twitter.com/deanallum/status/830838328027205635
2017-02-12 17:57:46,JinaduOladimeji,,0,0,0,"Leicester city can't even try to defend their EPL title, what a shame. https://twitter.com/skyfootball/status/830819663231610881 …",,,,830838319516876805,https://twitter.com/JinaduOladimeji/status/830838319516876805
2017-02-12 17:57:43,lcfcbuzztap,,0,0,0,"nbcsports .com >> Swansea City 2-0 Leicester City: Foxes continue plunge as Swans clear drop http://buzztap.com/-k35fc1",,,,830838309203148801,https://twitter.com/lcfcbuzztap/status/830838309203148801
2017-02-12 17:57:43,swanseabuzztap,,0,0,0,"nbcsports .com >> Swansea City 2-0 Leicester City: Foxes continue plunge as Swans clear drop http://buzztap.com/-k35fc1",,,,830838307793805313,https://twitter.com/swanseabuzztap/status/830838307793805313
2017-02-12 17:57:36,Omodon,,0,1,5,"I love Ranieri and what he did for Leicester City last season but he has to realise he is taking us down by sticking with a losing team.",,,,830838279717187584,https://twitter.com/Omodon/status/830838279717187584
2017-02-12 17:57:36,KC_Gosso,,0,0,0,"For Leicester City it has gone from anticipating to win the PL and winning it to battling Relegation. 1year not a long time for Soccer.",,,,830838279507496964,https://twitter.com/KC_Gosso/status/830838279507496964
2017-02-12 17:57:32,poojaambani,,0,0,0,"Premier League: Swansea City beat defending champions Leicester City 2-0, table-toppers Chelsea draw 1-1 vs Burnley",,,,830838262566678530,https://twitter.com/poojaambani/status/830838262566678530
2017-02-12 17:57:31,TumzaYDN,,0,0,0,"Leicester City is a proof that EPL is not the best in the world, but ONLY the most entertaining....too much inconsistency.",,,,830838257390858241,https://twitter.com/TumzaYDN/status/830838257390858241
2017-02-12 17:57:30,OluwaBliN,,0,0,0,"Leicester city might relegate yo !",,,,830838253913772032,https://twitter.com/OluwaBliN/status/830838253913772032
2017-02-12 17:57:17,opiopat,,0,0,0,"Will Ranieri survive the sack? #LeicesterCity",,,#LeicesterCity,830838197357858817,https://twitter.com/opiopat/status/830838197357858817
2017-02-12 17:57:17,osayidv,,0,0,0,"Leicester City are really in big trouble. 21 points from 25 games..hmmm",,,,830838196930019328,https://twitter.com/osayidv/status/830838196930019328
2017-02-12 17:57:12,MUnited_Forever,,0,0,0,"Leicester City are a sinking ship. This is so sad.",,,,830838178953228289,https://twitter.com/MUnited_Forever/status/830838178953228289
2017-02-12 17:57:06,VeronicaCommey,,6,3,2,"What could really be happening to Leicester City? Champions one season and near relegation few months on just like that?",,,,830838152453566464,https://twitter.com/VeronicaCommey/status/830838152453566464
2017-02-12 17:57:05,Magicman1980,,0,0,1,"Leicester city fans + this season = huge reality check.",,,,830838147974045696,https://twitter.com/Magicman1980/status/830838147974045696
2017-02-12 17:57:03,SteveCornforth2,,0,0,1,"The struggles of #leicestercity just show what a remarkable achievement last season was",,,#leicestercity,830838138461364224,https://twitter.com/SteveCornforth2/status/830838138461364224
2017-02-12 17:57:03,joelboniawotwi,,0,0,0,"Gotta feel for Leicester City! No #PL goal in 2017 and relegation is smiling at them #SWALEI",,,#PL #SWALEI,830838138369142787,https://twitter.com/joelboniawotwi/status/830838138369142787
2017-02-12 17:57:02,PlayerProSoccer,,0,2,4,"Swansea City have defeated Leicester City 2-0. This leaves the Premier League Champions 1 point away from relegation in 17th place. pic.twitter.com/wzKZdsrjbc",,,,830838137291153408,https://twitter.com/PlayerProSoccer/status/830838137291153408
2017-02-12 17:57:01,LeeDyer91,,0,1,1,"Leicester City Are Shit, Can't Even Bag A Goal, Players Like Mahrez And Vardy Are Struggling This Year...Should Left, Blew There Chance Now",,,,830838131733708800,https://twitter.com/LeeDyer91/status/830838131733708800
2017-02-12 17:57:01,sabarnes13,,0,0,0,"Time for @GaryLineker to come out of retirement to save Leicester City FC?",,@GaryLineker,,830838131259764738,https://twitter.com/sabarnes13/status/830838131259764738
2017-02-12 17:56:59,OSOgunleye,,0,0,1,"This time last season, it was Leicester City could win the league. This time this season, we are nw saying Liecester City could be relegated",,,,830838124204916736,https://twitter.com/OSOgunleye/status/830838124204916736
2017-02-12 17:56:55,FreyFox87,,0,0,1,"If it weren't for the fact that Leicester City were EPL champions last year, Claudio Ranieri would have been sacked by now.",,,,830838106551091200,https://twitter.com/FreyFox87/status/830838106551091200
2017-02-12 17:56:54,aliyu_figo,,0,0,0,"Leicester City sorry oo",,,,830838101429911554,https://twitter.com/aliyu_figo/status/830838101429911554
2017-02-12 17:56:50,IRNRadioNews,,0,1,1,"At 6 with Charlie - Leicester City and John Bercow are both in trouble.",,,,830838087148326914,https://twitter.com/IRNRadioNews/status/830838087148326914
2017-02-12 17:56:48,tundealuko,,0,0,0,"Leicester City from Champions to relegation fight, let's they win the Champions league to ease the pain",,,,830838075441999872,https://twitter.com/tundealuko/status/830838075441999872
2017-02-12 17:56:47,SMLeicester,,0,0,0,"FULL-TIME: Swansea City 2-0 Leicester City #swans #lcfc",,,#swans #lcfc,830838072434688005,https://twitter.com/SMLeicester/status/830838072434688005
2017-02-12 17:56:47,oge_jenny,,1,0,0,"5th straight defeat now for Leicester City",,,,830838072023584768,https://twitter.com/oge_jenny/status/830838072023584768
2017-02-12 17:56:47,SMSwansea,,0,0,0,"FULL-TIME: Swansea City 2-0 Leicester City #swans #lcfc",,,#swans #lcfc,830838071256084480,https://twitter.com/SMSwansea/status/830838071256084480
2017-02-12 17:56:45,TehSmiithy,,0,0,0,"The Champions havent scored a premier league goal in 2017. Lets that sink in #lufc #Leicester #leicestercity",,,#lufc #Leicester #leicestercity,830838065786667009,https://twitter.com/TehSmiithy/status/830838065786667009
2017-02-12 17:56:42,ElysiumCross,,0,0,0,"Go to the dictionary look under ROCK BOTTOM...you will see LEICESTER CITYS picture #leicestercity #EPL #PremierLeague #SwanseaCity",,,#leicestercity #EPL #PremierLeague #SwanseaCity,830838052859871234,https://twitter.com/ElysiumCross/status/830838052859871234
2017-02-12 17:56:38,BenedictSikwazo,,0,0,0,"Friends of Leicester City until the end",,,,830838035713515520,https://twitter.com/BenedictSikwazo/status/830838035713515520
2017-02-12 17:56:37,RINZOID,,0,1,0,"Leicester City going the way of Blackburn Rovers..from Champions to Relegation???",,,,830838030005129216,https://twitter.com/RINZOID/status/830838030005129216
2017-02-12 17:56:32,kayin11,,0,0,0,"Leicester city can't catch a break...they are on their way down!. #plfanzone",,,#plfanzone,830838010920968193,https://twitter.com/kayin11/status/830838010920968193
2017-02-12 17:56:31,lcfcbuzztap,,0,0,0,"sportingnews .com >> Swansea City 2-0 Leicester City: Pressure mounts on struggling champions http://buzztap.com/-8q7Gnl",,,,830838003954282496,https://twitter.com/lcfcbuzztap/status/830838003954282496
2017-02-12 17:56:31,Mr_AlVil,,0,0,0,"FULL TIME: Swansea 2 Leicester City 0 Relegation fears grow for the Premier League champions… https://twitter.com/i/web/status/830837048860897280 …",,,,830838003937472512,https://twitter.com/Mr_AlVil/status/830838003937472512
2017-02-12 17:56:30,swanseabuzztap,,0,0,0,"sportingnews .com >> Swansea City 2-0 Leicester City: Pressure mounts on struggling champions http://buzztap.com/-8q7Gnl",,,,830838002716987392,https://twitter.com/swanseabuzztap/status/830838002716987392
2017-02-12 17:56:27,Rogerdavis22,,0,0,0,"Leicester City are dead man. Their squad looks to have given up IMO. #SWALEI",,,#SWALEI,830837990914215937,https://twitter.com/Rogerdavis22/status/830837990914215937
2017-02-12 17:56:25,Jon_gooner,,0,1,0,"Leicester City doing everything they can to get a sequel to their movie.",,,,830837982097727488,https://twitter.com/Jon_gooner/status/830837982097727488
2017-02-12 17:56:23,CitiSportsGHA,,0,7,12,"FT: Swansea 2-0 Leicester City [Mawson, Olsson] #CitiSportspic.twitter.com/mXgASSjJpH",,,#CitiSportspic,830837974422130688,https://twitter.com/CitiSportsGHA/status/830837974422130688
2017-02-12 17:56:23,OlJohnnyRockets,,0,0,0,"FT - Swansea City 2-0 Leicester City (ESPN) http://ift.tt/1NKZUVZ",,,,830837970496258048,https://twitter.com/OlJohnnyRockets/status/830837970496258048
2017-02-12 17:56:19,ElliottSales1,,0,2,20,"No matter how bad we are, I don't see how you can sack a bloke who won Leicester city the premier league",,,,830837957389119489,https://twitter.com/ElliottSales1/status/830837957389119489
2017-02-12 17:56:17,adexpac007,,0,0,0,"#LeicesterCity has not scores any league goal in 2017?.",,,#LeicesterCity,830837949034012672,https://twitter.com/adexpac007/status/830837949034012672
2017-02-12 17:56:16,RunRideDive,,0,0,2,"Leicester City are in freefall",,,,830837943342358531,https://twitter.com/RunRideDive/status/830837943342358531
2017-02-12 17:56:16,MWinni,,0,0,0,"Leicester City with another terrible performance. #PremierLeague",,,#PremierLeague,830837943271038979,https://twitter.com/MWinni/status/830837943271038979
2017-02-12 17:56:14,Khutso_26,,0,2,0,"Leicester City management must make tough decisions before it's too late if it's not late already",,,,830837936216297474,https://twitter.com/Khutso_26/status/830837936216297474
2017-02-12 17:56:12,Papa_Kwesi_,,0,0,0,"Leicester city make loose pass oversized bra",,,,830837926711980033,https://twitter.com/Papa_Kwesi_/status/830837926711980033
2017-02-12 17:56:03,FoxesNews,,0,0,0,"#Leicester #LeicesterCity #LCFC Stats: Swansea City v Leicester http://dld.bz/fyuBw",,,#Leicester #LeicesterCity #LCFC,830837887377747970,https://twitter.com/FoxesNews/status/830837887377747970
2017-02-12 17:56:01,AndrewPassaro,,0,1,0,"#SoccerSunday with @willtidey kicks off at 1pm ET. Are Leicester City going to be relegated? 877 629 4614",,@willtidey,#SoccerSunday,830837880805285888,https://twitter.com/AndrewPassaro/status/830837880805285888
2017-02-12 17:56:01,SiriusXMFC,,3,1,3,"#SoccerSunday with @willtidey kicks off at 1pm ET. Are Leicester City going to be relegated? 877 629 4614",,@willtidey,#SoccerSunday,830837880750800897,https://twitter.com/SiriusXMFC/status/830837880750800897
2017-02-12 17:56:00,La5tadelfutbol,,0,0,0,"#PremierLeague Fecha 25 Swansea 2 (Mawson 37' Olsson 45') 0 Leicester City",,,#PremierLeague,830837875704991745,https://twitter.com/La5tadelfutbol/status/830837875704991745
2017-02-12 17:55:58,elevenfalse9s,,0,0,0,"I blame this Leicester City slump on all those fake fan boys hyping them up making them think they were any good.",,,,830837869275123712,https://twitter.com/elevenfalse9s/status/830837869275123712
2017-02-12 17:55:58,Chikaakanoh,,0,0,0,"Leicester City and their relegation prone performances, Will they be relegated?",,,,830837866234273793,https://twitter.com/Chikaakanoh/status/830837866234273793
2017-02-12 17:55:56,kicsho,,0,0,2,"Yooo Leicester city take that L #SWALEI",,,#SWALEI,830837858734841856,https://twitter.com/kicsho/status/830837858734841856
2017-02-12 17:55:53,colossalblue,,1,0,0,"What a thoroughly depressing time to be a Leicester City fan. Demarai Gray is going to tear apart championship defences next season though.",,,,830837848009998336,https://twitter.com/colossalblue/status/830837848009998336
2017-02-12 17:55:52,FifthPenalty,,0,0,0,"Leicester City are just one point away from relegation zone.",,,,830837840518877184,https://twitter.com/FifthPenalty/status/830837840518877184
2017-02-12 17:55:49,AlexHunter010,,0,0,0,"RT if you don't want to see Leicester city goes to Premiership",,,,830837829248905217,https://twitter.com/AlexHunter010/status/830837829248905217
2017-02-12 17:55:49,LiveLCFC,,3,0,1,"FULL-TIME: Swansea 2-0 Leicester City Another away defeat for #LCFC. http://www.leicestermercury.co.uk/swansea-v-leicester-city-8211-premier-league-live-team-news-score-goals-from-liberty-stadium/story-30130393-detail/story.html …",,,#LCFC,830837828120616960,https://twitter.com/LiveLCFC/status/830837828120616960
2017-02-12 17:55:47,Gustavospeaks,,0,0,1,"Leicester City still has not scored a single league goal in 2017. Unbelievable.",,,,830837822454132737,https://twitter.com/Gustavospeaks/status/830837822454132737
2017-02-12 17:55:47,tytyloye,,0,0,0,"Leicester city Champions - Championship,Triumphant entry to Audacious exit the untold story of DeKante... PL aint no beans top4 na luxury",,,,830837820998574081,https://twitter.com/tytyloye/status/830837820998574081
2017-02-12 17:55:47,KylewhiteNew,,2,0,0,"Leicester city to win the champions league",,,,830837820306620419,https://twitter.com/KylewhiteNew/status/830837820306620419
