date,username,to,replies,retweets,favorites,text,geo,mentions,hashtags,id,permalink
2017-02-12 17:35:45,sirberry,,0,1,0,"Not sure if Leicester City or Chelsea FC",,,,830832781055950850,https://twitter.com/sirberry/status/830832781055950850
2017-02-12 17:35:31,WiltTheStilt5,,0,0,0,"Leicester City might actually get relegated",,,,830832723048669186,https://twitter.com/WiltTheStilt5/status/830832723048669186
2017-02-12 17:35:28,TheReal_Hafeez,,0,0,0,"Hmmmmmm ""@dijiaderoGBA: In case you have forgotten, Leicester City won EPL last season...""",,@dijiaderoGBA,,830832710490918912,https://twitter.com/TheReal_Hafeez/status/830832710490918912
2017-02-12 17:35:27,RichClif_8020,,0,0,0,"Leicester City is like someone who a Lottery jackpot then money runs dry....now life is more bad than before lol",,,,830832705172549632,https://twitter.com/RichClif_8020/status/830832705172549632
2017-02-12 17:35:26,themartinsamuel,,1,1,1,"Can Claudio Ranieri keep #Leicester City up this season? #lcfc",,,#Leicester #lcfc,830832698172305410,https://twitter.com/themartinsamuel/status/830832698172305410
2017-02-12 17:35:19,TAWFCorkrey,,0,0,2,"Unbelievable how bad Leicester city look",,,,830832669512581120,https://twitter.com/TAWFCorkrey/status/830832669512581120
2017-02-12 17:35:16,Team_NigeriaUK,,0,0,0,"#Repost fcpremierleague with @repostapp ・・・ LIVE: #SwanseaCity 2-0 #LeicesterCity #Olsson @… https://www.instagram.com/p/BQa4zHHB5P6/",,@repostapp @,#Repost #SwanseaCity #LeicesterCity #Olsson,830832657516761088,https://twitter.com/Team_NigeriaUK/status/830832657516761088
2017-02-12 17:35:10,Mohsaad__,,0,9,0,"Life is like Leicester city, on top yesterday, at the bottom today. So be wise",,,,830832634766958592,https://twitter.com/Mohsaad__/status/830832634766958592
2017-02-12 17:35:07,DaROYALemperor,,0,0,0,"Leicester city can't avoid relegation for sure!!",,,,830832619277402113,https://twitter.com/DaROYALemperor/status/830832619277402113
2017-02-12 17:34:59,JGrytheFireGuy,,2,0,2,"It just baffles me how bad Leicester City is this year.",,,,830832588789051392,https://twitter.com/JGrytheFireGuy/status/830832588789051392
2017-02-12 17:34:54,alexbussani,,0,0,2,"Sad times for Leicester City. Looks like the champions are well on their way to relegation. (Strange thing to type.) #LCFC",,,#LCFC,830832567771348995,https://twitter.com/alexbussani/status/830832567771348995
2017-02-12 17:34:54,Ernestekow,,0,0,0,"Leicester city going back to where they came from",,,,830832567389663233,https://twitter.com/Ernestekow/status/830832567389663233
2017-02-12 17:34:54,1dNAGh,Pimp_Fada,0,0,0,"So if he had left no one would have sang his name ? Leicester city ? Lmao kante won't be remembered ? I see @Pimp_Fada @Nana_Agyei_",,@Pimp_Fada @Nana_Agyei_,,830832566584410112,https://twitter.com/1dNAGh/status/830832566584410112
2017-02-12 17:34:54,sirberry,,0,1,0,"Leicester City breaking a 67 years old Chelsea's record today.. 5 consecutive defeats as defending champions!",,,,830832564072017920,https://twitter.com/sirberry/status/830832564072017920
2017-02-12 17:34:51,REALMatthewJr,,0,0,0,"Tota it's late for Leicester City",,,,830832552994697217,https://twitter.com/REALMatthewJr/status/830832552994697217
2017-02-12 17:34:34,shathik_basha,,0,0,0,"Leicester city players first touch very awful !!",,,,830832482064986112,https://twitter.com/shathik_basha/status/830832482064986112
2017-02-12 17:34:33,Ernestekow,,1,0,3,"I feel for Leicester city",,,,830832477673500672,https://twitter.com/Ernestekow/status/830832477673500672
2017-02-12 17:34:27,NawiAndLater,,0,0,3,"Leicester City are really breaking my heart this year. It would honestly suck a lot if they got relegated.",,,,830832451433934850,https://twitter.com/NawiAndLater/status/830832451433934850
2017-02-12 17:34:21,tyrex_thabz,,0,0,0,"I feel sorry for Leicester City this season. Relegation all the way up",,,,830832429355110401,https://twitter.com/tyrex_thabz/status/830832429355110401
2017-02-12 17:34:20,themartinsamuel,,0,2,4,"Leicester City 2-0 down... Desperately need a goal... Relegation 6 pointer...... Ranieri brings on a centre half. #lcfc #swalei",,,#lcfc #swalei,830832423453745152,https://twitter.com/themartinsamuel/status/830832423453745152
2017-02-12 17:34:14,Obipat121,,0,0,0,"How did Leicester City win the EPL?",,,,830832399256780800,https://twitter.com/Obipat121/status/830832399256780800
2017-02-12 17:33:48,IamLtkWarric,,0,0,0,"Leicester City, oh boy",,,,830832287902203904,https://twitter.com/IamLtkWarric/status/830832287902203904
2017-02-12 17:33:42,AshroseUK,,2,1,1,"Leicester City and the worlds worst title hangover #SWALEI",,,#SWALEI,830832263814340616,https://twitter.com/AshroseUK/status/830832263814340616
2017-02-12 17:33:41,soufyane_1987,,0,0,0,"Swansea vs Leicester City 2 0 Goal Premier League 12 02 2017 hinglignt: http://youtu.be/bJFG9l7Xxrg?a via @YouTube",,@YouTube,,830832261369102337,https://twitter.com/soufyane_1987/status/830832261369102337
2017-02-12 17:33:21,majorly_vext,,0,0,0,"Sack Ranieri and stay up or stick with him and go down for the sake of sentiment?? ""Leicester City""",,,,830832174001709056,https://twitter.com/majorly_vext/status/830832174001709056
2017-02-12 17:33:14,SpeshZondo,,0,0,0,"Leicester City are trash this season.",,,,830832144918384642,https://twitter.com/SpeshZondo/status/830832144918384642
2017-02-12 17:33:10,footballpools,footballpools,0,2,3,"It doesn't explain the other 10 Leicester City players though...",,,,830832128938143744,https://twitter.com/footballpools/status/830832128938143744
2017-02-12 17:33:05,IamLekanBalo,,0,0,0,"This is d Leicester city i know.",,,,830832109195505665,https://twitter.com/IamLekanBalo/status/830832109195505665
2017-02-12 17:33:05,SiggeeStardust,,1,1,2,"Leicester City must have been doing more juice than Tropicana last season. #SWALEI",,,#SWALEI,830832107496824834,https://twitter.com/SiggeeStardust/status/830832107496824834
2017-02-12 17:33:01,artsynihon,,0,0,0,"Brandon Phillips , #LCFC , #HackLearning , Burnley , #WWEChamber , Leicester City , Chris Ruddy , Swansea , #cwpchat",,,#LCFC #HackLearning #WWEChamber #cwpchat,830832092023906305,https://twitter.com/artsynihon/status/830832092023906305
2017-02-12 17:32:55,kwasinom,,0,1,3,"I just remembered why I was watching the Swansea v Leicester City match. Jordan Ayew comes on in the 72nd minute making his debut 4 Swansea",,,,830832065662812160,https://twitter.com/kwasinom/status/830832065662812160
2017-02-12 17:32:51,manuseb,,0,0,0,"Leicester City ""Kante"" get a break #Relegation #PremierLeague #SWALEIpic.twitter.com/MDwxMsPAoB",,,#Relegation #PremierLeague #SWALEIpic,830832049187672064,https://twitter.com/manuseb/status/830832049187672064
2017-02-12 17:32:47,rtgunn,,0,0,0,"Wow, just turn on the TV and see Swansea 2-0 Leicester City. That's crazy",,,,830832032167116800,https://twitter.com/rtgunn/status/830832032167116800
2017-02-12 17:32:36,WSPate,,0,0,0,"#Vardy is having a poor run, but, who knows, next season he could challenge for @SkyBetChamp Player of the Year. #SWALEI #leicestercity",,@SkyBetChamp,#Vardy #SWALEI #leicestercity,830831985501274114,https://twitter.com/WSPate/status/830831985501274114
2017-02-12 17:32:33,adamsnewtonwill,LCFC,0,0,0,"Leicester City. Championship. https://twitter.com/lcfc/status/727240110920577024 …",,,,830831974096973827,https://twitter.com/adamsnewtonwill/status/830831974096973827
2017-02-12 17:32:32,davidcopeland75,,0,0,0,"Who has been the biggest let down for Leicester City this season?",,,,830831971567796224,https://twitter.com/davidcopeland75/status/830831971567796224
2017-02-12 17:32:29,phemy_lala,,0,0,0,"#SWALEI Its an awful display from #leicestercity team.",,,#SWALEI #leicestercity,830831958594875398,https://twitter.com/phemy_lala/status/830831958594875398
2017-02-12 17:32:28,davidcarnall23,,0,1,0,"Lack of ideas,lack of quality,lack of fight,lack of anything. Such a shame for Leicester city. @GaryLineker what's gone wrong ?",,@GaryLineker,,830831954182492161,https://twitter.com/davidcarnall23/status/830831954182492161
2017-02-12 17:32:23,koora_Algerie,,0,0,1,"#algeria #الجزائر (En cours) Swensea 2 – Leicester City 0 (Mahrez et Slimani) http://www.koora-news.net/108056",,,#algeria #الجزائر,830831934586642432,https://twitter.com/koora_Algerie/status/830831934586642432
2017-02-12 17:32:22,mdizz_,,0,0,0,"what happened to leicester city brah ://",,,,830831926491672576,https://twitter.com/mdizz_/status/830831926491672576
2017-02-12 17:32:17,its_chusi,,0,0,0,"Sugar, we're going down - Leicester City",,,,830831908955230208,https://twitter.com/its_chusi/status/830831908955230208
2017-02-12 17:32:17,StevenHector3,,1,0,1,"Leicester city.vardy rejected #Arsenal",,,#Arsenal,830831905604063232,https://twitter.com/StevenHector3/status/830831905604063232
2017-02-12 17:32:00,DiStarrEnu,,0,0,0,"Leicester City should have used Chelsea as a blueprint. Loyalty to certain players is costing them.",,,,830831835521363968,https://twitter.com/DiStarrEnu/status/830831835521363968
2017-02-12 17:31:46,MrOmsboy,,0,0,0,"Leicester City have become so bad it's not even cute anymore!",,,,830831777010839552,https://twitter.com/MrOmsboy/status/830831777010839552
2017-02-12 17:31:43,iMike_93,,0,0,0,"What would happen if Leicester City get relegated but win the Champions League? Do they keep a spot in the Prem?",,,,830831765656915972,https://twitter.com/iMike_93/status/830831765656915972
2017-02-12 17:31:38,Najeebwali_,,0,0,0,"Leicester City are going down, it's time to poach Mahrez for 15M.",,,,830831745570320385,https://twitter.com/Najeebwali_/status/830831745570320385
2017-02-12 17:31:34,majorly_vext,,0,0,0,"Why play a big man up front if you don't pass to him ""Leicester City""",,,,830831726909874177,https://twitter.com/majorly_vext/status/830831726909874177
2017-02-12 17:31:33,BetsOnAllFooty,,0,3,3,"Leicester City last season vs. Leicester City this season. pic.twitter.com/QuBi2YvDRG",,,,830831723462197251,https://twitter.com/BetsOnAllFooty/status/830831723462197251
2017-02-12 17:31:28,durhamchris1983,,0,0,0,"Leicester City look absolutely appalling #SWALEI",,,#SWALEI,830831702528368640,https://twitter.com/durhamchris1983/status/830831702528368640
2017-02-12 17:31:23,KleinJasklein2,,0,1,1,"Leicester City is a joke this year!!!!",,,,830831680210472960,https://twitter.com/KleinJasklein2/status/830831680210472960
2017-02-12 17:31:22,Semi_Retard,,0,0,0,"Leicester City is so stagnant while in possession of the ball.",,,,830831676850917378,https://twitter.com/Semi_Retard/status/830831676850917378
2017-02-12 17:31:22,Gavin_Connor,,0,0,0,"Leicester City Football Club!",,,,830831675655458817,https://twitter.com/Gavin_Connor/status/830831675655458817
2017-02-12 17:31:19,phil_delcielo,,0,0,2,"Reports suggest that 65% of last season's Leicester City ""fans"" now support Chelsea.",,,,830831665165529088,https://twitter.com/phil_delcielo/status/830831665165529088
2017-02-12 17:31:16,wyngatez,,0,0,0,"#SWALEI it's rather unfortunate the way it's going for Leicester City. Gonna be a big crime committed to the PL.",,,#SWALEI,830831653312409600,https://twitter.com/wyngatez/status/830831653312409600
2017-02-12 17:31:15,BettracksScores,,0,0,0,"Substitution On - Jordan Ayew (Swansea City 2 - 0 Leicester City)",,,,830831646719037444,https://twitter.com/BettracksScores/status/830831646719037444
2017-02-12 17:31:14,meisterbuerger,,0,0,0,"How many Premier League teams have won the title one year and been relegated the next? #LeicesterCity",,,#LeicesterCity,830831644676349952,https://twitter.com/meisterbuerger/status/830831644676349952
2017-02-12 17:31:14,BettracksScores,,0,0,0,"Substitution Off - Fernando Llorente (Swansea City 2 - 0 Leicester City)",,,,830831643409645569,https://twitter.com/BettracksScores/status/830831643409645569
2017-02-12 17:31:01,Team_NigeriaUK,,0,0,0,"#Repost fcpremierleague with @repostapp ・・・ LIVE: #SwanseaCity 1-0 #LeicesterCity #Mawson @… https://www.instagram.com/p/BQa4UNnhpdO/",,@repostapp @,#Repost #SwanseaCity #LeicesterCity #Mawson,830831589055553536,https://twitter.com/Team_NigeriaUK/status/830831589055553536
2017-02-12 17:30:58,DP_tweets,,0,0,1,"Oh how people laughed at me last June when I said I was going to put twenty quid on Leicester City to get relegated.",,,,830831576334344192,https://twitter.com/DP_tweets/status/830831576334344192
2017-02-12 17:30:54,leirbriseadh,,0,0,0,"Leicester City looks nothing like the winning team of last year. Can't imagine winning it all to relegation in a single season. #EPL",,,#EPL,830831557501939712,https://twitter.com/leirbriseadh/status/830831557501939712
2017-02-12 17:30:53,Kgopiso316,,0,0,0,"What happened last season was a fluke. Leicester City is nothing. #EPL",,,#EPL,830831553253146624,https://twitter.com/Kgopiso316/status/830831553253146624
2017-02-12 17:30:42,DavidWa50046817,harry19631956,1,0,1,"The Leicester City players have let Ranieri down this season!",,,,830831510919974920,https://twitter.com/DavidWa50046817/status/830831510919974920
2017-02-12 17:30:34,mattfoster2010,TeltheTrekkie,1,0,0,"leicester city are still losing",,,,830831474718945281,https://twitter.com/mattfoster2010/status/830831474718945281
2017-02-12 17:30:29,KenKiberenge,,0,1,0,"Poor Leicester City.",,,,830831455605497856,https://twitter.com/KenKiberenge/status/830831455605497856
2017-02-12 17:30:26,GinoGallizzi,,0,0,0,"Sevilla -200 to advance vs Leicester city seems like a bargain in UCL",,,,830831440422055936,https://twitter.com/GinoGallizzi/status/830831440422055936
2017-02-12 17:30:25,LekomboiJnr,,0,0,0,"What a time to be alive, Leicester City winning the league, apparently they get relegated the following season.",,,,830831437058342912,https://twitter.com/LekomboiJnr/status/830831437058342912
2017-02-12 17:30:20,blindcobbler,,2,0,2,"Everyone connected with Leicester City Football Club should be put in the stocks. And egged to fuck.",,,,830831416707518465,https://twitter.com/blindcobbler/status/830831416707518465
2017-02-12 17:30:15,Iam_SuperTed,,0,0,0,"This is what happens when after winning the league you sell Kante and make Musa your record signing! #leicestercity",,,#leicestercity,830831396692193280,https://twitter.com/Iam_SuperTed/status/830831396692193280
2017-02-12 17:30:14,Craigdono,,1,0,0,"Leicester City look a cert to go down",,,,830831390140854274,https://twitter.com/Craigdono/status/830831390140854274
2017-02-12 17:30:02,Crusemissile78,,0,0,1,"The bubble has well and truly burst, something now very wrong at Leicester City. Relegation fodder #SWALEI",,,#SWALEI,830831340694228992,https://twitter.com/Crusemissile78/status/830831340694228992
2017-02-12 17:29:56,Mufasa_0fficial,,0,0,1,"Leicester city winning the league is like homeless crack head winning the lottery. Nothing to show for their outstanding season",,,,830831316723720192,https://twitter.com/Mufasa_0fficial/status/830831316723720192
2017-02-12 17:29:55,Largeelarge,,0,1,0,"Leicester City never wan sack Ranieri. Them dey play with relegation ooh",,,,830831313259212800,https://twitter.com/Largeelarge/status/830831313259212800
2017-02-12 17:29:52,seandavids,,0,0,0,"Leicester City approaching relegation like a crash-landing jet.",,,,830831297417314304,https://twitter.com/seandavids/status/830831297417314304
2017-02-12 17:29:36,batl50,,0,0,0,"If I was Ranieri then I would resign from #leicestercity. Don't let the story end in being fired...",,,#leicestercity,830831232531456000,https://twitter.com/batl50/status/830831232531456000
2017-02-12 17:29:34,GoalESLFeed,,0,0,0,"Leicester City sub: Simpson off, Amartey on! #sub",,,#sub,830831223090114561,https://twitter.com/GoalESLFeed/status/830831223090114561
2017-02-12 17:29:34,fantasyiteam,,0,0,1,"Leicester City sub: Simpson off, Amartey on! #sub",,,#sub,830831222796537858,https://twitter.com/fantasyiteam/status/830831222796537858
2017-02-12 17:29:34,FiTEPLFeed,,0,0,0,"Leicester City sub: Simpson off, Amartey on! #sub",,,#sub,830831222771351552,https://twitter.com/FiTEPLFeed/status/830831222771351552
2017-02-12 17:29:33,MatyMak,,0,0,0,"What's happening with Leicester City is what will happen to Orlando Pierats one day #SSDiski",,,#SSDiski,830831219751391232,https://twitter.com/MatyMak/status/830831219751391232
2017-02-12 17:29:23,Liam_Frost86,,0,0,0,"I can't wait to see that Jamie Vardy film sequel:- 'From Champions League to Oakwell' #SWALEI #leicestercity",,,#SWALEI #leicestercity,830831178898931713,https://twitter.com/Liam_Frost86/status/830831178898931713
2017-02-12 17:29:21,BettracksScores,,0,0,0,"Substitution On - Daniel Amartey (Swansea City 2 - 0 Leicester City)",,,,830831170724171778,https://twitter.com/BettracksScores/status/830831170724171778
2017-02-12 17:29:21,fairlyodd_tweet,,0,0,0,"@EdWoodwardCEO get Demari Gray from Leicester city before our rivals do the guy has pure talent",,@EdWoodwardCEO,,830831168648048641,https://twitter.com/fairlyodd_tweet/status/830831168648048641
2017-02-12 17:29:21,BettracksScores,,0,0,0,"Substitution Off - Danny Simpson (Swansea City 2 - 0 Leicester City)",,,,830831167574269953,https://twitter.com/BettracksScores/status/830831167574269953
2017-02-12 17:29:07,LLMaranya,,0,5,9,"Leicester City are making my name look bad",,,,830831109676085250,https://twitter.com/LLMaranya/status/830831109676085250
2017-02-12 17:29:00,HarryTheHammer_,,0,0,1,"Leicester City FC: One season wonder, Jamie Vardy: One season wonder, Riyad Mahrez: One season wonder and so on...",,,,830831081389686784,https://twitter.com/HarryTheHammer_/status/830831081389686784
2017-02-12 17:28:55,sincityMd,,0,0,0,"Leicester city have lost their fight .... The reality is gradually sinking in ....",,,,830831058476150784,https://twitter.com/sincityMd/status/830831058476150784
2017-02-12 17:28:45,kingbrag,,0,0,0,"Swansea City v Leicester City: Premier League – live! https://www.theguardian.com/football/live/2017/feb/12/swansea-city-v-leicester-city-premier-league-live?CMP=share_btn_tw …",,,,830831019523706880,https://twitter.com/kingbrag/status/830831019523706880
2017-02-12 17:28:36,duncanjones64,,0,0,6,"Not sure Leicester City are going to successfully defend their #PremierLeague title.",,,#PremierLeague,830830982353809408,https://twitter.com/duncanjones64/status/830830982353809408
2017-02-12 17:28:08,ophicialmanando,,0,0,0,"Leicester City fans at the Liberty Stadium #SWALEI https://twitter.com/Sporf/status/801118909214638080/video/1 …",,,#SWALEI,830830865055903745,https://twitter.com/ophicialmanando/status/830830865055903745
2017-02-12 17:28:08,ophicialmanando,,0,0,0,"Leicester City still haven't scored a Premier League goal in 2017 #SWALEI http://www.telegraph.co.uk/football/2017/02/12/swansea-city-vs-leicester-city-premier-league-live-score/ …pic.twitter.com/8rdaQCxw6F",,,#SWALEI,830830860995850244,https://twitter.com/ophicialmanando/status/830830860995850244
2017-02-12 17:28:02,ManyJams,,0,0,0,"Leicester City Game Jam: London #LeicesterCityJam",,,#LeicesterCityJam,830830839407706112,https://twitter.com/ManyJams/status/830830839407706112
2017-02-12 17:27:57,aniketargade,,0,0,1,"Has it happened b4 Team wins the league and next year they are relegated #leicestercity",,,#leicestercity,830830818624946178,https://twitter.com/aniketargade/status/830830818624946178
2017-02-12 17:27:54,RJBailey,,0,0,0,"Top story: Watch Swansea City-Leicester City live stream http://ln.is/stream.nbcsports.com/eLUA1 …, see more http://tweetedtimes.com/RJBailey?s=tnp",,,,830830806310453248,https://twitter.com/RJBailey/status/830830806310453248
2017-02-12 17:27:54,TeleFootball,,7,170,228,"Leicester City fans at the Liberty Stadium #SWALEI https://twitter.com/Sporf/status/801118909214638080/video/1 …",,,#SWALEI,830830806285291524,https://twitter.com/TeleFootball/status/830830806285291524
2017-02-12 17:27:53,FiTEPLFeed,,0,0,0,"We have just over 20 minutes left to play.. can the current Premier League champions turn this game around? Swansea 2-0 Leicester City",,,,830830800996286464,https://twitter.com/FiTEPLFeed/status/830830800996286464
2017-02-12 17:27:53,GoalESLFeed,,0,0,0,"We have just over 20 minutes left to play.. can the current Premier League champions turn this game around? Swansea 2-0 Leicester City",,,,830830800971132929,https://twitter.com/GoalESLFeed/status/830830800971132929
2017-02-12 17:27:53,fantasyiteam,,0,0,2,"We have just over 20 minutes left to play.. can the current Premier League champions turn this game around? Swansea 2-0 Leicester City",,,,830830800748892161,https://twitter.com/fantasyiteam/status/830830800748892161
2017-02-12 17:27:47,labowlerino,,0,0,1,"#leicestercity fans hoping for it to stop... #SWALEIpic.twitter.com/4EToylEom8",,,#leicestercity #SWALEIpic,830830776736444416,https://twitter.com/labowlerino/status/830830776736444416
2017-02-12 17:27:47,desegun_,,0,0,0,"I really feel sorry for Ranieri and Leicester city.",,,,830830773661990912,https://twitter.com/desegun_/status/830830773661990912
2017-02-12 17:27:44,MarkAndrea5,,2,0,2,"Can someone tell me wht is wrong with Leicester city?!!! @randzejude @ndeemma @mosesngwanah @t_leonard2020",,@randzejude @ndeemma @mosesngwanah @t_leonard2020,,830830764182876160,https://twitter.com/MarkAndrea5/status/830830764182876160
2017-02-12 17:27:23,Phil_Carroll_,,0,0,0,"Leicester city are actually 1 point off relegation zone",,,,830830673510412288,https://twitter.com/Phil_Carroll_/status/830830673510412288
2017-02-12 17:27:04,alexielsi,,0,0,0,"Leicester City FC ready to sign Francesco Totti... https://goo.gl/fb/by5bEi #leicestercityfc",,,#leicestercityfc,830830593529245696,https://twitter.com/alexielsi/status/830830593529245696
2017-02-12 17:27:04,Ibidapson,,0,0,0,"EPL champion, Leicester city, could relegate.",,,,830830592895881216,https://twitter.com/Ibidapson/status/830830592895881216
2017-02-12 17:26:55,Mar_Peee,,0,0,0,"So Relieved We Are No More The Worst Ever Team To Defend Our Title, Thank You Leicester City",,,,830830557546348544,https://twitter.com/Mar_Peee/status/830830557546348544
2017-02-12 17:26:46,filmbuff62,,0,0,1,"Wow oh how the mighty have fallen #leicestercity is playing like a team who just want their summer vacation NOW. Sad to watch",,,#leicestercity,830830518509981696,https://twitter.com/filmbuff62/status/830830518509981696
2017-02-12 17:26:38,DavidWa50046817,,1,0,0,"Leicester City players are living in a bubble since winning the PL,this season the Leicester City players have downed tools #LCFC #SWALEI",,,#LCFC #SWALEI,830830486335414272,https://twitter.com/DavidWa50046817/status/830830486335414272
2017-02-12 17:26:34,nteah,,0,0,0,"Leicester City FC is in trouble. If they don't do anything about their present form, they may find themselves relegated.",,,,830830467175821312,https://twitter.com/nteah/status/830830467175821312
2017-02-12 17:26:32,GlowNLuck10,,0,0,17,"Leicester City is so bad",,,,830830461484204033,https://twitter.com/GlowNLuck10/status/830830461484204033
2017-02-12 17:26:27,Kabirjaaf,,0,1,0,"From winning the premier league to relegation. Story of Leicester City football club.",,,,830830438277062658,https://twitter.com/Kabirjaaf/status/830830438277062658
2017-02-12 17:26:13,kristvav,,0,1,0,"Jamie Vardy insists &#39;we&#39;re just enjoying the ride&#39; at Leicester City #LeicesterCityF.C. http://dlvr.it/NMC4X7",,,#39 #39 #39 #LeicesterCityF,830830379787378688,https://twitter.com/kristvav/status/830830379787378688
2017-02-12 17:26:07,Sambob180,,0,0,0,"Leicester City are awful",,,,830830356559515648,https://twitter.com/Sambob180/status/830830356559515648
2017-02-12 17:25:54,ThatoMokoena10,,0,0,1,"Leicester City",,,,830830301857333250,https://twitter.com/ThatoMokoena10/status/830830301857333250
2017-02-12 17:25:42,itan4sam,,0,0,1,"Leicester city sold the league to Chelsea...Kante is the league",,,,830830248656777216,https://twitter.com/itan4sam/status/830830248656777216
2017-02-12 17:25:24,TeleFootball,,2,12,19,"Leicester City still haven't scored a Premier League goal in 2017 #SWALEI http://www.telegraph.co.uk/football/2017/02/12/swansea-city-vs-leicester-city-premier-league-live-score/ …pic.twitter.com/4nxFO4up9V",,,#SWALEI,830830176741236737,https://twitter.com/TeleFootball/status/830830176741236737
2017-02-12 17:25:15,NOT_MOTD,,2,165,287,"Leicester City last season vs. Leicester City this season. pic.twitter.com/RAwwiym3uG",,,,830830139147706369,https://twitter.com/NOT_MOTD/status/830830139147706369
2017-02-12 17:25:04,entadaplace,,0,0,1,"Last season I heard chelsea had the worst title defense. So what do we say about Leicester city?",,,,830830091898851328,https://twitter.com/entadaplace/status/830830091898851328
2017-02-12 17:24:59,theKC10ib,,0,0,0,"I wonder if Leicester City score goals in practice? #LCFC #SWALEI",,,#LCFC #SWALEI,830830068905553920,https://twitter.com/theKC10ib/status/830830068905553920
2017-02-12 17:24:58,TalkSportTV,,0,0,0,"Leicester City have conceded 15 goals in the 15 minutes before half time this season; the most in the Premier League pic.twitter.com/Et4ry2QqVt",,,,830830068163366912,https://twitter.com/TalkSportTV/status/830830068163366912
2017-02-12 17:24:55,TalkSportTV,,0,0,0,"Swansea City vs Leicester City - Premier League, 12-Feb-2017 pic.twitter.com/q1GDsNtWxd",,,,830830052933767168,https://twitter.com/TalkSportTV/status/830830052933767168
2017-02-12 17:24:54,Bamiidelle,,0,0,0,"Shame on #Leicestercity",,,#Leicestercity,830830048336814080,https://twitter.com/Bamiidelle/status/830830048336814080
2017-02-12 17:24:44,lfc_comments,,0,0,0,"When Leicester City get relegated, #LFC should swoop for Andre Gray. Pace at a discount.",,,#LFC,830830006112772096,https://twitter.com/lfc_comments/status/830830006112772096
2017-02-12 17:24:43,frank2005,,0,0,0,"So much for #Ranieri changing his team midweek #leicestercity",,,#Ranieri #leicestercity,830830004883832834,https://twitter.com/frank2005/status/830830004883832834
2017-02-12 17:24:31,kagire,,0,0,0,"It is real, Leicester City will be relegated. From champs to relegation.",,,,830829954455760901,https://twitter.com/kagire/status/830829954455760901
