date,username,to,replies,retweets,favorites,text,geo,mentions,hashtags,id,permalink
2017-02-12 16:52:41,dRealTunde,,0,0,0,"Mention One Nigerian Player that plays for Leicester City?!! To Win 10,000 Naira Live on Bond 92.9 Fm Now!!! #FootballFeverNG",,,#FootballFeverNG,830821941674176512,https://twitter.com/dRealTunde/status/830821941674176512
2017-02-12 16:52:41,SlowestPoison,,0,0,0,"Mention One Nigerian Player that plays for Leicester City?!! To Win 10,000 Naira Live on Bond 92.9 Fm Now!!! #FootballFeverNG",,,#FootballFeverNG,830821941661536260,https://twitter.com/SlowestPoison/status/830821941661536260
2017-02-12 16:52:41,I_AmDozzy,,0,0,0,"Mention One Nigerian Player that plays for Leicester City?!! To Win 10,000 Naira Live on Bond 92.9 Fm Now!!! #FootballFeverNG",,,#FootballFeverNG,830821941648973824,https://twitter.com/I_AmDozzy/status/830821941648973824
2017-02-12 16:52:41,Iam_David_A,,0,0,0,"Mention One Nigerian Player that plays for Leicester City?!! To Win 10,000 Naira Live on Bond 92.9 Fm Now!!! #FootballFeverNG",,,#FootballFeverNG,830821941648953344,https://twitter.com/Iam_David_A/status/830821941648953344
2017-02-12 16:52:41,kenyanstar,,0,0,0,""" @Football__Tweet: Half time at the Liberty Stadium: Swansea City 2 - 0 Leicester City. #Swans #LCFC pic.twitter.com/mew20jWFUR""",,@Football__Tweet,#Swans #LCFC,830821939929296900,https://twitter.com/kenyanstar/status/830821939929296900
2017-02-12 16:52:40,mwangy_kay,,0,0,2,"Crystal Palace, Leicester City and Sunderland will go down",,,,830821935500115968,https://twitter.com/mwangy_kay/status/830821935500115968
2017-02-12 16:52:37,SlimSEM_,,0,0,1,"#LeicesterCity will go down. Any one of those teams in the bottom 3 fancy leapfrogging them #SWALEI",,,#LeicesterCity #SWALEI,830821927006662657,https://twitter.com/SlimSEM_/status/830821927006662657
2017-02-12 16:52:35,Shaji4Football,,0,0,1,"Champions #LeicesterCity misery compounded. HT: down 2-0 against resurgent #Swansea",,,#LeicesterCity #Swansea,830821916784996353,https://twitter.com/Shaji4Football/status/830821916784996353
2017-02-12 16:52:34,wachira_kaburia,,0,0,0,"My #EPL picks: crystal palace, sunderland and leicester city will be relegated.",,,#EPL,830821910732750849,https://twitter.com/wachira_kaburia/status/830821910732750849
2017-02-12 16:52:33,phookwillers,GaryLineker,0,0,0,"My words on Leicester City going down are as follows. https://twitter.com/GaryLineker/status/728983236722999296 …",,,,830821908614623232,https://twitter.com/phookwillers/status/830821908614623232
2017-02-12 16:52:32,DarenLaudaa,,0,0,0,"Leicester CIty's season is stuck in the upside down. pic.twitter.com/YsRUz348Hd",,,,830821902939721728,https://twitter.com/DarenLaudaa/status/830821902939721728
2017-02-12 16:52:28,SoccerCooligans,,1,1,9,"The more we watch Leicester City this season, the more we think they used a cheat code last season. #SWALEI #PremierLeague",,,#SWALEI #PremierLeague,830821888008003584,https://twitter.com/SoccerCooligans/status/830821888008003584
2017-02-12 16:52:23,mhmmdfxrth,,0,0,1,"R. I. P Leicester City",,,,830821867959128064,https://twitter.com/mhmmdfxrth/status/830821867959128064
2017-02-12 16:52:21,SoccerNationNg,,1,28,10,"When you ask Claudio Ranieri ""what is next for Leicester City"" with this beating they're chopping every weekend: #EtisalatFootballpic.twitter.com/FJ5dztqZDk",,,#EtisalatFootballpic,830821859058995201,https://twitter.com/SoccerNationNg/status/830821859058995201
2017-02-12 16:52:17,tcobertizo,,0,0,0,"The sports nihilist in me is really relishing in this Leicester City season.",,,,830821839999991808,https://twitter.com/tcobertizo/status/830821839999991808
2017-02-12 16:52:14,MikeyGregory,,0,0,1,"I hope theyve not made that Leicester film just yet #leicestercity",,,#leicestercity,830821829984059392,https://twitter.com/MikeyGregory/status/830821829984059392
2017-02-12 16:52:12,TheGunnersWay,,2,12,19,"Dear @FA The Premier league association and its officials need to investigate Leicester City FC for doping last season. Strip when guilty!",,@FA,,830821821914181633,https://twitter.com/TheGunnersWay/status/830821821914181633
2017-02-12 16:52:12,TheJamieCarter,,0,0,1,"Leicester City's decline since winning the league is a joke. Mahrez looks like the Space Jam aliens got him.",,,,830821818751733762,https://twitter.com/TheJamieCarter/status/830821818751733762
2017-02-12 16:52:06,Longy_Steve,,1,0,0,"Serious question now #LeicesterCity fans. Progress in UCL or forget it & fight for premier league status?",,,#LeicesterCity,830821794198200321,https://twitter.com/Longy_Steve/status/830821794198200321
2017-02-12 16:52:01,Ryancosgrove_,,0,0,0,"What a dream it would be if both Manchester clubs finish outside the top four and Leicester City get relegated",,,,830821772786282497,https://twitter.com/Ryancosgrove_/status/830821772786282497
2017-02-12 16:51:57,Leo_Bomaye,,0,0,1,"Leicester City fans were happy to see Kante leave. They actually thought they won the title thanx to Vardy and Marez ... shame man",,,,830821757506445312,https://twitter.com/Leo_Bomaye/status/830821757506445312
2017-02-12 16:51:56,TheMichaelGale,,1,0,1,"Hold up on coming out with the Leicester city DVD. Might need to wait for another chapter when they get relegated this season. #Leicester",,,#Leicester,830821752003555328,https://twitter.com/TheMichaelGale/status/830821752003555328
2017-02-12 16:51:52,PhutiLeroy,,1,1,0,"Leicester City is in serious trouble now @JiggaMofreddy @NGANGEZWELAKHE_",,@JiggaMofreddy @NGANGEZWELAKHE_,,830821737751314433,https://twitter.com/PhutiLeroy/status/830821737751314433
2017-02-12 16:51:48,NelsonMahlangu1,,0,0,0,"Leicester City going for relegation. History will be made. #SwaLei",,,#SwaLei,830821720613384194,https://twitter.com/NelsonMahlangu1/status/830821720613384194
2017-02-12 16:51:47,Hambido,,0,0,1,"I hope someone screenshot my ""Leicester City will get relegated"" tweet.",,,,830821716070903808,https://twitter.com/Hambido/status/830821716070903808
2017-02-12 16:51:45,alex23ti,,0,0,0,"@SkySportsNewsHQ Leicester city - champions to championship it seems",,@SkySportsNewsHQ,,830821704905666560,https://twitter.com/alex23ti/status/830821704905666560
2017-02-12 16:51:44,jayledger,,1,0,0,"Anyone feel sorry for Leicester city ?",,,,830821704389771266,https://twitter.com/jayledger/status/830821704389771266
2017-02-12 16:51:30,TheFantasyFooti,,0,1,0,"45+2' Goal by Martin Olsson (a: Sigurdsson)! Swansea City is ahead of Leicester City as the score is 2-0. #SWANS #LCFC #PremierLeague",,,#SWANS #LCFC #PremierLeague,830821645120004097,https://twitter.com/TheFantasyFooti/status/830821645120004097
2017-02-12 16:51:28,Jomo_The_Best,,0,0,0,"I think Leicester City needs a new manager with a fresh philosophy before its too late, taking nothing away from the current manager #SWALEI",,,#SWALEI,830821635192152064,https://twitter.com/Jomo_The_Best/status/830821635192152064
2017-02-12 16:51:27,DGlef,,0,0,0,"Leicester City 2016-17... hands down the worst defending champion in PL/top tier history. What a fucking joke of a team. #StillNoGoalsIn2017",,,#StillNoGoalsIn2017,830821633321553922,https://twitter.com/DGlef/status/830821633321553922
2017-02-12 16:51:27,Asherrs89,,0,0,0,"Leicester city are dogshit",,,,830821629894594560,https://twitter.com/Asherrs89/status/830821629894594560
2017-02-12 16:51:24,beraoa,,0,0,0,"Leicester City are losing 0-2 to Swansea City at half time -_-",,,,830821617295040515,https://twitter.com/beraoa/status/830821617295040515
2017-02-12 16:51:23,ndranandraj,,0,0,0,"SIGH. It's getting real.Leicester City might very well get relegated! #EPL",,,#EPL,830821613847187456,https://twitter.com/ndranandraj/status/830821613847187456
2017-02-12 16:51:22,Jason_Linn21,,0,0,0,"RIP Leicester City",,,,830821611238522880,https://twitter.com/Jason_Linn21/status/830821611238522880
2017-02-12 16:51:22,FPLUpdates_Tips,,0,0,1,"Goaaaal ! Swansea City FC 2 -- 0 Leicester City FC Scorer : Olsson Assist : Siggurdson #Gw25 #SWALEI ##Masry",,,#Gw25 #SWALEI # #Masry,830821610219307010,https://twitter.com/FPLUpdates_Tips/status/830821610219307010
2017-02-12 16:51:22,moseisleys,,0,0,0,"Leicester City playing like shit lol, Swansea wat",,,,830821609137115137,https://twitter.com/moseisleys/status/830821609137115137
2017-02-12 16:51:21,DareToZlaataan,,0,0,1,"Leicester City defeating Manchester City was the biggest fluke of this season. Guardiola must be scratching his bald head.",,,,830821605689298944,https://twitter.com/DareToZlaataan/status/830821605689298944
2017-02-12 16:51:20,Tjelley09,,0,0,0,"Leicester City= . Nothing more to say really.",,,,830821603613118465,https://twitter.com/Tjelley09/status/830821603613118465
2017-02-12 16:51:20,AnTonyO_B,,0,0,1,"Leicester City really gonna get relegated this season omg",,,,830821600543006721,https://twitter.com/AnTonyO_B/status/830821600543006721
2017-02-12 16:51:19,zalomarcos,,0,0,0,"- calling it now - Leicester City are going to be relegated this season. . . :(",,,,830821595874787331,https://twitter.com/zalomarcos/status/830821595874787331
2017-02-12 16:51:18,ye_back,,0,0,0,"@SuperSportBlitz: #PL - HT: Swansea City *2-0 Leicester City #SSFootball",,@SuperSportBlitz,#PL #SSFootball,830821594566107136,https://twitter.com/ye_back/status/830821594566107136
2017-02-12 16:51:16,PeterSmitGary,LCFC,0,0,0,"First Manchester City, now Leicester City. Go down after winning the League.",,,,830821584990412800,https://twitter.com/PeterSmitGary/status/830821584990412800
2017-02-12 16:51:15,chuma_maphasa,,0,0,0,"The defending Champions are struggling .Leicester City kwenze njani#SSFootball",,,#SSFootball,830821580301332480,https://twitter.com/chuma_maphasa/status/830821580301332480
2017-02-12 16:51:13,timmmy0404,,0,0,0,"Leicester City are getting relegated",,,,830821573611417601,https://twitter.com/timmmy0404/status/830821573611417601
2017-02-12 16:51:12,orozemo_es,,0,0,0,"#PremierLeague//Entretiempo Swansea City 2 (MAWSON;OLSSON) Leicester City 0",,,#PremierLeague,830821569656131586,https://twitter.com/orozemo_es/status/830821569656131586
2017-02-12 16:51:10,TheLedgeSports,,0,0,0,"When you hear Leicester City haven't scored a #PremierLeague goal in 2017... #SWALEIpic.twitter.com/R3EImsiqV8",,,#PremierLeague #SWALEIpic,830821559191302146,https://twitter.com/TheLedgeSports/status/830821559191302146
2017-02-12 16:51:08,UtdNaj,,0,0,2,"What could really be happening to Leicester city's season",,,,830821550316195844,https://twitter.com/UtdNaj/status/830821550316195844
2017-02-12 16:51:06,Sirth_quorantyn,,0,0,0,"Leicester City... Smh",,,,830821542850342912,https://twitter.com/Sirth_quorantyn/status/830821542850342912
2017-02-12 16:51:06,IncenseSA,,0,0,0,"Leicester City might just get relegated",,,,830821541239783425,https://twitter.com/IncenseSA/status/830821541239783425
2017-02-12 16:51:01,iamzibit,,0,0,0,"Leicester city paaa be this ? Awww defending champions now turn to Onaapo champions",,,,830821521744601090,https://twitter.com/iamzibit/status/830821521744601090
2017-02-12 16:51:00,chike95,LCFC,0,0,0,"ESPN 30 for 30, from Champions to the Championship in a year, the Leicester City story. https://twitter.com/LCFC/status/830821117245927426 …",,,,830821518674362368,https://twitter.com/chike95/status/830821518674362368
2017-02-12 16:50:59,SBOBET,,0,0,0,"HALF TIME: Swansea City 2-0 Leicester City. #SWALEI #PL Check more betting options for this game at http://goo.gl/eXhLoy pic.twitter.com/OoG5Sxlg31",,,#SWALEI #PL,830821513024593922,https://twitter.com/SBOBET/status/830821513024593922
2017-02-12 16:50:58,sportscentref,,0,0,0,"HALF-TIME: Swansea City 2-0 Leicester City #EPL",,,#EPL,830821511418216448,https://twitter.com/sportscentref/status/830821511418216448
2017-02-12 16:50:58,bambo_johnson,,0,0,1,"The champions are indeed struggling. PL update : Swansea City 2 - Leicester City 0.",,,,830821509753094146,https://twitter.com/bambo_johnson/status/830821509753094146
2017-02-12 16:50:58,EtchesIan,,0,0,0,"Leicester city where have you gone? #just saying",,,#just,830821508700311552,https://twitter.com/EtchesIan/status/830821508700311552
2017-02-12 16:50:58,OgunbanjoOlajid,,1,0,0,"Leicester city are without a goal this 2017.....what a bad season for the 2016EPL champions #EPL #2017",,,#EPL #2017,830821507924385793,https://twitter.com/OgunbanjoOlajid/status/830821507924385793
2017-02-12 16:50:58,ChrisChohan,,0,0,0,"#LeicesterCity for the @SkyBetChamp title next season! #SWALEI",,@SkyBetChamp,#LeicesterCity #SWALEI,830821507781771264,https://twitter.com/ChrisChohan/status/830821507781771264
2017-02-12 16:50:57,AarunKane,,0,0,0,"This is the Leicester City I expected last season.",,,,830821505403609088,https://twitter.com/AarunKane/status/830821505403609088
2017-02-12 16:50:54,Martynw34,,0,0,3,"Leicester made history last season & could well make history again this season but for all the wrong reasons #SWALEI #leicestercity",,,#SWALEI #leicestercity,830821492283863040,https://twitter.com/Martynw34/status/830821492283863040
2017-02-12 16:50:48,aussieafc,,1,0,0,"Leicester city. Did I dream 15/16 season",,,,830821466887290880,https://twitter.com/aussieafc/status/830821466887290880
2017-02-12 16:50:47,josephfarrugia7,,0,0,0,"@GaryLineker #leicestercity officially worst reigning #PremierLeague champions ever!",,@GaryLineker,#leicestercity #PremierLeague,830821464110686211,https://twitter.com/josephfarrugia7/status/830821464110686211
2017-02-12 16:50:45,chimfwembe_n,,0,0,0,"I guess Leicester city is headed for relegation",,,,830821454186962944,https://twitter.com/chimfwembe_n/status/830821454186962944
2017-02-12 16:50:42,FareedR_,,0,0,0,"Leicester CIty's season is stuck in the upside down. pic.twitter.com/CSG6AXBwdW",,,,830821444724617216,https://twitter.com/FareedR_/status/830821444724617216
2017-02-12 16:50:41,linziramma,,0,0,0,"Leicester city could very well go down...unbelievable",,,,830821437304889345,https://twitter.com/linziramma/status/830821437304889345
2017-02-12 16:50:40,Bee_mufc,,0,1,0,"Really feel sorry for Leicester City. They havent even scored a goal in the League in 2017",,,,830821436185014272,https://twitter.com/Bee_mufc/status/830821436185014272
2017-02-12 16:50:40,Jimbo__IV,,0,0,1,"Have to feel bad for Leicester City this season",,,,830821433177681925,https://twitter.com/Jimbo__IV/status/830821433177681925
2017-02-12 16:50:40,DavidIndia2,BBCSport,0,0,0,"Jst saw the owner of Leicester city ""Shaking his head"" in Disarray. Can imagine what grief he's in right now. Decision time awaits",,,,830821432837931008,https://twitter.com/DavidIndia2/status/830821432837931008
2017-02-12 16:50:39,amarapickerill,,0,0,0,"Leicester city",,,,830821431357345793,https://twitter.com/amarapickerill/status/830821431357345793
2017-02-12 16:50:39,Khuze_Elikhulu,,1,0,0,"Leicester City guys is this a fall from grace or a return to normalcy?",,,,830821430233280512,https://twitter.com/Khuze_Elikhulu/status/830821430233280512
2017-02-12 16:50:38,kash_talks,SuperSportBlitz,0,0,0,"The entire Leicester City team can now retire from football. Including their water boys. It's sad... https://twitter.com/SuperSportBlitz/status/830821140578844673 …",,,,830821427502776321,https://twitter.com/kash_talks/status/830821427502776321
2017-02-12 16:50:33,disler95,,0,0,1,"Leicester City are in a lot of trouble. This is turning into a real battle to stay in the league, just one season after winning it",,,,830821406522884097,https://twitter.com/disler95/status/830821406522884097
2017-02-12 16:50:33,COPA90,,2,15,94,"Leicester City showing us how f*cking nuts last season really was. 2-0 down before the break!",,,,830821402999713792,https://twitter.com/COPA90/status/830821402999713792
2017-02-12 16:50:30,John_g_belfast,,0,0,0,"Leicester City 'and when they were up, they were up, and when they were down, they were down @5liveSport @premierleague @bbc606",,@5liveSport @premierleague @bbc606,,830821391595343872,https://twitter.com/John_g_belfast/status/830821391595343872
2017-02-12 16:50:30,Wanny_Gredz,,2,0,3,"Leicester City will 100% be relegated we are a team in free fall and with #ranieri sticking with this same back 4 we won't win a game",,,#ranieri,830821391469576192,https://twitter.com/Wanny_Gredz/status/830821391469576192
2017-02-12 16:50:28,Selektah12,,0,0,0,"Leicester City pic.twitter.com/EWRk1q1Cws",,,,830821383768776706,https://twitter.com/Selektah12/status/830821383768776706
2017-02-12 16:50:28,TeleFootball,,1,0,6,"Half time: Swansea 2-0 Leicester City #SWALEI http://www.telegraph.co.uk/football/2017/02/12/swansea-city-vs-leicester-city-premier-league-live-score/ …pic.twitter.com/z416iFVZ4c",,,#SWALEI,830821382057496578,https://twitter.com/TeleFootball/status/830821382057496578
2017-02-12 16:50:27,MILLIONAIRE_CC,,0,0,0,"Leicester City don suffer...so team no fit #epl in peace and stay gallant the following season ever since #SAF retired..",,,#epl #SAF,830821378827886593,https://twitter.com/MILLIONAIRE_CC/status/830821378827886593
2017-02-12 16:50:26,PikeAdam,,0,0,1,"Premier League Champions 2015/16 - Leicester City Championship Winners 2017/18 - Leicester City ??",,,,830821376885977088,https://twitter.com/PikeAdam/status/830821376885977088
2017-02-12 16:50:26,thee_rebone,,1,0,0,"Leicester City Bathong #SWALEI",,,#SWALEI,830821373870215170,https://twitter.com/thee_rebone/status/830821373870215170
2017-02-12 16:50:24,FraserMercsport,,0,0,0,"Half time: @SwansOfficial 2-0 Leicester City. For half hour, a cagey lifeless game - but then Swansea really got hold of it. Deserved lead.",,@SwansOfficial,,830821365263511555,https://twitter.com/FraserMercsport/status/830821365263511555
2017-02-12 16:50:23,brfootball,,4,162,285,"Leicester CIty's season is stuck in the upside down. pic.twitter.com/1aitvMlgsr",,,,830821363418030082,https://twitter.com/brfootball/status/830821363418030082
2017-02-12 16:50:19,sportscentref,,0,0,0,"LEICESTER CITY IN TROUBle now ,on the brink of half-time. Swansea 2-0 Leicester. #EPL",,,#EPL,830821346116517888,https://twitter.com/sportscentref/status/830821346116517888
2017-02-12 16:50:17,Tunjai,,0,0,0,"What has happened to EPL champions Leicester City? Mawson + Olsson compounds their troubles.",,,,830821337212006400,https://twitter.com/Tunjai/status/830821337212006400
2017-02-12 16:50:13,abdi_imra,,1,0,0,"Leicester city has been relegated.",,,,830821321110007808,https://twitter.com/abdi_imra/status/830821321110007808
2017-02-12 16:50:11,SpudzMackensy,,0,0,0,"Leicester City just has to scrap this season. They're playing w/ fire being in this relegation zone",,,,830821313187033088,https://twitter.com/SpudzMackensy/status/830821313187033088
2017-02-12 16:50:10,UnitedNZM_,,0,1,2,"Wow. Leicester city really doing a blackburn... Won the league and then disappeared",,,,830821308388683777,https://twitter.com/UnitedNZM_/status/830821308388683777
2017-02-12 16:50:10,Alhajlatif,,0,0,0,"Sorry Leicester city this is getting bad",,,,830821308304855042,https://twitter.com/Alhajlatif/status/830821308304855042
2017-02-12 16:50:09,richardrel,,0,0,0,"Leicester City wetin dey Sup Na..... I'm so sorry for Ndidi and Ahmed Musa...",,,,830821305855385601,https://twitter.com/richardrel/status/830821305855385601
2017-02-12 16:50:07,SifaKarabu,,0,0,0,"Leicester city beaten by every team",,,,830821295684063232,https://twitter.com/SifaKarabu/status/830821295684063232
2017-02-12 16:50:05,afcmanny_,,0,0,0,"From PL glory and Champions League to the Chanpinship. Leicester City FC.",,,,830821289149489157,https://twitter.com/afcmanny_/status/830821289149489157
2017-02-12 16:50:03,CitiSportsGHA,,0,5,7,"HT: Swansea 2-0 Leicester City [Mawson, Olsson] #CitiSportspic.twitter.com/AkCZZEoqGW",,,#CitiSportspic,830821278235910144,https://twitter.com/CitiSportsGHA/status/830821278235910144
2017-02-12 16:50:02,lastmangame,,0,0,0,"Goal! Martin Olsson (45') scores for Swansea City. Swansea City 2 - 0 Leicester City",,,,830821274893025280,https://twitter.com/lastmangame/status/830821274893025280
2017-02-12 16:50:01,scotty2smithy,EnglishPL,0,0,0,"HT. 2-0. Swansea City in full command at the interval as Leicester City's woeful form continues at the Liberty Stadium. #PL",,,#PL,830821269901758465,https://twitter.com/scotty2smithy/status/830821269901758465
2017-02-12 16:50:01,Sports_Journo_1,,0,0,0,"Could this be the end of Claudio Ranieri at Leicester City? #SWALEI",,,#SWALEI,830821269448818688,https://twitter.com/Sports_Journo_1/status/830821269448818688
2017-02-12 16:50:00,_mynameisRuhel,,0,0,0,"Leicester City are actually getting relegated",,,,830821266370203648,https://twitter.com/_mynameisRuhel/status/830821266370203648
2017-02-12 16:49:59,ashaarimuhammad,,0,0,1,"Tak ada Kante, susah betul Leicester City ni nak menang.. Its shows the importance of a good defensive midfielder in a team..",,,,830821261886451712,https://twitter.com/ashaarimuhammad/status/830821261886451712
2017-02-12 16:49:56,dickiewynne,,0,0,0,"What has happened to Leicester City",,,,830821249957892099,https://twitter.com/dickiewynne/status/830821249957892099
2017-02-12 16:49:56,chrissatchell,,0,0,0,"I wonder how many Leicester City 'fans' are still 'fans' this season",,,,830821249442013186,https://twitter.com/chrissatchell/status/830821249442013186
2017-02-12 16:49:56,gvoctvn,,0,0,0,"Leicester City aka the Champion is going down. HOPEFULLY LFC can hurt them more next time LFC meet LCFC",,,,830821247772610560,https://twitter.com/gvoctvn/status/830821247772610560
2017-02-12 16:49:55,la_ligapremier,,0,0,0,"HALFTIME: Swansea City 2-0 Leicester City.",,,,830821243532222464,https://twitter.com/la_ligapremier/status/830821243532222464
2017-02-12 16:49:53,smokezilla27,,0,0,2,"Nah Leicester city FC are still hungover honestly! #SwanseavLeicester",,,#SwanseavLeicester,830821237815390208,https://twitter.com/smokezilla27/status/830821237815390208
2017-02-12 16:49:52,SirSbusiso,,0,0,0,"Shame Leicester City!",,,,830821232350212096,https://twitter.com/SirSbusiso/status/830821232350212096
2017-02-12 16:49:51,ulrichtchio,,0,0,0,"Leicester City might get relegated @the end of this season that would suck",,@the,,830821228789260289,https://twitter.com/ulrichtchio/status/830821228789260289
2017-02-12 16:49:50,DantePasusu,,0,0,0,"Abi Leicester city sef go consider sack Ranieri",,,,830821225911951364,https://twitter.com/DantePasusu/status/830821225911951364
2017-02-12 16:49:50,Cian89_,premierleague,1,3,16,"Leicester City... Champions to Champions League to.... Championship...? Poor Ranieri.",,,,830821223542169600,https://twitter.com/Cian89_/status/830821223542169600
2017-02-12 16:49:49,callumtaylorr17,,0,0,0,"Leicester city as a football team are a joke atm! How things can change so much in 12 months",,,,830821219356254209,https://twitter.com/callumtaylorr17/status/830821219356254209
2017-02-12 16:49:49,bidam_II,,0,1,0,"Leicester city are trying their very best to get relegated. It will shock them.",,,,830821218374844425,https://twitter.com/bidam_II/status/830821218374844425
2017-02-12 16:49:47,DeanWainwright2,,0,0,0,"WTF has happened to #leicestercity this season? Team looks totally lacking in belief & ideas. Defending champions ffs.",,,#leicestercity,830821212792160263,https://twitter.com/DeanWainwright2/status/830821212792160263
2017-02-12 16:49:47,MCTipbet_tr,,0,0,0,"Devre Swansea City 2:0 Leicester City #SWALEIpic.twitter.com/XOOFZD4tEj",,,#SWALEIpic,830821210711810049,https://twitter.com/MCTipbet_tr/status/830821210711810049
2017-02-12 16:49:47,inkhel,,0,0,0,"Swansea City 2-0 Leicester City (HT) Martin Olsson 45+3",,,,830821210036588548,https://twitter.com/inkhel/status/830821210036588548
2017-02-12 16:49:46,DJFozzz,,0,0,0,"@GaryLineker How much do you think the value of the Leicester City players are worth now ? #MOTD",,@GaryLineker,#MOTD,830821206265884672,https://twitter.com/DJFozzz/status/830821206265884672
2017-02-12 16:49:45,Scott_Schmitt,,0,0,0,"With every passing game, Leicester City winning the Premier League last season might be one of the biggest upsets in football history #EPL",,,#EPL,830821202088357892,https://twitter.com/Scott_Schmitt/status/830821202088357892
2017-02-12 16:49:44,adamrbrooks,,1,0,0,"So Leicester City are going to be the most interesting story two years in a row",,,,830821200041484289,https://twitter.com/adamrbrooks/status/830821200041484289
2017-02-12 16:49:43,ScoresPro,,0,0,0,"Soccer #Livescore: (ENG-EPL) #Swansea vs #LeicesterCity: 2-0. Halftime ...",,,#Livescore #Swansea #LeicesterCity,830821193506816002,https://twitter.com/ScoresPro/status/830821193506816002
2017-02-12 16:49:41,InvictosSomos,,5,125,376,"Leicester City... pic.twitter.com/g7sRYQKC4n",,,,830821187089465351,https://twitter.com/InvictosSomos/status/830821187089465351
2017-02-12 16:49:41,OffsideRulePod,,0,0,1,"HT: Swansea City 2-0 Leicester City #SWALEI",,,#SWALEI,830821186225467392,https://twitter.com/OffsideRulePod/status/830821186225467392
2017-02-12 16:49:40,BoyleSports,,0,1,1,"HT: Swansea City 2-0 Leicester City pic.twitter.com/uaTQ7EyNSE",,,,830821180743487488,https://twitter.com/BoyleSports/status/830821180743487488
2017-02-12 16:49:39,theKingScores,,0,0,0,"HALF TIME RESULT 2-0 #Swans vs #LCFC, #EPL #SwanseaCity #LeicesterCity, http://bit.ly/2jE1Dl5 pic.twitter.com/jY6IfSBWmb",,,#Swans #LCFC #EPL #SwanseaCity #LeicesterCity,830821179774611459,https://twitter.com/theKingScores/status/830821179774611459
2017-02-12 16:49:38,RastaKidJae12,,1,0,0,"From champions to relegation #LeicesterCity",,,#LeicesterCity,830821174695313408,https://twitter.com/RastaKidJae12/status/830821174695313408
2017-02-12 16:49:36,niiokaijr,niiokaijr,0,0,0,"Leicester City on the other hand pic.twitter.com/57jHrcOBo7",,,,830821166440931328,https://twitter.com/niiokaijr/status/830821166440931328
2017-02-12 16:49:36,JayPolk44,,0,0,0,"Forget that Leicester City won the league last year and is facing relegation. I'm sick this is the same team that handled City earlier",,,,830821165715292165,https://twitter.com/JayPolk44/status/830821165715292165
