date,username,to,replies,retweets,favorites,text,geo,mentions,hashtags,id,permalink
2015-09-13 16:47:33,SAMLUCASKILLER,,0,0,0,"What a goal #LeicesterCity",,,#LeicesterCity,643103736164958209,https://twitter.com/SAMLUCASKILLER/status/643103736164958209
2015-09-13 16:47:33,Just_Goddy,,0,0,0,"Leicester City WOW!!!!!!",,,,643103736018173952,https://twitter.com/Just_Goddy/status/643103736018173952
2015-09-13 16:47:33,_bradmontings,,0,0,0,"Leicester City with the come back of the year",,,,643103735850385408,https://twitter.com/_bradmontings/status/643103735850385408
2015-09-13 16:47:33,bZbmB,,0,0,0,"Leicester City WOW what a comeback",,,,643103734361366528,https://twitter.com/bZbmB/status/643103734361366528
2015-09-13 16:47:32,phoenixdwyer,,0,0,0,"Leicester City!!!!!!!!!!",,,,643103733270888453,https://twitter.com/phoenixdwyer/status/643103733270888453
2015-09-13 16:47:32,Football__Tweet,,1,50,41,"GOAL: Leicester City 3 - 2 Aston Villa. Nathan Dyer completes the turnaround for the Foxes. What a pass from Riyad Mahrez. #LCFC #AVFC",,,#LCFC #AVFC,643103733233123328,https://twitter.com/Football__Tweet/status/643103733233123328
2015-09-13 16:47:31,voice255,,0,0,0,"Goal leicester city",,,,643103727352737792,https://twitter.com/voice255/status/643103727352737792
2015-09-13 16:47:31,C_Espina_21,,0,0,0,"Holy shit they came back!!! #LeicesterCity",,,#LeicesterCity,643103725666459648,https://twitter.com/C_Espina_21/status/643103725666459648
2015-09-13 16:47:31,sheikhriad1,,0,0,0,"Goaaaaallllllllllll! 3-2 for Leicester City. Great comeback",,,,643103725062504448,https://twitter.com/sheikhriad1/status/643103725062504448
2015-09-13 16:47:30,Fred_Amazing,,0,0,0,"Leicester City, the team to watch... Goal... Dyer... 3-2..",,,,643103722852229120,https://twitter.com/Fred_Amazing/status/643103722852229120
2015-09-13 16:47:30,KRDorn21,,0,0,0,"Holy #LeicesterCity",,,#LeicesterCity,643103722441179136,https://twitter.com/KRDorn21/status/643103722441179136
2015-09-13 16:47:28,LFCforLife11,,0,0,2,"Wow Leicester City! Hope Dyers ok?",,,,643103715310874624,https://twitter.com/LFCforLife11/status/643103715310874624
2015-09-13 16:47:28,Zack_Cyko,,0,0,0,"Leicester City what a comeback!",,,,643103712647512064,https://twitter.com/Zack_Cyko/status/643103712647512064
2015-09-13 16:47:27,aicksendent,,0,0,0,"Leicester city comeback!ngeri!!!",,,,643103708704706560,https://twitter.com/aicksendent/status/643103708704706560
2015-09-13 16:47:26,ThaboTheHuman,,0,0,0,"Wow Leicester city",,,,643103708096655361,https://twitter.com/ThaboTheHuman/status/643103708096655361
2015-09-13 16:47:26,jdwmaguire,,0,0,0,"Leicester City, what a comeback that was!!!",,,,643103707945635844,https://twitter.com/jdwmaguire/status/643103707945635844
2015-09-13 16:47:26,Tea4Two2ForTea,,0,0,0,"Madness!!! #LeicesterCity",,,#LeicesterCity,643103705437478912,https://twitter.com/Tea4Two2ForTea/status/643103705437478912
2015-09-13 16:47:25,Roebbn,,0,0,0,"If our players work as hard as Leicester City players, we would win the League and the Champions league. #Arsenal #COYG",,,#Arsenal #COYG,643103700886515712,https://twitter.com/Roebbn/status/643103700886515712
2015-09-13 16:47:24,Karissa_M10,,1,0,0,"89' GOOOALL FOR LEICESTER CITY!!!!!",,,,643103698193768448,https://twitter.com/Karissa_M10/status/643103698193768448
2015-09-13 16:47:24,SwayzeMayne,,0,0,0,"OMG THIS LEICESTER CITY GAME",,,,643103698080636928,https://twitter.com/SwayzeMayne/status/643103698080636928
2015-09-13 16:47:24,TheRealKBlack25,,0,0,0,"Leicester City!",,,,643103695895437313,https://twitter.com/TheRealKBlack25/status/643103695895437313
2015-09-13 16:47:23,tristanjoyce12,,0,0,1,"LEICESTER CITY ARE FLYING",,,,643103694691672064,https://twitter.com/tristanjoyce12/status/643103694691672064
2015-09-13 16:47:23,iamOkon,,0,1,0,"3-2. Leicester City in front. Nathan Dyer.",,,,643103692040839168,https://twitter.com/iamOkon/status/643103692040839168
2015-09-13 16:47:22,Darius9T,,0,0,0,"Absolutely ""@__arsenalnews_: Leicester City this season are so great to watch!""",,@__arsenalnews_,,643103690287677440,https://twitter.com/Darius9T/status/643103690287677440
2015-09-13 16:47:21,sporker_,,1,1,0,"LEICESTER CITY OMGGGG",,,,643103686219202560,https://twitter.com/sporker_/status/643103686219202560
2015-09-13 16:47:20,MaxSuchevits,,0,0,0,"LEICESTER CITY WTF HOW",,,,643103679206268928,https://twitter.com/MaxSuchevits/status/643103679206268928
2015-09-13 16:47:16,Tr00Chase,,0,2,1,"LEICESTER CITY GOD",,,,643103666317168640,https://twitter.com/Tr00Chase/status/643103666317168640
2015-09-13 16:47:16,FTPSportsMgmt,,0,0,0,"Whoever scouted Mahrez for Leicester City deserves a medal. Bringing him in from Ligue 2 was inspired",,,,643103665088262144,https://twitter.com/FTPSportsMgmt/status/643103665088262144
2015-09-13 16:47:16,Shahid_Tutla,,0,0,0,"Jordan Amavi looks like a shaving pin #LEIAVL #Leicestercity #villa",,,#LEIAVL #Leicestercity #villa,643103664643682304,https://twitter.com/Shahid_Tutla/status/643103664643682304
2015-09-13 16:47:15,soccerscoresnet,,0,0,0,"Leicester City 3-2 Aston Villa (England) #livescoreshttp://bit.ly/1LyFd0j",,,#livescoreshttp,643103660998815744,https://twitter.com/soccerscoresnet/status/643103660998815744
2015-09-13 16:47:13,Deanoh999,,0,0,2,"I'm sure Leicester City will b happy wi their steward/security man aka Fred Flintstone celebrating their equaliser? pic.twitter.com/lc0RTNijG5",,,,643103650932490241,https://twitter.com/Deanoh999/status/643103650932490241
2015-09-13 16:47:08,RyMarples,,0,0,0,"If Mahrez gets the winner, i'll buy a Leicester City shirt with his name on it. #LEIAVL",,,#LEIAVL,643103629243756545,https://twitter.com/RyMarples/status/643103629243756545
2015-09-13 16:47:07,cj_beach,,0,0,0,"LEICESTER CITY",,,,643103625049436160,https://twitter.com/cj_beach/status/643103625049436160
2015-09-13 16:46:58,whosjoshh,,0,0,0,"This Leicester City vs. Aston Villa game has been phenomenal.",,,,643103589905375232,https://twitter.com/whosjoshh/status/643103589905375232
2015-09-13 16:46:56,arazuhrtz,,0,0,0,"Leicester City",,,,643103581868986368,https://twitter.com/arazuhrtz/status/643103581868986368
2015-09-13 16:46:49,otunbasegebam,,0,0,0,"MAHREEZ such a bundle of talent and skill for Leicester City. He won't last in this club I'm so sure. @Ayourb @shogolomo @Yemz_Olu",,@Ayourb @shogolomo @Yemz_Olu,,643103549312868353,https://twitter.com/otunbasegebam/status/643103549312868353
2015-09-13 16:46:46,dadx3gMike,,0,0,0,"Leicester City vs Aston Villa LIVE: Follow all the action http://dailym.ai/1NxbRQF",,,,643103537698861056,https://twitter.com/dadx3gMike/status/643103537698861056
2015-09-13 16:46:42,EEP_ster,,0,0,0,"WTHECK LEICESTER CITY",,,,643103520812498944,https://twitter.com/EEP_ster/status/643103520812498944
2015-09-13 16:46:37,AobakweOtsetswe,,0,0,0,"Leicester City!!!!!!!",,,,643103500310851584,https://twitter.com/AobakweOtsetswe/status/643103500310851584
2015-09-13 16:46:28,9ijaNews,,0,0,0,"Leicester City 2-2 Aston Villa English Premier League LIVE score: Follow all the action from the King Power Stadi… http://ift.tt/1Oo6qTm",,,,643103464399237120,https://twitter.com/9ijaNews/status/643103464399237120
2015-09-13 16:46:21,SRKgooner,,0,0,0,"Leicester city still on weed ffs",,,,643103435512942592,https://twitter.com/SRKgooner/status/643103435512942592
2015-09-13 16:46:17,kejumesissusu,,0,0,0,"Leicester city gokil!",,,,643103417921961984,https://twitter.com/kejumesissusu/status/643103417921961984
2015-09-13 16:46:17,Ashwani_KS,,0,0,0,"Its a pleasure to watch #LeicesterCity & #crystalpalace this season!!",,,#LeicesterCity #crystalpalace,643103414805663744,https://twitter.com/Ashwani_KS/status/643103414805663744
2015-09-13 16:46:15,GaryLambourne,,0,0,0,"What a player mahrez is #LeicesterCity",,,#LeicesterCity,643103408954679298,https://twitter.com/GaryLambourne/status/643103408954679298
2015-09-13 16:46:15,VillaNewsOnly,,0,0,0,"#AstonVilla #AVFC Aston Villa Away To Leicester City - Team News http://dld.bz/dTxXZ",,,#AstonVilla #AVFC,643103406404595712,https://twitter.com/VillaNewsOnly/status/643103406404595712
2015-09-13 16:46:11,tatt_png,,0,0,0,"Leicester City, what a stubborn side.",,,,643103390990397440,https://twitter.com/tatt_png/status/643103390990397440
2015-09-13 16:46:07,lukereddevil7,,0,0,0,"Leicester City 2-2 Aston Villa 2-nil down after 63 minutes, the Foxes have scored twice in 10 mins (de Laet, Vardy). What a game ! #LEIAVL",,,#LEIAVL,643103376314626048,https://twitter.com/lukereddevil7/status/643103376314626048
2015-09-13 16:46:04,PagalSardar,,0,0,0,"39.6. The percentage of #FPL players anxiously waiting for a Mahrez winner. #LeicesterCity v #AstonVilla. #lcfc #avfc",,,#FPL #LeicesterCity #AstonVilla #lcfc #avfc,643103361508634624,https://twitter.com/PagalSardar/status/643103361508634624
2015-09-13 16:46:02,reddit_stream,,0,0,0,"Match Thread: Leicester City vs Aston Villa [Premier League] http://reddit-stream.com/comments/3ksf47",,,,643103354722258944,https://twitter.com/reddit_stream/status/643103354722258944
2015-09-13 16:45:56,Pratieekk,,0,0,0,"Leicester City 2 - 2 Aston Villa. THE COMEBACK IS COMPLETE! Jamie Vardy with the equaliser for the Foxes. What a game. #LCFC #AVFC",,,#LCFC #AVFC,643103327861891072,https://twitter.com/Pratieekk/status/643103327861891072
2015-09-13 16:45:54,tomryan77843869,,0,0,0,"I'm watching Leicester City are you watching Brendan Rodgers ?",,,,643103318898778112,https://twitter.com/tomryan77843869/status/643103318898778112
2015-09-13 16:45:54,sheeun11,,0,1,0,"I can't wait for Leicester City FC to thrash Rodgers and Liverpool in the #EPL,they're so enjoyable to watch! #LFC",,,#EPL #LFC,643103318294839296,https://twitter.com/sheeun11/status/643103318294839296
2015-09-13 16:45:53,CaliWolverine,,0,0,0,"I love laughing at Brad Guzan as he loses it on his defenders when he concedes a goal. It's the little things in life. #LeicesterCity",,,#LeicesterCity,643103314733756417,https://twitter.com/CaliWolverine/status/643103314733756417
2015-09-13 16:45:41,SeyramSuarez,,0,0,0,"Leicester city never say die spirit",,,,643103264901341184,https://twitter.com/SeyramSuarez/status/643103264901341184
2015-09-13 16:45:37,TheBest_ManUtd,,0,0,0,"Live Sunday football: Leicester City v Aston Villa http://goo.gl/fb/evaIeX",,,,643103250074353665,https://twitter.com/TheBest_ManUtd/status/643103250074353665
2015-09-13 16:45:37,_SHUKRI_,,0,0,0,"Leicester City killing people sia...Comeback sial",,,,643103249835257861,https://twitter.com/_SHUKRI_/status/643103249835257861
2015-09-13 16:45:33,BeriThomson,,0,0,0,"How happy is this guy about the goal #GOALDANCE #epl #bpl #leicestercity pic.twitter.com/AzYxtcrEsQ",,,#GOALDANCE #epl #bpl #leicestercity,643103230331854849,https://twitter.com/BeriThomson/status/643103230331854849
2015-09-13 16:45:31,GoodPeps,,0,0,0,"#leicesterCity are not a plucky little club. They have some serious talent and come right down your throat. They are so quick to the ball.",,,#leicesterCity,643103222656303104,https://twitter.com/GoodPeps/status/643103222656303104
2015-09-13 16:45:30,AlleyMatty,,0,5,6,"Security man at Leicester knows how to celebrate #Leicestercity https://vine.co/v/eFD5EQMt9gh",,,#Leicestercity,643103218080288769,https://twitter.com/AlleyMatty/status/643103218080288769
2015-09-13 16:45:26,Bisolaaa,,1,0,0,"Frigging Leicester City have a better coach than us.",,,,643103200795598850,https://twitter.com/Bisolaaa/status/643103200795598850
2015-09-13 16:45:25,phemoy,,0,1,0,"Where on earth did Leicester City get Riyad Mahrez from???????? He is an ABSOLUTE monster of a dribbler!!!! Electrifying!! #SuperSunday #BPL",,,#SuperSunday #BPL,643103198165774336,https://twitter.com/phemoy/status/643103198165774336
2015-09-13 16:45:23,CammyCowan98,,0,0,0,"Leicester City are on fire the now",,,,643103188783132672,https://twitter.com/CammyCowan98/status/643103188783132672
2015-09-13 16:45:21,JMURPHY_27387,,0,0,0,"This Leicester city high tempo performance is what Ronnie deila is looking for",,,,643103182772678656,https://twitter.com/JMURPHY_27387/status/643103182772678656
2015-09-13 16:45:19,law_cee,,0,0,0,"When Leicester city gets the momentum going very few can stop them.",,,,643103175600414720,https://twitter.com/law_cee/status/643103175600414720
2015-09-13 16:45:17,RotoWireAndrew,gochaita,1,0,0,"@gochaita Leicester City to Real Madrid, haha",,@gochaita,,643103164720377856,https://twitter.com/RotoWireAndrew/status/643103164720377856
2015-09-13 16:45:15,SriramAavichi,,0,0,0,"Leicester city have been absolutely amazing; I wouldn't be surprised if one or two of the big teams drop points against them #LEIAVL #BPL",,,#LEIAVL #BPL,643103155287232512,https://twitter.com/SriramAavichi/status/643103155287232512
2015-09-13 16:45:14,houtanrasouli,,1,0,0,"Watching #LC vs #AVL (2:2) at 85:00 such an amazing game @premierleague Leicester City fights with all of their hearts! They deserve a win!",,@premierleague,#LC #AVL,643103151906758657,https://twitter.com/houtanrasouli/status/643103151906758657
2015-09-13 16:45:11,Toshiki_Yasuda,,0,0,7,"I can't be the only one watching this Leicester City vs. Aston Villa game",,,,643103139722170368,https://twitter.com/Toshiki_Yasuda/status/643103139722170368
2015-09-13 16:45:11,TKT_Mshika,,0,0,0,"Leicester City !!!",,,,643103137893621764,https://twitter.com/TKT_Mshika/status/643103137893621764
2015-09-13 16:45:10,Goal_India,,0,1,0,"GOAL! Leicester City 2-2 Aston Villa... Vardy scores! http://bit.ly/1gjxvsU #avfc #lcfc",,,#avfc #lcfc,643103136748556289,https://twitter.com/Goal_India/status/643103136748556289
2015-09-13 16:45:07,MOB5STAR,,0,4,2,"@EASPORTSFIFA Mahrez for Leicester City deserves to be 5 star skiller and minimum 82 rated. #BPL #fifa16 @Castro1021 @ChuBoi",,@EASPORTSFIFA @Castro1021 @ChuBoi,#BPL #fifa16,643103124803203072,https://twitter.com/MOB5STAR/status/643103124803203072
2015-09-13 16:45:07,jazzasouthern,,0,0,0,"Leicester City looking really good :/",,,,643103123104378880,https://twitter.com/jazzasouthern/status/643103123104378880
2015-09-13 16:45:07,fckarlov,,0,0,1,"LEICESTER CITY",,,,643103121615519746,https://twitter.com/fckarlov/status/643103121615519746
2015-09-13 16:45:05,GaretKimmet,,0,0,0,"Leicester City have themselves a hell of a player in Mahrez. The man's an genius. #BPL",,,#BPL,643103112715206657,https://twitter.com/GaretKimmet/status/643103112715206657
2015-09-13 16:45:02,Ibmsally,,0,0,0,"I love the way this leicester city play... very determine, discipline",,,,643103104100134912,https://twitter.com/Ibmsally/status/643103104100134912
2015-09-13 16:45:02,PoojaMedia,,0,0,0,"Leicester City want to remain unbeaten.. Massive spirit from them. #PBLive",,,#PBLive,643103103605190656,https://twitter.com/PoojaMedia/status/643103103605190656
2015-09-13 16:45:01,JPduPlessis11,,0,0,0,"Dear Brendan. You know Leicester City? Now THAT's character.",,,,643103098806894593,https://twitter.com/JPduPlessis11/status/643103098806894593
2015-09-13 16:45:01,TayoMarciano,,0,1,0,"Leicester City's philosophy goes like this: U may be better than us, we may not win at the end but u not walk out with a victory easily.",,,,643103098483793920,https://twitter.com/TayoMarciano/status/643103098483793920
2015-09-13 16:45:01,CoachLuwi,FVCentral,0,0,0,"@tw14renato he won't be at Leicester City next season...",,@tw14renato,,643103097250779136,https://twitter.com/CoachLuwi/status/643103097250779136
2015-09-13 16:45:01,litwithlayton,,0,0,3,"Final minutes of Villa-Leicester City is pretty dope.",,,,643103097108213760,https://twitter.com/litwithlayton/status/643103097108213760
2015-09-13 16:45:00,M_Schnoes34,,0,0,0,"Leicester City plays soccer like I play FIFA #aggressive",,,#aggressive,643103095212347392,https://twitter.com/M_Schnoes34/status/643103095212347392
2015-09-13 16:44:59,MrAsimolowo,,0,0,0,"On loan"" @joegunson: I didn't know Dyer is a Leicester City player.""",,@joegunson,,643103089457799168,https://twitter.com/MrAsimolowo/status/643103089457799168
2015-09-13 16:44:59,rioadriano,,0,0,0,"Leicester City will win the PL.",,,,643103089206038528,https://twitter.com/rioadriano/status/643103089206038528
2015-09-13 16:44:56,TCBsoccer,,0,0,0,"Leicester City sees blood, they're really going for it.",,,,643103078657458176,https://twitter.com/TCBsoccer/status/643103078657458176
2015-09-13 16:44:52,DevilRays9,,0,0,0,"Did Leicester City and Chelsea exchanged name before the season begin?",,,,643103060219170816,https://twitter.com/DevilRays9/status/643103060219170816
2015-09-13 16:44:49,sydneyandsports,,0,0,0,"leicester city",,,,643103048747872256,https://twitter.com/sydneyandsports/status/643103048747872256
2015-09-13 16:44:47,Jones1213,,0,0,0,"Arsenal need a striker with as much enthusiasm as Vardy is showing. #LeicesterCity",,,#LeicesterCity,643103039914684416,https://twitter.com/Jones1213/status/643103039914684416
2015-09-13 16:44:47,EJNorskUffDa,,0,0,0,"King Power is fucking rocking right now and it is awesome to see and hear on TV #Foxes #LeicesterCity #BPLonNBC #LEIAVL",,,#Foxes #LeicesterCity #BPLonNBC #LEIAVL,643103039331549185,https://twitter.com/EJNorskUffDa/status/643103039331549185
2015-09-13 16:44:47,lapak_ardi,,0,0,0,"What a come back Leicester City !",,,,643103039033733122,https://twitter.com/lapak_ardi/status/643103039033733122
2015-09-13 16:44:43,bigdaveeden,,0,0,0,"I take it number 26 of Leicester City will be banned @FA ?",,@FA,,643103024286695424,https://twitter.com/bigdaveeden/status/643103024286695424
2015-09-13 16:44:41,AstonVillaFNH,,0,0,0,"#LCFC #AVFC 81mins #Leicester come back from 2-0 down against #Villa #LeicesterCity 2-2 #AstonVilla #fnh",,,#LCFC #AVFC #Leicester #Villa #LeicesterCity #AstonVilla #fnh,643103012152545280,https://twitter.com/AstonVillaFNH/status/643103012152545280
2015-09-13 16:44:39,Beelal92,,0,0,0,"Leicester City",,,,643103004011327489,https://twitter.com/Beelal92/status/643103004011327489
2015-09-13 16:44:29,MargieChelsia,,0,0,0,"I so love how Leicester City is playing.",,,,643102961867038722,https://twitter.com/MargieChelsia/status/643102961867038722
2015-09-13 16:44:27,androidgd,,0,1,0,"The Leicester City ball boy is killing me with his reactions to this game. #notsuboptimal",,,#notsuboptimal,643102955823046656,https://twitter.com/androidgd/status/643102955823046656
2015-09-13 16:44:27,HerrejonPedro,,0,0,0,"Not sure if this is Leicester City or Real Madrid in Leicester uniforms against villa. #LeicesterCity #astonvilla #BPL",,,#LeicesterCity #astonvilla #BPL,643102954992496640,https://twitter.com/HerrejonPedro/status/643102954992496640
2015-09-13 16:44:25,Chigs91,,0,0,1,"Loving this Leicester City vs Villa match.",,,,643102946964709376,https://twitter.com/Chigs91/status/643102946964709376
2015-09-13 16:44:23,Carlo_Campo,,0,0,1,"Leicester City is carrying me to glory in fantasy football.",,,,643102939503063041,https://twitter.com/Carlo_Campo/status/643102939503063041
2015-09-13 16:44:19,dhebylicious,,1,0,0,""" @Laamar__: Leicester City. That goals has been Knocking"" Those Villa players r dull. 2goals up @70mins n u can't manage 2 hold ball 4 5secs",,@Laamar__ @70mins,,643102921165537280,https://twitter.com/dhebylicious/status/643102921165537280
2015-09-13 16:44:18,MikePrittie,,0,0,0,"Leicester city vs Ason Villa is getting exciting. Amazing comeback by LC. #lcfcvavfc #lcfc #bpl",,,#lcfcvavfc #lcfc #bpl,643102918661398528,https://twitter.com/MikePrittie/status/643102918661398528
2015-09-13 16:44:18,SoccerCTC,,1,0,1,"Leicester City = Dyer + Vardy + 9 other guys who get the ball to Dyer and Vardy.",,,,643102917466021893,https://twitter.com/SoccerCTC/status/643102917466021893
2015-09-13 16:44:16,BenAllain,,0,0,0,"I'm giving up on Spurs and am now 100% a Leicester City fan. (I've been cheering for Leicester when they play Spurs anyway.)",,,,643102907320127488,https://twitter.com/BenAllain/status/643102907320127488
2015-09-13 16:44:15,MitchFountain,,0,0,4,"Who just see the Leicester city's steward going mental",,,,643102903008382976,https://twitter.com/MitchFountain/status/643102903008382976
2015-09-13 16:44:14,ZahiddAhmed,,0,0,1,"#LeicesterCity is always deadly and toughest to defend against in the last quarter of the match.",,,#LeicesterCity,643102902479884288,https://twitter.com/ZahiddAhmed/status/643102902479884288
2015-09-13 16:44:14,DaveOCKOP,,1,73,72,"Loving the passion from this Leicester City official. https://vine.co/v/eFD5J02v9AF",,,,643102900340834305,https://twitter.com/DaveOCKOP/status/643102900340834305
2015-09-13 16:44:12,KevNGxx,,0,0,0,"It's a sad state of affairs when Leicester City FC have more about them than Liverpool.",,,,643102890693931008,https://twitter.com/KevNGxx/status/643102890693931008
2015-09-13 16:44:11,bc_1973lfc,,1,0,1,"Fight. passion. Heart. Commitment. Playing for the manager and fans. This is Leicester City. Liverpool lack all of the above.",,,,643102889725042688,https://twitter.com/bc_1973lfc/status/643102889725042688
2015-09-13 16:44:10,ROD_YTbe,,0,0,0,"¡Gol de Vardy! ¡Gol del Leicester City! Leicester City 2-2 Aston Villa.",,,,643102883899174912,https://twitter.com/ROD_YTbe/status/643102883899174912
2015-09-13 16:44:09,kaputarrr,,0,0,0,"This should be the most exciting game I've seen this season. Leicester city vs Aston villa",,,,643102880401084416,https://twitter.com/kaputarrr/status/643102880401084416
2015-09-13 16:44:09,Warjr21,,0,0,0,"This Leicester city and Aston villa game is intense",,,,643102879235092480,https://twitter.com/Warjr21/status/643102879235092480
2015-09-13 16:44:09,SantiClaus,,0,0,0,"Gwan Leicester City and Mahrez.. Hope he scores the winner.",,,,643102877817417728,https://twitter.com/SantiClaus/status/643102877817417728
2015-09-13 16:44:07,Ben__Nadeau,,0,0,0,"Wow, this Leicester City vs. Aston Villa game has been bananas -- what an absolute treat to watch! #LCFC #AVFC",,,#LCFC #AVFC,643102872700370944,https://twitter.com/Ben__Nadeau/status/643102872700370944
2015-09-13 16:44:05,Oakpolo7,,0,0,0,"Is there anyone not cheering on #leicestercity ?",,,#leicestercity,643102861933563904,https://twitter.com/Oakpolo7/status/643102861933563904
2015-09-13 16:44:04,Drraskob86,,0,0,1,"I'm a Leicester City fan now.",,,,643102859836456961,https://twitter.com/Drraskob86/status/643102859836456961
2015-09-13 16:44:04,redian77,,0,0,1,"Leicester City would hammer #LFC",,,#LFC,643102857646997504,https://twitter.com/redian77/status/643102857646997504
2015-09-13 16:44:01,landon_harris,,0,0,0,"#LeicesterCity is fun to watch. This game is on full pace.",,,#LeicesterCity,643102847240802304,https://twitter.com/landon_harris/status/643102847240802304
2015-09-13 16:43:57,TalkWithTatar,,0,0,0,"Never thought an Aston Villa v Leicester City game could be so fun to watch",,,,643102831591981056,https://twitter.com/TalkWithTatar/status/643102831591981056
2015-09-13 16:43:57,rhyskjohnson,,0,0,0,"Leicester City putting in the work today!",,,,643102829020901376,https://twitter.com/rhyskjohnson/status/643102829020901376
2015-09-13 16:43:56,Gary_R_Adams,,0,0,0,"Look at that @LFC. You don't have to spend a bunch of money to have some fight and desire about you. Leicester City doing themselves proud.",,@LFC,,643102825631862784,https://twitter.com/Gary_R_Adams/status/643102825631862784
2015-09-13 16:43:55,tribundergi,,0,0,7,"GOOOLLL 82' Vardy (Leicester City 2 - Aston Villa 2)",,,,643102822456786945,https://twitter.com/tribundergi/status/643102822456786945
2015-09-13 16:43:55,AlexPatel_95,,0,0,0,"You can only have pure love for Leicester City FC",,,,643102822347706369,https://twitter.com/AlexPatel_95/status/643102822347706369
2015-09-13 16:43:55,Arse_n_Nose,,0,0,0,"Leicester City really exciting to watch",,,,643102820238028800,https://twitter.com/Arse_n_Nose/status/643102820238028800
2015-09-13 16:43:53,MlDibo,,0,0,0,"Exciting game between Leicester City and Aston Villa.",,,,643102811983622144,https://twitter.com/MlDibo/status/643102811983622144
2015-09-13 16:43:50,rezadiazCFC,,0,0,0,"LEICESTER CITY FOOTBALL CLUB, King Power Stadium I love you :)",,,,643102800491053056,https://twitter.com/rezadiazCFC/status/643102800491053056
2015-09-13 16:43:49,clancyclancy9,,0,0,1,"Leicester City has made more comebacks this season than Brendan Rodgers' entire career at LFC. Hahaha.",,,,643102794832936961,https://twitter.com/clancyclancy9/status/643102794832936961
2015-09-13 16:43:48,AlexPaterson0,,0,0,0,"What a second half this has been between Leicester City and Villa",,,,643102792073248768,https://twitter.com/AlexPaterson0/status/643102792073248768
2015-09-13 16:43:48,MrTazofficial,,0,0,0,"Leicester City are on one right now",,,,643102790999515136,https://twitter.com/MrTazofficial/status/643102790999515136
2015-09-13 16:43:47,sparkzeast,,0,0,0,"Leicester city are mad team ya'know 2-0 down 20 minutes to go, ten minutes later is 2-2",,,,643102787820195842,https://twitter.com/sparkzeast/status/643102787820195842
2015-09-13 16:43:46,acdcjacko,,0,0,0,"Leicester City playing like champions. The table doesn't lie. They are the second best team in the league right now. Utter class about them.",,,,643102783953084416,https://twitter.com/acdcjacko/status/643102783953084416
2015-09-13 16:43:46,bellamoir,,0,0,0,"A good day, and that point vs Leicester City looks a bit more valuable now..... #coys",,,#coys,643102783915335680,https://twitter.com/bellamoir/status/643102783915335680
2015-09-13 16:43:44,theomethod7,,0,0,0,"What a game #LeicesterCity_AstonVilla #EPL",,,#LeicesterCity_AstonVilla #EPL,643102776290095104,https://twitter.com/theomethod7/status/643102776290095104
2015-09-13 16:43:43,oymxmi,,0,0,0,"Leicester City! Believe the hype",,,,643102772154363904,https://twitter.com/oymxmi/status/643102772154363904
2015-09-13 16:43:43,Atleticograce,,0,1,1,"Looks like Leicester City have the same 'never say die' attitude as The Tap eh? @sam_lcfc11",,@sam_lcfc11,,643102771051429888,https://twitter.com/Atleticograce/status/643102771051429888
