date,username,to,replies,retweets,favorites,text,geo,mentions,hashtags,id,permalink
2015-09-13 16:52:26,EEnderinWales,,0,0,1,"So Nathan Dyer scores a goal for #LeicesterCity clearly injured and his colleagues don't jump on top of him. #Tottenham players take note",,,#LeicesterCity #Tottenham,643104962629738496,https://twitter.com/EEnderinWales/status/643104962629738496
2015-09-13 16:52:25,AlexPaterson0,,0,0,0,"Hard to believe that Leicester City was losing, and here they are winning",,,,643104960784269312,https://twitter.com/AlexPaterson0/status/643104960784269312
2015-09-13 16:52:25,stuart_d_15,,0,0,0,"Unbelievable game Leicester city v Aston villa.. Brilliant play by Leicester.",,,,643104960427782144,https://twitter.com/stuart_d_15/status/643104960427782144
2015-09-13 16:52:25,JudeAgba,,0,0,0,"Leicester City is becoming the new Southampton.",,,,643104959735554049,https://twitter.com/JudeAgba/status/643104959735554049
2015-09-13 16:52:23,serbijagamer89,,0,0,0,"Leicester City what a comeback!!!! Awesome!!!",,,,643104953188257792,https://twitter.com/serbijagamer89/status/643104953188257792
2015-09-13 16:52:23,dannyw3369,,0,0,0,"Gotta love Leicester city :)",,,,643104952202731520,https://twitter.com/dannyw3369/status/643104952202731520
2015-09-13 16:52:21,ThlsisOurYear,,0,0,1,"Leicester City soccer club are better at kicking balls than Liverpool Soccer Club",,,,643104942413234176,https://twitter.com/ThlsisOurYear/status/643104942413234176
2015-09-13 16:52:21,soccerscoresnet,,0,0,0,"Leicester City 3-2 Aston Villa (England) #livescoreshttp://bit.ly/1LyFd0j",,,#livescoreshttp,643104942316744704,https://twitter.com/soccerscoresnet/status/643104942316744704
2015-09-13 16:52:20,MesutsTouch,,0,0,0,"What a comeback from Leicester City!! From 2-0 down to 3-2 win!! #BPL",,,#BPL,643104940655779840,https://twitter.com/MesutsTouch/status/643104940655779840
2015-09-13 16:52:19,RedArmy714,,0,0,0,"What a game! What a turn around! What a come back! Leicester City you beauty.",,,,643104936234913793,https://twitter.com/RedArmy714/status/643104936234913793
2015-09-13 16:52:19,Uchesworld,,0,0,0,"Unbelievable! What a comeback! From 2-0 to 2-3. Well done,Leicester City.",,,,643104934725070848,https://twitter.com/Uchesworld/status/643104934725070848
2015-09-13 16:52:19,This_Is_Ledzi,,0,0,0,"Leicester city.... Respect!!!",,,,643104933563248640,https://twitter.com/This_Is_Ledzi/status/643104933563248640
2015-09-13 16:52:18,kevin_the_gray,,0,0,0,"Even Leicester City has more character than #LFC to come from behind and win! #Comeback",,,#LFC #Comeback,643104929847115776,https://twitter.com/kevin_the_gray/status/643104929847115776
2015-09-13 16:52:18,MargieChelsia,,0,3,0,"So Chelsea has really swapped positions with Leicester City,poor us,smh.",,,,643104929322803200,https://twitter.com/MargieChelsia/status/643104929322803200
2015-09-13 16:52:17,gilngango,,0,0,0,"It's soo fun to watch him #LeicesterCity play. It's hard to believe they were struggling the major part of last season without winning",,,#LeicesterCity,643104927468883968,https://twitter.com/gilngango/status/643104927468883968
2015-09-13 16:52:15,kaschmidt,,0,0,0,"Leicester City likely won't maintain this form all season (like Southampton last year), but they're fun to watch! #EPL",,,#EPL,643104920363761664,https://twitter.com/kaschmidt/status/643104920363761664
2015-09-13 16:52:15,Teicsi,,0,0,0,"Haven't watched the game, but Leicester city and Mahrez... What the actual fuck!? :O :D",,,,643104919898165249,https://twitter.com/Teicsi/status/643104919898165249
2015-09-13 16:52:15,Mr_B15,,0,0,0,"Got in the shower and it was 2-1 Aston Villa. Get out & now it's 3-2 Leicester City, wow.",,,,643104919768203264,https://twitter.com/Mr_B15/status/643104919768203264
2015-09-13 16:52:14,budi_seth,,0,0,0,"Heii @LFC @John_W_Henry you learn something from #leicestercity?? You see their pace and spirit of football?? Please sack rodgers..",,@LFC @John_W_Henry,#leicestercity,643104913497550848,https://twitter.com/budi_seth/status/643104913497550848
2015-09-13 16:52:13,MR16gunner,,0,0,0,"Leicester City is simply incredible!",,,,643104908036702208,https://twitter.com/MR16gunner/status/643104908036702208
2015-09-13 16:52:12,Tonyhardie16,,0,0,0,"Half depressing the way half of the liverpool fan base r becoming leicester city fans",,,,643104907004919812,https://twitter.com/Tonyhardie16/status/643104907004919812
2015-09-13 16:52:10,sheeun11,,0,1,0,"Leicester City have better Coach than #LFC",,,#LFC,643104898507239424,https://twitter.com/sheeun11/status/643104898507239424
2015-09-13 16:52:10,ChocKid,,0,0,0,"Leicester City though...evil",,,,643104897030750212,https://twitter.com/ChocKid/status/643104897030750212
2015-09-13 16:52:09,dpmay,,0,0,0,"Leicester City, the Premier League's Borussia Dortmund. Such high energy, pressing and great counter attack. Excellent to watch.",,,,643104895151775744,https://twitter.com/dpmay/status/643104895151775744
2015-09-13 16:52:09,PrtkNavghare,,0,0,0,"Manchester United vs Leicester City is gonna be some match!",,,,643104894467993600,https://twitter.com/PrtkNavghare/status/643104894467993600
2015-09-13 16:52:09,alexnjenga,,0,0,0,"Incredible 2nd half from Leicester City.",,,,643104892932988928,https://twitter.com/alexnjenga/status/643104892932988928
2015-09-13 16:52:08,AJpatriote,,0,0,0,"Man City and Leicester City, the only unbeaten teams in the premier league.",,,,643104891037024256,https://twitter.com/AJpatriote/status/643104891037024256
2015-09-13 16:52:08,jdwmaguire,,0,0,0,"What a start Vardy and Mahrez is having for Leicester City.",,,,643104888713543680,https://twitter.com/jdwmaguire/status/643104888713543680
2015-09-13 16:52:08,MahmoudRabi3,,0,0,0,"And that means #leicester_city to 2nd place in #PremierLeague",,,#leicester_city #PremierLeague,643104888411561984,https://twitter.com/MahmoudRabi3/status/643104888411561984
2015-09-13 16:52:08,phemoy,,0,0,0,"Leicester City have been IMMENSE today!! What a second half it's been! Over the moon I didn't miss this game!! #LEIAVL #Mahrez #SuperSunday",,,#LEIAVL #Mahrez #SuperSunday,643104886964535296,https://twitter.com/phemoy/status/643104886964535296
2015-09-13 16:52:07,Caljack26,,0,0,0,"What a comeback by leicester City ...0-2 down from two absolute peaches by Villa to go 3-2 up...",,,,643104884234059776,https://twitter.com/Caljack26/status/643104884234059776
2015-09-13 16:52:06,Absteen1,,0,0,0,"What a comeback #LeicesterCity Villa had this one in the bag or so they thought Great game this!",,,#LeicesterCity,643104880534659072,https://twitter.com/Absteen1/status/643104880534659072
2015-09-13 16:52:02,mrtayo1130,,0,0,0,"Wow.. Leicester city! From 2-0 down to leading 3-2",,,,643104865519013888,https://twitter.com/mrtayo1130/status/643104865519013888
2015-09-13 16:52:02,YaxleyAdam,YaxleyAdam,0,0,0,"I hate Leicester City. Bring on October 3rd.",,,,643104863241547776,https://twitter.com/YaxleyAdam/status/643104863241547776
2015-09-13 16:52:01,DanPegs,,0,0,0,"So glad I turned on this #lcfc #avfc match! I'm a Liverpool supporter but honestly becoming more and more a fan of Leicester city foxes",,,#lcfc #avfc,643104859021950976,https://twitter.com/DanPegs/status/643104859021950976
2015-09-13 16:52:01,DB_AVFC,,0,0,0,"Well deserved Leicester city made the right substitutions we made the worse ones.....",,,,643104858057383937,https://twitter.com/DB_AVFC/status/643104858057383937
2015-09-13 16:52:00,FootballVideos,,2,110,118,"What a comeback from Leicester City. WE LOVE THE PREMIER LEAGUE!",,,,643104857088479232,https://twitter.com/FootballVideos/status/643104857088479232
2015-09-13 16:51:57,Mjeff82,,0,0,0,"Leicester City everyone's favorite second team! Love it!!!! #lcfc #foxes",,,#lcfc #foxes,643104843633164288,https://twitter.com/Mjeff82/status/643104843633164288
2015-09-13 16:51:57,AlbertoFCB123,,0,0,0,"This Leicester City vs Aston Villa game is actually insane. So fun to watch",,,,643104842022522880,https://twitter.com/AlbertoFCB123/status/643104842022522880
2015-09-13 16:51:56,buddy_swag,,0,0,0,"Leicester City is on steroids guys.",,,,643104840390963201,https://twitter.com/buddy_swag/status/643104840390963201
2015-09-13 16:51:56,kaushik_ingti,,0,0,0,"What a turn around its been for leicester city amazing, from 2-0 down to 3-2 up now Great spirit shown by them #LEIvAVL #BPL #fantastic",,,#LEIvAVL #BPL #fantastic,643104840067866624,https://twitter.com/kaushik_ingti/status/643104840067866624
2015-09-13 16:51:55,gurjinderks,,0,0,0,"Leicester City comeback wow #LEIAVL",,,#LEIAVL,643104835286495232,https://twitter.com/gurjinderks/status/643104835286495232
2015-09-13 16:51:55,SpicyGovan,,0,0,2,"Leicester City, you beautiful foxy bastards pic.twitter.com/6Qn3GBiuOZ",,,,643104835181617152,https://twitter.com/SpicyGovan/status/643104835181617152
2015-09-13 16:51:55,RoanGurkhay237,,0,0,0,"Leicester City with a great comeback.",,,,643104833549930496,https://twitter.com/RoanGurkhay237/status/643104833549930496
2015-09-13 16:51:54,DaOneandOnly7,,0,0,0,"Leicester city is going to be my FIFA 16 team",,,,643104832262377472,https://twitter.com/DaOneandOnly7/status/643104832262377472
2015-09-13 16:51:52,DevilRays9,,0,1,0,"Breaking News: Chelsea to buy entire Leicester City's team for 50 millions...",,,,643104822078509056,https://twitter.com/DevilRays9/status/643104822078509056
2015-09-13 16:51:52,destiantop,,0,0,0,"Horas Leicester City! you're an extra ordinary team",,,,643104820962836481,https://twitter.com/destiantop/status/643104820962836481
2015-09-13 16:51:52,SoccerSerber,,0,0,0,"This comeback from #LeicesterCity shows the same kind of fight that saved them last year & is propelling them up the table this year #LEIAVL",,,#LeicesterCity #LEIAVL,643104820396621824,https://twitter.com/SoccerSerber/status/643104820396621824
2015-09-13 16:51:51,Trevor_Fisher,,0,0,0,"Well done Leicester City!! Now that's what you call character, determination and a will to win. Wish the current #LFC side had half as much",,,#LFC,643104816827375616,https://twitter.com/Trevor_Fisher/status/643104816827375616
2015-09-13 16:51:51,sc__6,,0,0,1,"Leicester City quality come-back! #LEIAVL",,,#LEIAVL,643104816735100929,https://twitter.com/sc__6/status/643104816735100929
2015-09-13 16:51:50,aaabeljnr,,0,1,1,"Leicester City",,,,643104814415650817,https://twitter.com/aaabeljnr/status/643104814415650817
2015-09-13 16:51:50,RedDevilReports,,0,0,0,"Not news but what a brave header from Nathan dyer then to take all 3 points for Leicester City #avfc #lcfc",,,#avfc #lcfc,643104813262241793,https://twitter.com/RedDevilReports/status/643104813262241793
2015-09-13 16:51:49,JeffYocom,,0,1,1,"Wow what a last 30 min for Leicester City scoring 3 against Aston Villa. #BPLonNBC",,,#BPLonNBC,643104809239744512,https://twitter.com/JeffYocom/status/643104809239744512
2015-09-13 16:51:48,Magzii_Jojo,,0,1,3,"Well done to Leicester City FC #GoodComeBack",,,#GoodComeBack,643104805934735361,https://twitter.com/Magzii_Jojo/status/643104805934735361
2015-09-13 16:51:48,jack7c4,,0,0,0,"Yes Leicester City!!!!!!",,,,643104803141386240,https://twitter.com/jack7c4/status/643104803141386240
2015-09-13 16:51:47,abhinav757,,0,0,0,"Only if Liverpool FC had shown half the passion and desire as Leicester City are showing right now. #LFC #LCFC",,,#LFC #LCFC,643104802684182528,https://twitter.com/abhinav757/status/643104802684182528
2015-09-13 16:51:47,yellowhannah33,,1,0,0,"This has been a fun game #LeicesterCity #astonvilla",,,#LeicesterCity #astonvilla,643104801228783616,https://twitter.com/yellowhannah33/status/643104801228783616
2015-09-13 16:51:46,KJ_MUFC,,0,0,0,"What a comeback by Leicester City!!",,,,643104798225510401,https://twitter.com/KJ_MUFC/status/643104798225510401
2015-09-13 16:51:45,littepea,,0,0,0,"Leicester city now does remind me of Manu a never die team spirit",,,,643104791220981760,https://twitter.com/littepea/status/643104791220981760
2015-09-13 16:51:44,mubarakhadha,,0,0,0,"Unbelieveable leicester city.",,,,643104789123887104,https://twitter.com/mubarakhadha/status/643104789123887104
2015-09-13 16:51:43,adbrent,,0,0,0,"What a comeback by Leicester City, excellent and full value for the win. #LEIAVL #SSFootball #BPL",,,#LEIAVL #SSFootball #BPL,643104786078896128,https://twitter.com/adbrent/status/643104786078896128
2015-09-13 16:51:43,KirkGreenslade,GaryLineker,0,0,0,"@GaryLineker Well done Nathan Dyer, such a brave header!! Well done Leicester City on an excellent comeback!",,@GaryLineker,,643104785902780416,https://twitter.com/KirkGreenslade/status/643104785902780416
2015-09-13 16:51:43,nii_sarpei,,0,0,0,"Claudio Tinkerman Ranieri. Leicester City, bruh!!!",,,,643104782979342336,https://twitter.com/nii_sarpei/status/643104782979342336
2015-09-13 16:51:41,vinayakkm,,0,0,0,"Leicester City. What a bloody brilliant team.",,,,643104776461221888,https://twitter.com/vinayakkm/status/643104776461221888
2015-09-13 16:51:41,Ahmed_Baines,,0,0,0,"It hurt so bad that Leicester city playing better football than Liverpool #SackRodgers#RodgersOut@LFC@empireofthekop pic.twitter.com/xB0Q2R5IXK",,@LFC @empireofthekop,#SackRodgers #RodgersOut,643104775920291841,https://twitter.com/Ahmed_Baines/status/643104775920291841
2015-09-13 16:51:39,I_ortegga,,0,0,0,"Leicester City still unbeatable . Unreal season they're having .",,,,643104769142337536,https://twitter.com/I_ortegga/status/643104769142337536
2015-09-13 16:51:39,BlueLionTweets,,0,0,0,"Leicester city fans going crazy at KP stadium.",,,,643104766785024000,https://twitter.com/BlueLionTweets/status/643104766785024000
2015-09-13 16:51:39,Selby089,,0,0,0,"Leicester City FC is quickly becoming my all time favorite team in the Premiere league. #AllHeart #ClutchPlay @LCFC",,@LCFC,#AllHeart #ClutchPlay,643104766256640000,https://twitter.com/Selby089/status/643104766256640000
2015-09-13 16:51:38,Sid10RedDevil,,0,0,0,"Great comeback from Leicester City..!! Mahrez has been phenomenal this season!! #BPL",,,#BPL,643104762531999744,https://twitter.com/Sid10RedDevil/status/643104762531999744
2015-09-13 16:51:38,iHadi89,,0,0,0,"Impressive comeback by Leicester city !",,,,643104761764442113,https://twitter.com/iHadi89/status/643104761764442113
2015-09-13 16:51:37,_jaycliff_,,0,0,0,"wow @Leicester city",,@Leicester,,643104759990362112,https://twitter.com/_jaycliff_/status/643104759990362112
2015-09-13 16:51:37,GrasscutterUK,,0,0,0,"What a comeback from Leicester City against Aston Villa ...0-2 down with 19mins left, to 3-2 up in the last minute ...superb",,,,643104758681718784,https://twitter.com/GrasscutterUK/status/643104758681718784
2015-09-13 16:51:37,mahk_marsha,,0,1,0,"Leicester City is my second team mayne, they are good to watch!",,,,643104758602051584,https://twitter.com/mahk_marsha/status/643104758602051584
2015-09-13 16:51:37,MilanOutLoud,,0,0,0,"Ranieri is having quite a comeback in England with Leicester City. 5 games in, second place under Man City.",,,,643104758346059778,https://twitter.com/MilanOutLoud/status/643104758346059778
2015-09-13 16:51:37,sandmanbs81,,0,0,0,"Leicester City continues to impress. Wow",,,,643104758161510400,https://twitter.com/sandmanbs81/status/643104758161510400
2015-09-13 16:51:36,joehartley87,,0,0,0,"Unreal character by Leicester City. Villa gone to sleep at half time to be fair",,,,643104756068651008,https://twitter.com/joehartley87/status/643104756068651008
2015-09-13 16:51:36,stylesclash69,,0,0,0,"Leicester City is going second on the @premierleague table!!!!",,@premierleague,,643104753967341568,https://twitter.com/stylesclash69/status/643104753967341568
2015-09-13 16:51:36,CharIieGarcia,,0,0,0,"what a way to win it boys! #LeicesterCity",,,#LeicesterCity,643104753153474560,https://twitter.com/CharIieGarcia/status/643104753153474560
2015-09-13 16:51:36,DanGHughes,,0,0,0,"This is why I love football. Leicester City what a game",,,,643104753132679169,https://twitter.com/DanGHughes/status/643104753132679169
2015-09-13 16:51:35,justnathaneal,,0,0,0,"Leicester City vs Aston Villa What a game!",,,,643104750498656261,https://twitter.com/justnathaneal/status/643104750498656261
2015-09-13 16:51:33,_brianbeckford,,0,0,0,"Leicester City serious this season",,,,643104743288496128,https://twitter.com/_brianbeckford/status/643104743288496128
2015-09-13 16:51:33,SportsRoadhouse,,0,0,0,"RT "" GOAL Leicester City. Foxes complete their amazing comeback from 2-0 down on header by Nathan Dyer. Incredibly,… "" #SportsRoadhouse",,,#SportsRoadhouse,643104742864883712,https://twitter.com/SportsRoadhouse/status/643104742864883712
2015-09-13 16:51:33,lozowski5,,0,0,2,"When Leicester city is the best team in the world",,,,643104742860832768,https://twitter.com/lozowski5/status/643104742860832768
2015-09-13 16:51:33,Konyye,,0,0,0,"What a comeback from Leicester city",,,,643104742298775552,https://twitter.com/Konyye/status/643104742298775552
2015-09-13 16:51:33,amanbasssi,,1,0,1,"Leicester city. What.",,,,643104742093131776,https://twitter.com/amanbasssi/status/643104742093131776
2015-09-13 16:51:32,khess513,,1,0,0,"Leicester City is just damn fun to watch. Riyad Mahrez is a magician",,,,643104737903124481,https://twitter.com/khess513/status/643104737903124481
2015-09-13 16:51:31,akinleyeajayi,,0,0,0,"Cool comeback Leicester City",,,,643104734413488128,https://twitter.com/akinleyeajayi/status/643104734413488128
2015-09-13 16:51:31,AuliaTogu,,0,0,0,"Wow great comeback from leicester city #lcfc Great game! #LEIAVL @premierleague",,@premierleague,#lcfc #LEIAVL,643104734119792640,https://twitter.com/AuliaTogu/status/643104734119792640
2015-09-13 16:51:30,JustinGlen96,,0,0,1,"I've fell in love way Leicester City after this performance",,,,643104729191575556,https://twitter.com/JustinGlen96/status/643104729191575556
2015-09-13 16:51:29,JD_Akinz,,0,0,0,"Leicester City are for real",,,,643104725819367425,https://twitter.com/JD_Akinz/status/643104725819367425
2015-09-13 16:51:29,SergioChitown,,0,0,0,"Wow what a goal by #Dyer!!! Mad props to #LeicesterCity for this comeback win! #BPL",,,#Dyer #LeicesterCity #BPL,643104723696926720,https://twitter.com/SergioChitown/status/643104723696926720
2015-09-13 16:51:28,AddictedToCFC,,0,4,4,"What a comeback by Leicester City.",,,,643104722975629312,https://twitter.com/AddictedToCFC/status/643104722975629312
2015-09-13 16:51:28,karoon95,,0,0,0,"Best team to watch in the #EPL at the moment: Leicester City Best player to watch: Mahrez. pic.twitter.com/RFye9JFpFX",,,#EPL,643104721385820160,https://twitter.com/karoon95/status/643104721385820160
2015-09-13 16:51:28,fabiogunners,,0,0,0,"Leicester city for europe?",,,,643104719787831296,https://twitter.com/fabiogunners/status/643104719787831296
2015-09-13 16:51:27,REMEMBERTHE96,,0,0,0,"A lot of #LFC players need to watch this #LeicesterCity team and see what passion and pride is",,,#LFC #LeicesterCity,643104715987898368,https://twitter.com/REMEMBERTHE96/status/643104715987898368
2015-09-13 16:51:27,Victors_POV,,0,1,0,"Leicester City Mahrez is a wonderful player. Vardy's work rate and passion is amazing.",,,,643104715367182336,https://twitter.com/Victors_POV/status/643104715367182336
2015-09-13 16:51:27,yosuakristian,,0,0,0,"Leicester City 3-2 Aston Villa.. GAME OF THE WEEEKKKKKKK...!!!!! WHATTA COMEBACK...!!!!",,,,643104715144728576,https://twitter.com/yosuakristian/status/643104715144728576
2015-09-13 16:51:26,JMar_lewis,,0,0,0,"What an amazing comeback from Leicester City. #BPLonNBC",,,#BPLonNBC,643104713827708929,https://twitter.com/JMar_lewis/status/643104713827708929
2015-09-13 16:51:26,wong_lawas58,,0,0,0,"tertinggal 0-2 dari Aston Villa, comeback brilliant dari Leicester City 3-2.. fantastic",,,,643104712796020736,https://twitter.com/wong_lawas58/status/643104712796020736
2015-09-13 16:51:25,MRDANLJONES,,1,1,1,"@LFC take note of Leicester City's fight, passion, desire and hunger, we are lacking in all departments. Good management goes along way.",,@LFC,,643104710594064384,https://twitter.com/MRDANLJONES/status/643104710594064384
2015-09-13 16:51:25,jasonuk17,,0,0,0,"If you had Leicester City sitting 2nd in the #BPL at this point, you're lying. What a run they're on",,,#BPL,643104710073950209,https://twitter.com/jasonuk17/status/643104710073950209
2015-09-13 16:51:25,YusufMFaisal,,0,0,0,"2nd position Leicester City if it stays like this",,,,643104707557355520,https://twitter.com/YusufMFaisal/status/643104707557355520
2015-09-13 16:51:24,wesmanchild,,0,0,0,"WTF....Leicester City are leading now",,,,643104706093580289,https://twitter.com/wesmanchild/status/643104706093580289
2015-09-13 16:51:24,MattesonZac,,0,0,0,"Anyone watching the #LeicesterCity game?!",,,#LeicesterCity,643104704944279552,https://twitter.com/MattesonZac/status/643104704944279552
2015-09-13 16:51:23,naywilson96,,0,0,0,"Leicester City",,,,643104699680464896,https://twitter.com/naywilson96/status/643104699680464896
2015-09-13 16:51:22,BhavenJ_,,0,0,0,"Leicester City are in dream land. What a start to their premier league campaign...",,,,643104697029541888,https://twitter.com/BhavenJ_/status/643104697029541888
2015-09-13 16:51:22,Qaizher,,0,0,0,"Mother fucking spirited team Leicester City are. #LEIAVL",,,#LEIAVL,643104695167258624,https://twitter.com/Qaizher/status/643104695167258624
2015-09-13 16:51:21,woodyoflh,,0,0,0,"Great comeback Leicester city",,,,643104692323520513,https://twitter.com/woodyoflh/status/643104692323520513
2015-09-13 16:51:21,KpanshMasta,,0,1,0,"Leicester City are fucking maddddddddd",,,,643104692004913152,https://twitter.com/KpanshMasta/status/643104692004913152
2015-09-13 16:51:21,priceadams99,,0,0,1,"This Leicester City game is incredible",,,,643104691883233284,https://twitter.com/priceadams99/status/643104691883233284
2015-09-13 16:51:20,darealboss8,,0,0,0,"Leicester City are indeed fearless. Wow. From 0-2 down to 3-2 up!!! Battled hard all the way. #LEIAVL #PremierLeague",,,#LEIAVL #PremierLeague,643104685814059008,https://twitter.com/darealboss8/status/643104685814059008
2015-09-13 16:51:18,TayoMarciano,,0,2,0,"From 2-0 to 3-2, Leicester City is a fascinating team.",,,,643104681233743877,https://twitter.com/TayoMarciano/status/643104681233743877
2015-09-13 16:51:18,JefeMello,,0,0,1,"Leicester City is the way to go!!!!!!!! Great team and extremely confident. #nevergiveup",,,#nevergiveup,643104680395079680,https://twitter.com/JefeMello/status/643104680395079680
2015-09-13 16:51:18,baldninja42,,0,0,0,"Fair play to Leicester city, fabulous comeback, best half of football ive seen this season!",,,,643104677492584448,https://twitter.com/baldninja42/status/643104677492584448
2015-09-13 16:51:17,Kemfon_U,,0,0,0,"United why can we not play like Leicester City",,,,643104675701620738,https://twitter.com/Kemfon_U/status/643104675701620738
2015-09-13 16:51:17,blackeaglefc,,0,0,0,"What an exciting finish to Leicester City vs Aston Villa! Guzan is shaky in goal. I would prefer Howard starting for the USMNT.",,,,643104674661318656,https://twitter.com/blackeaglefc/status/643104674661318656
2015-09-13 16:51:17,IamHaffiz,,0,0,0,"Even Leicester city had a better coach and tactical approach",,,,643104674216742912,https://twitter.com/IamHaffiz/status/643104674216742912
2015-09-13 16:51:17,chasel_1,,0,0,0,"Cinderella story for Leicester City #EPL",,,#EPL,643104673315049472,https://twitter.com/chasel_1/status/643104673315049472
2015-09-13 16:51:16,AliiMuhd,,1,0,0,"Leicester city. What a fucking team!",,,,643104672354467841,https://twitter.com/AliiMuhd/status/643104672354467841
2015-09-13 16:51:16,DiamondkidBello,,0,0,0,"Never count Leicester city out. What a comeback. From 0-2 to 3-2. Damn. #SSFootball #PremierLeague #LeiAst",,,#SSFootball #PremierLeague #LeiAst,643104670743924736,https://twitter.com/DiamondkidBello/status/643104670743924736
2015-09-13 16:51:15,bigetaylor,,0,0,0,"If only Liverpool played with the same spirit as Leicester City. #LFC",,,#LFC,643104665467547648,https://twitter.com/bigetaylor/status/643104665467547648
2015-09-13 16:51:14,Iukmanali,,0,0,1,"Leicester City are something else under Ranieri.",,,,643104663127072768,https://twitter.com/Iukmanali/status/643104663127072768
2015-09-13 16:51:14,DerekArden,,1,0,0,"Amazing 100'% effort from#Leicester City. If u want to win you need commitment pic.twitter.com/7qARKGjjfr",,,#Leicester,643104661969481728,https://twitter.com/DerekArden/status/643104661969481728
2015-09-13 16:51:14,AhmaddSalah,,0,0,0,"Leicester City !!!!",,,,643104661604560897,https://twitter.com/AhmaddSalah/status/643104661604560897
2015-09-13 16:51:14,JusticeMaila,,0,0,0,"Leicester City!!!!!!!",,,,643104661302607872,https://twitter.com/JusticeMaila/status/643104661302607872
2015-09-13 16:51:13,IpswichTownTalk,,0,0,4,"What a comeback from Leicester City! Nathan Dyer going to feel that in the morning! #lcfc",,,#lcfc,643104659771670528,https://twitter.com/IpswichTownTalk/status/643104659771670528
2015-09-13 16:51:13,adambennett23,,0,0,0,"Awesome game #astonvilla #LeicesterCity ....",,,#astonvilla #LeicesterCity,643104659540967424,https://twitter.com/adambennett23/status/643104659540967424
2015-09-13 16:51:13,henryilnicky,,0,0,0,"Extraordinary finish at Leicester City. What a game",,,,643104659473858560,https://twitter.com/henryilnicky/status/643104659473858560
2015-09-13 16:51:13,_SHUKRI_,,0,0,0,"OMG LEICESTER CITY 3-2",,,,643104658680995840,https://twitter.com/_SHUKRI_/status/643104658680995840
2015-09-13 16:51:13,m_c_a_l_,,0,0,0,"Wow, Leicester City!!!! Still unbeaten",,,,643104656835526656,https://twitter.com/m_c_a_l_/status/643104656835526656
2015-09-13 16:51:11,AdamFryettt,,0,0,0,"A big Well Done to Leicester City @LCFC",,@LCFC,,643104648421883904,https://twitter.com/AdamFryettt/status/643104648421883904
2015-09-13 16:51:09,WhoBut_TOS,,0,0,0,"Wow - this Leicester City | Aston Villa game is another example of why the EPL is the best league in the world. What a match.",,,,643104639525736448,https://twitter.com/WhoBut_TOS/status/643104639525736448
