date,username,to,replies,retweets,favorites,text,geo,mentions,hashtags,id,permalink
2015-09-13 16:59:59,StingHP,,0,0,0,"What a come back from Leicester City over Aston Villa. Villa had some gorgeous goals as well.",,,,643106863161188352,https://twitter.com/StingHP/status/643106863161188352
2015-09-13 16:59:58,P47J_,,1,0,0,"Need to hit a Northampton town match & a Leicester City game",,,,643106860703313920,https://twitter.com/P47J_/status/643106860703313920
2015-09-13 16:59:57,OhEdenHazard,,1,1,1,"Leicester City vs Aston Villa is more entertaining than La Liga. Fact.",,,,643106855015706624,https://twitter.com/OhEdenHazard/status/643106855015706624
2015-09-13 16:59:57,kbone_,,0,0,0,"Nice one leicester city,this kinda game needed for entertainment.",,,,643106854017626112,https://twitter.com/kbone_/status/643106854017626112
2015-09-13 16:59:55,CFC_ManiacUK,,0,0,0,"From 2-0 down Now, leading 3-2 Leicester City are in 2nd place now",,,,643106848183349249,https://twitter.com/CFC_ManiacUK/status/643106848183349249
2015-09-13 16:59:55,TD_LFC,,0,0,0,"Leicester City take a bow #LEI",,,#LEI,643106847503708160,https://twitter.com/TD_LFC/status/643106847503708160
2015-09-13 16:59:55,I_am_cage,,0,0,0,"What a beautiful game of football ... Leicester City plays some entertaining brand of the game. WOW !!!",,,,643106846107148288,https://twitter.com/I_am_cage/status/643106846107148288
2015-09-13 16:59:53,ChibuzoUjam,,0,2,1,"Leicester city have shown great character in the premier league, better than Chelsea, Liverpool and Tottenham put together.",,,,643106840683905025,https://twitter.com/ChibuzoUjam/status/643106840683905025
2015-09-13 16:59:53,shuethots,,0,0,2,"Leicester city wow what a match",,,,643106840335638529,https://twitter.com/shuethots/status/643106840335638529
2015-09-13 16:59:52,reedaflokka,,0,0,0,"Leicester city is on fucking fire",,,,643106834275037184,https://twitter.com/reedaflokka/status/643106834275037184
2015-09-13 16:59:50,f1lover75,,0,0,1,"Leicester City still unbeatable...Interesting that.",,,,643106827790589952,https://twitter.com/f1lover75/status/643106827790589952
2015-09-13 16:59:48,AlexBalano,,0,0,0,"This has been such a good start to the Barclays Premier League. Leicester City coming back to win over Aston Villa. This is football.",,,,643106819980681216,https://twitter.com/AlexBalano/status/643106819980681216
2015-09-13 16:59:48,NellyAliyu,,0,0,0,"Typos *Leicester city",,,,643106818798034945,https://twitter.com/NellyAliyu/status/643106818798034945
2015-09-13 16:59:47,rcatanese,,0,2,1,"Leicester City up 7 points on Chelsea right now but I'm #bpl",,,#bpl,643106814066724864,https://twitter.com/rcatanese/status/643106814066724864
2015-09-13 16:59:46,RudianC,,0,0,0,"#LeicesterCity reminds of a @LFC team of yesteryear where 2-0 down you know they'll fight and come out victorious after 90min #BPL #LEIAVL",,@LFC,#LeicesterCity #BPL #LEIAVL,643106810744991744,https://twitter.com/RudianC/status/643106810744991744
2015-09-13 16:59:46,shafiARS,,0,0,0,"Incredible stuff from Leicester City! http://fb.me/4xj36ljci",,,,643106809985675264,https://twitter.com/shafiARS/status/643106809985675264
2015-09-13 16:59:46,Sugiroud,,1,0,0,"Wow Leicester City",,,,643106808458969088,https://twitter.com/Sugiroud/status/643106808458969088
2015-09-13 16:59:42,ESEL23,,0,0,0,"Amazing Leicester City!!! #leicestercity #premierleague #amazing",,,#leicestercity #premierleague #amazing,643106794844352513,https://twitter.com/ESEL23/status/643106794844352513
2015-09-13 16:59:41,nadya_annette,,0,0,0,"RESPECT #leicestercity",,,#leicestercity,643106791081967616,https://twitter.com/nadya_annette/status/643106791081967616
2015-09-13 16:59:40,dylanfermin,,0,0,0,"That Leicester city game was amazing that's why the EPL is the best league",,,,643106782903201792,https://twitter.com/dylanfermin/status/643106782903201792
2015-09-13 16:59:38,CoachLuwi,,0,0,0,"It won't be easy playing at Leicester City this season...",,,,643106778079739905,https://twitter.com/CoachLuwi/status/643106778079739905
2015-09-13 16:59:38,PyrroleSindelo,,0,0,1,"Leicester City survived the drop last season and now they are just flexing.......",,,,643106776678723584,https://twitter.com/PyrroleSindelo/status/643106776678723584
2015-09-13 16:59:36,TomBlaze,,0,0,0,"Look at Leicester city flourishing",,,,643106768118239233,https://twitter.com/TomBlaze/status/643106768118239233
2015-09-13 16:59:35,DaveOCKOP,,13,91,119,"Look at the way Leicester City fought today compared to Liverpool. It's not much to ask for Brendan. #LFC",,,#LFC,643106764712505345,https://twitter.com/DaveOCKOP/status/643106764712505345
2015-09-13 16:59:31,catalanfan,,0,0,0,"leicester city is now in second of the table four points behind leaders #MCFC #BPL",,,#MCFC #BPL,643106748631416832,https://twitter.com/catalanfan/status/643106748631416832
2015-09-13 16:59:29,olusanjofaro,,0,0,0,"What a day for Leicester city, great work 4rm Mahrez",,,,643106738615545860,https://twitter.com/olusanjofaro/status/643106738615545860
2015-09-13 16:59:27,sportingindex,,0,0,0,"What a game of football! Comeback complete. FT: #LeicesterCity 3 #AstonVilla 2pic.twitter.com/eF771xpG8h",,,#LeicesterCity #AstonVilla,643106732084985856,https://twitter.com/sportingindex/status/643106732084985856
2015-09-13 16:59:27,lukereddevil7,,0,0,0,"Leicester City produce a stunning comeback against Midlands rivals Aston Villa to go second. Wonderful. #foxesneverdie #LEIAVL",,,#foxesneverdie #LEIAVL,643106732047224832,https://twitter.com/lukereddevil7/status/643106732047224832
2015-09-13 16:59:27,_Shall17_,,0,0,0,"Perfect comeback from @LCFC. Congratulation Leicester City ! #LeiAst",,@LCFC,#LeiAst,643106730251948032,https://twitter.com/_Shall17_/status/643106730251948032
2015-09-13 16:59:26,TimmyWill,,0,0,0,"Super Blues ! What a performance Leicester City to beat Villa #foxtastic",,,#foxtastic,643106725638348801,https://twitter.com/TimmyWill/status/643106725638348801
2015-09-13 16:59:26,BenWasley1,,0,0,0,"Did that just happen Leicester City FC",,,,643106724489117696,https://twitter.com/BenWasley1/status/643106724489117696
2015-09-13 16:59:24,varadmehta,,0,0,0,"That was some finish to the end of the Leicester City vs. Aston Villa game. Crazy comeback by the Foxes!",,,,643106716121329664,https://twitter.com/varadmehta/status/643106716121329664
2015-09-13 16:59:23,katiemorgan35,,0,0,0,"[EPL] ASTON VILLA @LEICESTER CITY, Final: 2 - 3 (via http://thesco.re/theScore_app ) awesome win @LCFCpic.twitter.com/QBro9jNqYo",,@LEICESTER @LCFCpic,,643106715345420289,https://twitter.com/katiemorgan35/status/643106715345420289
2015-09-13 16:59:22,nativetxdude,,0,0,0,"Just watched fantastic English Premier soccer game: Leicester City beat Aston Villa 3-2. Don't know anything about the teams but great match",,,,643106709091717120,https://twitter.com/nativetxdude/status/643106709091717120
2015-09-13 16:59:22,RogerGatsinzi,,0,0,0,"Hats off to Leicester City. Showed character to come back and win 3-2. #TheFoxes #WhatAturnAround",,,#TheFoxes #WhatAturnAround,643106707250520064,https://twitter.com/RogerGatsinzi/status/643106707250520064
2015-09-13 16:59:21,PredictTheSix,,0,0,0,"FT: Leicester City 3 - 2 Aston Villa Not many will have had Dyer on their bet-slips but he's scored a late winner pic.twitter.com/T3DSydj96E",,,,643106705547640832,https://twitter.com/PredictTheSix/status/643106705547640832
2015-09-13 16:59:21,CFC7162,,0,0,1,"Wish Celtic would put haft the effort in that Leicester City did",,,,643106704452898821,https://twitter.com/CFC7162/status/643106704452898821
2015-09-13 16:59:19,CodyMaggard10,,0,0,1,"Leicester City are winning the Premier League.",,,,643106697817493504,https://twitter.com/CodyMaggard10/status/643106697817493504
2015-09-13 16:59:19,Olamansur,,0,0,0,"Leicester city.",,,,643106695040925697,https://twitter.com/Olamansur/status/643106695040925697
2015-09-13 16:59:18,TimnasGarudaIDN,,0,2,0,"FT: Leicester City (3-2) Aston Villa || Gol: De Laet 72', Vardy 82', Dyer 88' - Grealish 39', Gil 63' || #BPLpic.twitter.com/G7b0IEVdPs",,,#BPLpic,643106694562643968,https://twitter.com/TimnasGarudaIDN/status/643106694562643968
2015-09-13 16:59:18,kimarley97,,0,0,0,"Oh My...What a game!! What a performance by #TheFoxes #LeicesterCity",,,#TheFoxes #LeicesterCity,643106692717121536,https://twitter.com/kimarley97/status/643106692717121536
2015-09-13 16:59:17,sncksoul,,0,0,0,"Leicester City are just a joy to watch",,,,643106688187371521,https://twitter.com/sncksoul/status/643106688187371521
2015-09-13 16:59:16,Perry_Hayward,,0,0,0,"What a result for Leicester City F.C. 0-2 down and come back to win 3-2 #Football #FOOTBALLSUNDAY",,,#Football #FOOTBALLSUNDAY,643106685591101440,https://twitter.com/Perry_Hayward/status/643106685591101440
2015-09-13 16:59:16,DavidPalman,,0,0,0,"Leicester City!! #comebackkings #Dyer #Southamptonacademy #letsalllaughatSherwood",,,#comebackkings #Dyer #Southamptonacademy #letsalllaughatSherwood,643106682718023680,https://twitter.com/DavidPalman/status/643106682718023680
2015-09-13 16:59:15,deerudds,,0,0,0,"Leicester City",,,,643106679937216513,https://twitter.com/deerudds/status/643106679937216513
2015-09-13 16:59:15,Mergice,,0,0,0,"Leicester City is really on form",,,,643106679316447232,https://twitter.com/Mergice/status/643106679316447232
2015-09-13 16:59:15,badt_igboboy,,0,1,0,"Watch out for Leicester City this season yo!...and pls remember this tweet!!.",,,,643106678272098305,https://twitter.com/badt_igboboy/status/643106678272098305
2015-09-13 16:59:14,ZEAL_01,,0,1,0,"U like wahala oooo "" @Dr_Yazzy: If this Leicester City catch Chelsea tho!""",,@Dr_Yazzy,,643106676703371264,https://twitter.com/ZEAL_01/status/643106676703371264
2015-09-13 16:59:14,goodridge_john,,0,0,0,"Brilliant second half!! #LeicesterCity",,,#LeicesterCity,643106674568470529,https://twitter.com/goodridge_john/status/643106674568470529
2015-09-13 16:59:13,Benah254,,0,0,0,"Last season 5 games.. Bottom of the table... This season 5 games they are no 2 Hahaha congrats Leicester city #LeiAst #BPL",,,#LeiAst #BPL,643106670776832000,https://twitter.com/Benah254/status/643106670776832000
2015-09-13 16:59:12,SSnetwoork,,0,1,0,"We forget how Technology gave Leicester City this victory..... Richie De Laet 1-2 Video Technology is crucial",,,,643106667551453185,https://twitter.com/SSnetwoork/status/643106667551453185
2015-09-13 16:59:11,davemcnair16,,0,0,1,"What a game, love watching Leicester, the energy of Mahrez and Vardy in particular is outstanding #LeicesterCity",,,#LeicesterCity,643106664686727168,https://twitter.com/davemcnair16/status/643106664686727168
2015-09-13 16:59:10,theflyinglankan,,0,0,0,"Leicester city are in red hot form this season... what a comeback!!! #RiyadMahrez the best of the season so far... #LeiAvl",,,#RiyadMahrez #LeiAvl,643106660295118848,https://twitter.com/theflyinglankan/status/643106660295118848
2015-09-13 16:59:10,beINSPORTSid,,0,3,1,"What a comeback from The Foxes! Leicester City kembali menempel Manchester City di papan klasmen FT: Leicester 3-2 Aston Villa #LEIAVL #BPL",,,#LEIAVL #BPL,643106659615703041,https://twitter.com/beINSPORTSid/status/643106659615703041
2015-09-13 16:59:10,KamelTabbara,,1,5,2,"Chelsea 17th & Leicester City 2nd. #EPL",,,#EPL,643106658994946048,https://twitter.com/KamelTabbara/status/643106658994946048
2015-09-13 16:59:08,CockneyWelsh,,0,0,0,"Leicester City 2nd in the table. The footballing world really has gone mad",,,,643106650484789248,https://twitter.com/CockneyWelsh/status/643106650484789248
2015-09-13 16:59:07,iamOkon,,0,0,0,"FT: Leicester City 3-2 Aston Villa. Breathe taking display at the King Power stadium. #EPL",,,#EPL,643106648320540672,https://twitter.com/iamOkon/status/643106648320540672
2015-09-13 16:59:07,MilanKore,,0,0,0,"Leicester City and their mad fighting spirit. Still unbeaten in the EPL.",,,,643106648245071873,https://twitter.com/MilanKore/status/643106648245071873
2015-09-13 16:59:07,danroberts92,,0,0,0,"Just a shame I'm not a Leicester City fan.",,,,643106646110130176,https://twitter.com/danroberts92/status/643106646110130176
2015-09-13 16:59:07,THEREALMOGUL,,0,0,0,"Leicester City the true definition of strong character.",,,,643106644478566400,https://twitter.com/THEREALMOGUL/status/643106644478566400
2015-09-13 16:59:06,jmuntd,,0,0,0,"There's no way the Bears game is going 2 be better then what I just watched That was one hell of a game from Leicester City. Mahrez is GOAT.",,,,643106642595315712,https://twitter.com/jmuntd/status/643106642595315712
2015-09-13 16:59:05,thevaym,,0,0,0,"Leicester City are like this season's Southampton",,,,643106638593966081,https://twitter.com/thevaym/status/643106638593966081
2015-09-13 16:59:05,pikcherbaaz,,0,0,0,"Leicester City - The Southampton of this season. What a brilliant football match. Maharez is a treat to watch.... http://fb.me/7NF99WrmK",,,,643106637465567233,https://twitter.com/pikcherbaaz/status/643106637465567233
2015-09-13 16:59:05,Kalo_Trezegol18,,0,0,0,"Leicester City Football Club FT: #lcfc3-2 #avfc- A quite stunning second half comeback sees the Foxes move into... http://fb.me/4dj6tRfXr",,,#lcfc3 #avfc,643106637436321792,https://twitter.com/Kalo_Trezegol18/status/643106637436321792
2015-09-13 16:59:04,Phaka_T,,1,0,0,"Leicester City is just another Southampton - they'll finish 6th on the table.",,,,643106635712475136,https://twitter.com/Phaka_T/status/643106635712475136
2015-09-13 16:59:04,kesterRozay,,0,0,0,"I have to say I had my doubts about Ranieri but the guy is truly doing wonders with his Leicester city side",,,,643106632545796096,https://twitter.com/kesterRozay/status/643106632545796096
2015-09-13 16:59:04,Garry_ken,,0,0,0,"Leicester City tho . One team to beat in the EPL . Absolutely brilliant ..",,,,643106632084389888,https://twitter.com/Garry_ken/status/643106632084389888
2015-09-13 16:59:00,Juann_ak,,0,0,0,"That Leicester City vs Aston Villa game was nice af",,,,643106619031552000,https://twitter.com/Juann_ak/status/643106619031552000
2015-09-13 16:58:59,FreshFredy,,0,0,0,"LEICESTER CITY. Eeeiiiisshhhhh",,,,643106613453127680,https://twitter.com/FreshFredy/status/643106613453127680
2015-09-13 16:58:58,Tegovic,,0,0,0,"Im thinking of supporting Leicester city now , at least they have a manager",,,,643106610475347968,https://twitter.com/Tegovic/status/643106610475347968
2015-09-13 16:58:58,moby_98,,0,0,0,"Leicester City for Premier League",,,,643106608818581504,https://twitter.com/moby_98/status/643106608818581504
2015-09-13 16:58:58,rayvind_,,0,0,0,"I'll tell you who has character, Leicester City!",,,,643106608638091264,https://twitter.com/rayvind_/status/643106608638091264
2015-09-13 16:58:57,moniz35,,1,1,0,"Leicester City. 2 nil down. 3-2 up. 3 points. Total madness.",,,,643106603277905921,https://twitter.com/moniz35/status/643106603277905921
2015-09-13 16:58:55,Kayode_OG,,0,2,0,"Wow! Leicester city fire!!",,,,643106595526807552,https://twitter.com/Kayode_OG/status/643106595526807552
2015-09-13 16:58:55,danroberts92,,0,0,0,"It's a good day to be a Leicester City fan!",,,,643106594708955136,https://twitter.com/danroberts92/status/643106594708955136
2015-09-13 16:58:54,ffc2004,,1,1,0,"Leicester City, you fucking beauties.",,,,643106593232584704,https://twitter.com/ffc2004/status/643106593232584704
2015-09-13 16:58:54,_adamcampbell9,,0,0,0,"Leicester City, champions league this year haha #lcfc",,,#lcfc,643106590539816960,https://twitter.com/_adamcampbell9/status/643106590539816960
2015-09-13 16:58:53,Malbannaii,,0,0,0,"LEICESTER CITY ALWAYS",,,,643106586932736000,https://twitter.com/Malbannaii/status/643106586932736000
2015-09-13 16:58:51,DarrenTysWhite,,0,1,0,"The tinkerman 2nd #LeicesterCity #astonvilla I thought Villa had the 3 points. The strongest PL for some time",,,#LeicesterCity #astonvilla,643106577852055552,https://twitter.com/DarrenTysWhite/status/643106577852055552
2015-09-13 16:58:49,jess_beauty537,,0,0,0,"Leicester City..... What a come back #LCFC",,,#LCFC,643106572290392064,https://twitter.com/jess_beauty537/status/643106572290392064
2015-09-13 16:58:48,FootballVideos,,2,99,117,"What a game. What a comeback. Well done Leicester City!",,,,643106567521480705,https://twitter.com/FootballVideos/status/643106567521480705
2015-09-13 16:58:46,latambolshie,,0,0,0,"I see you Leicester City... Oo",,,,643106559007047680,https://twitter.com/latambolshie/status/643106559007047680
2015-09-13 16:58:43,redian_85310,,0,0,0,"Said at the start of the season that Leicester City will be the dark horse's!",,,,643106544251502592,https://twitter.com/redian_85310/status/643106544251502592
2015-09-13 16:58:42,simonsaccar,,0,0,0,"Congratulations to Claudio Ranieri's High flying Leicester City..what a comeback still #unbeaten #bpl #SuperSunday",,,#unbeaten #bpl #SuperSunday,643106542330486784,https://twitter.com/simonsaccar/status/643106542330486784
2015-09-13 16:58:42,AndySportNews,,0,0,0,"#PremierLeague finale #LeicesterCity - #astonvilla 3-2 @FOXSportsIT",,@FOXSportsIT,#PremierLeague #LeicesterCity #astonvilla,643106542309482496,https://twitter.com/AndySportNews/status/643106542309482496
2015-09-13 16:58:42,TheBestValkyrie,,0,0,0,"Speechless liat Leicester city....",,,,643106540782678016,https://twitter.com/TheBestValkyrie/status/643106540782678016
2015-09-13 16:58:41,mhliverpool,,0,0,0,"Well done Leicester City bt Villa 3-2 after being 2 nil down",,,,643106538819858433,https://twitter.com/mhliverpool/status/643106538819858433
2015-09-13 16:58:41,Aidan187,,0,0,0,"Leicester City are the real deal #tinkerman",,,#tinkerman,643106538744356864,https://twitter.com/Aidan187/status/643106538744356864
2015-09-13 16:58:40,seriousullash,,0,0,0,"Cunning as a fox #LeicesterCity",,,#LeicesterCity,643106532041687040,https://twitter.com/seriousullash/status/643106532041687040
2015-09-13 16:58:40,crackfriends,,0,1,0,"Leicester city really #2 in the league, Leicester fucking city. **sobbing in chelsea football club**",,,#2,643106531882475520,https://twitter.com/crackfriends/status/643106531882475520
2015-09-13 16:58:39,tiago_rafa31,,0,0,1,"JAMIE VARDY GOAL l Leicester City vs Aston Villa 2-2 13 09 2015: http://youtu.be/b-ObMNkhBeY?a via @YouTube",,@YouTube,,643106530267660288,https://twitter.com/tiago_rafa31/status/643106530267660288
2015-09-13 16:58:38,DaveOCKOP,,2,23,28,"Riyad Mahrez cost Leicester City £400,000. He could go for 100 times that if his form continues like this. What a signing.",,,,643106525838450688,https://twitter.com/DaveOCKOP/status/643106525838450688
2015-09-13 16:58:38,FtbPlease,,0,0,0,"#RISULTATO #FINALE Leicester City Football Club - Aston Villa FC - Official 3-2 ( 39' #Grealish [asv], 63' #Gil... http://fb.me/4ntuRBh28",,,#RISULTATO #FINALE #Grealish #Gil,643106525188390912,https://twitter.com/FtbPlease/status/643106525188390912
2015-09-13 16:58:38,beckym96,,0,0,0,"3-2 up from being 2-0! That's how we do it! Leicester City you little beauty #upthefoxes",,,#upthefoxes,643106522889891840,https://twitter.com/beckym96/status/643106522889891840
2015-09-13 16:58:36,PeterSmitGary,ManUtd,0,0,0,"@ManUtd Just pass the DVD of Leicester City vs Aston Villa to the Clueless One. This is Premier League and that's how we play football.",,@ManUtd,,643106518145961984,https://twitter.com/PeterSmitGary/status/643106518145961984
2015-09-13 16:58:36,Viraaj_,,0,0,8,"Leicester city!!! #3-2",,,#3,643106516187357184,https://twitter.com/Viraaj_/status/643106516187357184
2015-09-13 16:58:35,barkley_sparkly,,0,0,0,"In this form Leicester city can beat us easily by 3-0 ! #Justsayin #CFC #LEC",,,#Justsayin #CFC #LEC,643106512047505408,https://twitter.com/barkley_sparkly/status/643106512047505408
2015-09-13 16:58:34,Darius9T,marthakabibii,0,2,1,"Absolutely, Leicester city are monsters. https://twitter.com/marthakabibii/status/643105975155707904 …",,,,643106509036101632,https://twitter.com/Darius9T/status/643106509036101632
2015-09-13 16:58:33,vanwynkle,,0,0,0,"Man this Leicester city is in some mean form",,,,643106502329274369,https://twitter.com/vanwynkle/status/643106502329274369
2015-09-13 16:58:31,el_pherooq,,0,1,0,"Leicester City WILL Win the League!!!",,,,643106495698214914,https://twitter.com/el_pherooq/status/643106495698214914
2015-09-13 16:58:29,LOggers109,,0,0,0,"Stuck in work but had the footy on & that was a bloody great game, well done Leicester City!!!!",,,,643106485980004352,https://twitter.com/LOggers109/status/643106485980004352
2015-09-13 16:58:28,adefowope14,,0,0,0,"FULL TIME: Leicester City 3-2 Aston Villa",,,,643106481924128768,https://twitter.com/adefowope14/status/643106481924128768
2015-09-13 16:58:26,colinsalmon24,,1,0,8,"Leicester City v Aston Villa a proper local derby. That's football my friends,total commitment.",,,,643106475406163968,https://twitter.com/colinsalmon24/status/643106475406163968
2015-09-13 16:58:26,GRElZMANN,,0,0,0,"Leicester city to win the league",,,,643106475276013568,https://twitter.com/GRElZMANN/status/643106475276013568
2015-09-13 16:58:26,SportPaparazzi1,,0,0,0,"Wah a come back by Leicester City....good team spirit..",,,,643106475112595456,https://twitter.com/SportPaparazzi1/status/643106475112595456
2015-09-13 16:58:26,VeronicaTitley,,0,0,0,"How do you celebrate such an amazing come back, oh yes we love you #LeicesterCity without over gloating as one son supports the Villa!!",,,#LeicesterCity,643106474869288961,https://twitter.com/VeronicaTitley/status/643106474869288961
2015-09-13 16:58:26,waqasyousafzai1,,0,0,0,"Mahrez, the new Arjen Robben? The team that inspired me most, Leicester City FC. Yet another comeback! !",,,,643106473678118912,https://twitter.com/waqasyousafzai1/status/643106473678118912
2015-09-13 16:58:25,malathp,,0,0,0,"Leicester City 3-2 A. Villa. This defeat will hunt villa all season long. Mark my words. What a come back! #bbcfootball",,,#bbcfootball,643106471849275392,https://twitter.com/malathp/status/643106471849275392
2015-09-13 16:58:25,FemiCoolfm,,2,3,1,"Breathtaking come back led by Mahrez, Vardy and Dyer Leicester City 3-2 Aston Villa.",,,,643106471392186368,https://twitter.com/FemiCoolfm/status/643106471392186368
2015-09-13 16:58:25,lauramhamill,,1,0,0,"Great result for Leicester City",,,,643106469118742528,https://twitter.com/lauramhamill/status/643106469118742528
2015-09-13 16:58:23,Ritzkyekaputra,,0,1,0,"Big applause for Leicester City and especially for Riyad Mahrez",,,,643106463712284672,https://twitter.com/Ritzkyekaputra/status/643106463712284672
2015-09-13 16:58:23,stevieeallen,,0,0,1,"Leicester City #lcfc",,,#lcfc,643106460243771392,https://twitter.com/stevieeallen/status/643106460243771392
2015-09-13 16:58:22,Nobby_Norris,,0,0,0,"Well if you want to see a great advert for the #PremierLeague look no further than #LeicesterCity v #astonvilla - what a game! Full credit!",,,#PremierLeague #LeicesterCity #astonvilla,643106459719442432,https://twitter.com/Nobby_Norris/status/643106459719442432
2015-09-13 16:58:21,boncherinoooo,,0,0,0,"Wow Leicester City has a squad to be reckoned with this season",,,,643106454178693120,https://twitter.com/boncherinoooo/status/643106454178693120
2015-09-13 16:58:20,Teb0707,,0,0,0,"Leicester City is a young team buh they play like a top class football club...",,,,643106451196641280,https://twitter.com/Teb0707/status/643106451196641280
2015-09-13 16:58:20,_Khali95,,0,0,0,"Second on the EPL table: Leicester City. What a turnaround",,,,643106450273923072,https://twitter.com/_Khali95/status/643106450273923072
2015-09-13 16:58:20,ChrisM_25,,0,0,0,"It's a fucking sad day when Leicester City are better than us!",,,,643106448390639616,https://twitter.com/ChrisM_25/status/643106448390639616
2015-09-13 16:58:19,bonoswagg,,0,0,0,"The Premier League is still an exciting league. What a comeback by Leicester City.",,,,643106446230585344,https://twitter.com/bonoswagg/status/643106446230585344
2015-09-13 16:58:16,dhan4batman,,0,0,0,"Leicester city cool as a cucumber",,,,643106434222129152,https://twitter.com/dhan4batman/status/643106434222129152
2015-09-13 16:58:16,jdelahozz,,0,0,0,"Leicester City though",,,,643106433739964416,https://twitter.com/jdelahozz/status/643106433739964416
2015-09-13 16:58:16,MRTomexy,,0,0,0,"What a performance from leicester city",,,,643106431584075776,https://twitter.com/MRTomexy/status/643106431584075776
2015-09-13 16:58:16,REMEMBERTHE96,,0,0,0,"And got their reward. Well played #LeicesterCity and we'll played #LeicesterCity fans",,,#LeicesterCity #LeicesterCity,643106430795546624,https://twitter.com/REMEMBERTHE96/status/643106430795546624
2015-09-13 16:58:15,__dacr,,0,0,0,"The best league is the Premier league, Leicester City were losing 2-0 to Aston Villa and in 20 min they turned the game around and won 3-2",,,,643106428257865728,https://twitter.com/__dacr/status/643106428257865728
2015-09-13 16:58:14,Beastboxer420,,0,0,1,"What a match between Aston villa and Leicester City. I predicted Leicester would win and they came from 2-0 to win 2-3 #BPL #LCFC #AVFC",,,#BPL #LCFC #AVFC,643106425653346304,https://twitter.com/Beastboxer420/status/643106425653346304
2015-09-13 16:58:13,LowRah_18,,1,0,0,"I have chills! #LeicesterCity #respect",,,#LeicesterCity #respect,643106420985069568,https://twitter.com/LowRah_18/status/643106420985069568
2015-09-13 16:58:13,philmcnulty,,7,53,31,"Leicester City fans understandably ecstatic at 2nd. place - Villa fans silenced after watching their team simply blown away.",,,,643106418544001026,https://twitter.com/philmcnulty/status/643106418544001026
2015-09-13 16:58:11,kel_izzledizzle,,0,0,0,"The noise at the nPower stadium would deafen a deaf man.. Leicester city really doing the incredible. #welldone #LCFC",,,#welldone #LCFC,643106410729897985,https://twitter.com/kel_izzledizzle/status/643106410729897985
2015-09-13 16:58:10,dmagallanes289,maciel1796,0,0,1,"@maciel1796 you should of seen the Aston villa and Leicester city game. Aston villa were up 2-0 and Leicester city beat them3-2",,@maciel1796,,643106407110328320,https://twitter.com/dmagallanes289/status/643106407110328320
